"more","Generic message that lets you view more. Appears on the left-hand side of https://lichess.org/people, which lets you view a list of connected players. Also appears on the activity timeline on the left-hand side of the ""Play"" page (https://lichess.org/) if there are too many messages in the timeline. ""More"" may be used in other places around Lichess in the future, so please make your translation as generic as possible.","More","Pli"
"memberSince","Tells how long the player has been a member of lichess. Appears on profile pages. For example, https://lichess.org/@/thibault has been a member since 2010-11-22.","Member since","Membro ekde"
"lastSeenActive","The last time a player was seen on the site; %s is a duration. Appears on profile pages. Example: https://lichess.org/@/thibault — ""Active 4 minutes ago"" (as of the time of writing).","Active %s","Lasta ensaluto %s"
"challengeToPlay","Clicking this lets you ask the player to play a game with you, and takes you to the game set-up view. Appears on profile pages and popups over player names as a mouseover text for the crossed swords symbol. Please translate ""Challenge"" as a verb if possible. Example. https://lichess.org/@/thibault.","Challenge to a game","Defii al nova ludo"
"player","Clicking on this lets you sort the list of games by player names. Appears as a column heading in the list of open games on the ""Play"" page (https://lichess.org/).","Player","Ludanto"
"list","This is one of the two ways of sorting open games on the ""Play"" page (https://lichess.org/). Clicking it presents all games you can join in a list format.","List","Listo"
"graph","This is one of the two ways of sorting open games on the ""Play"" page (https://lichess.org/). Clicking it presents all games you can join on a graph, with x (time) and y (player rating) axes.","Graph","Grafo"
"lessThanNbMinutes","%s is the number of minutes. Ticking this checkbox means that games that last less than 3 minutes will show up in the list of games. The sentence appears in the ""Filter games"" menu, which can be accessed through the ""Play"" page (https://lichess.org).","Less than %s minutes","Malpli ol %s minutoj"
"xToYMinutes","%s, in both cases, is the number of minutes. Ticking this checkbox means that games that last certain predefined amounts (e.g. Blitz is 3 to 8 minutes) will show up in the list of games. The sentence appears in the ""Filter games"" menu, which can be accessed through the ""Play"" page (https://lichess.org).","%s to %s minutes","de %s ĝis %s minutoj"
"textIsTooShort","Error message that indicates the text put in the form is too short. Appears in forms around the site of all kinds, including registration and team creation.","Text is too short.","Teksto estas tro mallonga."
"textIsTooLong","Error message that indicates the text put in the form is too long. Appears in forms around the site of all kinds, including registration and team creation.","Text is too long.","Teksto estas tro longa."
"required","Error message that indicates that some required text fields in the form were not filled in. Appears in forms around the site of all kinds, including registration and team creation.","Required.","Necesa."
"openTournaments","""Open"" here means you can join the tournament. Below it is a list of tournaments you are able to join. Appears as a heading on https://lichess.org/tournament and also on the ""Play"" page (https://lichess.org/)","Open tournaments","Enireblaj turniroj"
"duration","Length of the tournament in minutes. Appears on the left-hand side box on the pages of tournaments. Example: https://lichess.org/tournament/67hj23c2","Duration","Daŭro"
"winner","Indicates the player won the tournament. This is the mouseover text of the trophy icon on tournaments pages. Example: https://lichess.org/tournament/67hj23c2","Winner","Venkinto"
"standing","Shows the order of the players in a tournament, ordered by their score. Could be translated as ""position"" or ""score"" if your language has no equivalent. Appears in the left-most column on the pages of individual tournaments. Example: https://lichess.org/tournament/67hj23c2","Standing","Pozicio"
"createANewTournament","Clicking this lets you create a new tournament. Appears as a heading and a button on the tournament creation page, among other places. Links to https://lichess.org/tournament/new.","Create a new tournament","Krei novan turniron"
"join","Clicking this lets you enter the tournament. This button is found on the ""Play"" (https://lichess.org) and ""Tournaments"" (https://lichess.org/tournament) pages.","Join","Aliĝi"
"withdraw","Clicking this makes you withdraw from (leave) the tournament you have entered. Appears on the tournament page after you have entered it.","Withdraw","Eliri"
"points","The number of points the player has attained in this tournament. Appears as a column heading on tournament pages. Example: https://lichess.org/tournament/67hj23c2","Points","Poentoj"
"wins","The number of games the player has won in this tournament. Appears as a column heading on tournament pages. Example: https://lichess.org/tournament/67hj23c2","Wins","Venkoj"
"losses","The number of games the player has lost in this tournament. Appears as a column heading on tournament pages. Example: https://lichess.org/tournament/67hj23c2","Losses","Malvenkoj"
"winStreak","The number of games the player won consecutively without losing. Appears as a column heading on tournament pages. Example: https://lichess.org/tournament/67hj23c2 — Thibault won all 6 games in a row, jordach 3 and graphitemaster 2.","Win streak","Venka serio"
"createdBy","This appears in a box on the top-left hand corner of tournament pages. The sentence is followed by the name of the player that created it. Example: https://lichess.org/tournament/gwlomxqd — ""Created by thibault"".","Created by","Kreita de"
"tournamentIsStarting","Appears as a pop-up when the tournament you have joined is about to start.","The tournament is starting","Turniro komenciĝas"
"membersOnly","Ticking this checkbox makes the game so only lichess members can join it. Appears in the game creation menu (https://lichess.org/setup/hook).","Members only","Nur membroj"
"boardEditor","The board editor lets you prepare a chess board and play from the position you set up. Appears as a heading on the editor page, and also as a tab in the ""Games"" pages. Links to https://lichess.org/editor","Board editor","Tabulredaktilo"
"startPosition","Clicking this resets the state of the board to the starting position in standard chess. Being a board editor feature, it appears on the board editor's page — https://lichess.org/editor","Starting position","Komenca aranĝo"
"clearBoard","Clicking this removes all the pieces from the chess board you are setting up. Being a board editor feature, it appears on the board editor's page — https://lichess.org/editor","Clear board","Malplenigi tabulon"
"savePosition","This sentence is not currently used on the site, but feel free to translate it","Save position","Savi aranĝon"
"loadPosition","Clicking this opens a form that lets you paste a FEN text (FEN is a notation system used to store precise positions on a board). Being a board editor feature, it appears on the board editor's page — https://lichess.org/editor","Load position","Ŝargi aranĝon"
"isPrivate","Means the tournament you are looking at is protected with a password. Appears in the information box on the tournament's page. Example: https://lichess.org/tournament/67hj23c2","Private","Privata"
"reportXToModerators","%s is the name of the player. Clicking this will take you to a form where you can report the player for things like cheating and trolling. Appears on player profiles.","Report %s to moderators","Raporti %s al moderatoroj"
"profile","Links to your player profile (account). Appears in the drop-down menu for your name at the navigation bar on the top of every page on lichess.","Profile","Profilo"
"editProfile","Clicking this lets you edit the information about you displayed on your player profile. Appears on your profile page and also as a heading and tab on the preferences configuration pages. Links to https://lichess.org/account/profile","Edit profile","Redakti profilon"
"firstName","Also known as a ""first name"", ""forename"" or even ""Christian name"" in some countries. This sentence appears in the ""Edit profile"" menu (https://lichess.org/account/profile). Translate to whatever best describes this in your language or culture.","Given name","Persona nomo"
"lastName","Also known as ""surname"" or ""family name"". You put in your last name in this field, which will in turn appear on your profile page. This sentence appears in the ""Edit profile"" menu (https://lichess.org/account/profile). Translate to whatever best describes this in your language or culture.","Last name","Familia nomo"
"biography","This is next to a text field where you can write anything you wish to describe yourself. For example, https://lichess.org/@/thibault reads ""I write bugs for lichess.org"". This sentence appears in the ""Edit profile"" menu (https://lichess.org/account/profile).","Biography","Biografio"
"country","This is a field for the country you are located at. Appears on player profiles (example: https://lichess.org/@/thibault). The sentence appears in the ""Edit profile"" menu (https://lichess.org/account/profile).","Country","Lando"
"preferences","Lets you configure lichess so it responds the way you prefer. Appears in the profile drop-down menu at the top of all pages when signed in. Links to https://lichess.org/account/preferences","Preferences","Preferoj"
"watchLichessTV","Clicking this take you to the TV page, where you can watch the current game being aired on lichess TV. Appears on the ""Play"" page (https://lichess.org/) below the miniboard showing the current TV game, as well as appearing as a tab on the ""Games"" pages (https://lichess.org/games). Links to https://lichess.org/tv — the TV page. Please keep this sentence as short as possible.","Watch Lichess TV","Spekti Lichess-TV"
"previouslyOnLichessTV","A list of games that were aired on lichess TV before. Appears as a heading to a box below the board on the TV page (https://lichess.org/tv).","Previously on Lichess TV","Antaŭe ĉe Lichess-TV"
"onlinePlayers","A list of players that are connected right now. Appears as a heading on https://lichess.org/people","Online players","Konektitaj ludantoj"
"activeToday","A list of players ordered by how many games they played today. Appears as a heading on the ""Players"" page (https://lichess.org/people).","Active today","Aktivaj hodiaŭ"
"activePlayers","A list of players ordered by how many games they have played over the last 30 days. Appears as a heading on the ""Players"" page (https://lichess.org/people).","Active players","Aktivaj ludantoj"
"bewareTheGameIsRatedButHasNoClock","Warning message that appears when you are about to join a game of unlimited time. This is only for games created via the ""Play with a friend"" menu (https://lichess.org/setup/friend), as creating public rated games with no time control is not allowed.","Beware, the game is rated but has no clock!","Atentu: la ludo estas taksa, sed ne havas tempolimon!"
"training","A page that offers chess puzzles. These help you improve how you play chess. Could also be translated as ""Practise"" (verb) or a similar word. This appears as one of the links on the navigation bar at the top of every page, so it should be kept as short as possible. Links to https://lichess.org/training","Training","Trejnado"
"yourPuzzleRatingX","%s is your numerical puzzle rating. Appears in a box left of the board on the ""Training"" page (https://lichess.org/training), above the graph.","Your puzzle rating: %s","Via puzla taksado: %s"
"findTheBestMoveForWhite","Informs the player what side they are playing. Appears on the right-hand side of the puzzle trainer, on the ""Training"" page (https://lichess.org/training).","Find the best move for white.","Trovu la plej bonan movon por la blanka ludanto."
"findTheBestMoveForBlack","Informs the player what side they are playing. Appears on the right-hand side of the puzzle trainer, on the ""Training"" page (https://lichess.org/training).","Find the best move for black.","Trovu la plej bonan movon por la nigra ludanto."
"toTrackYourProgress","Encourages the player to register. Below this message is a ""Register"" button. Appears in a box left of the board on the ""Training"" page (https://lichess.org/training) when trying puzzles and not being signed in.","To track your progress:","Por atenti vian progreson:"
"trainingSignupExplanation","Encourages the player to register an account to enjoy Lichess's ""Training"" feature more. Appears below the ""Register"" button when doing chess puzzles without being logged in, in a box left of the board on the ""Training"" page (https://lichess.org/training).","Lichess will provide puzzles that match your ability, making for better training sessions.","Por bona trejnado, Lichess produktos puzlojn, kiuj kongruas kun via kapablo."
"puzzleId","%s is the number of the puzzle. This means the way it appears on the site will be something like ""Puzzle 5705"". Appears on the ""Training"" page (https://lichess.org/training).","Puzzle %s","Puzlo %s"
"puzzleOfTheDay","A random chess puzzle presented on right-hand side the ""Play"" page (https://lichess.org). As the name suggests, there is a different puzzle every day.","Puzzle of the day","Puzlo de la tago"
"clickToSolve","The mouseover text of the chess board for the puzzle of the day on the ""Play"" page (https://lichess.org).","Click to solve","Alklaku por solvi"
"goodMove","Informs the player that they played a good move, but not the best they could make. Appears in a green box on the left-hand side of the ""Training"" page (https://lichess.org/training), in reference to the chess puzzle you are currently playing. Keep your translation short, as a longer sentence (also translatable) just below this one informs them it is not the best move they could play.","Good move","Bona movo"
"butYouCanDoBetter","Informs you that your move was good, but not the best move possible. ""But there is a better move"" is an alternate way to translate this. Appears in a green box left of the board on the ""Training"" page (https://lichess.org/), just below the ""Good move"" sentence. It is used in reference to the chess puzzle you are currently playing.","But you can do better.","Sed eblas pli bona."
"bestMove","Informs the player that the move they just played is the best they could possibly play. Appears in a green box on the left-hand side ""Training"" page (https://lichess.org/training) while playing a puzzle.","Best move!","Plej bona movo!"
"keepGoing","Informs you that the puzzle is not yet finished. Appears just below ""Best move!"" in a green box on the left of the board on the Training page (https://lichess.org/training), after you have made the best possible move.","Keep going…","Daŭrigu..."
"puzzleFailed","Informs you that you lost the puzzle. Appears in a red box left of the board on the Training page (https://lichess.org/training) when you fail the puzzle by making a wrong move. Could also be translated as ""You have failed the puzzle"", if it is short enough and sounds better.","Puzzle failed","Vi malsukcesis"
"butYouCanKeepTrying","Informs you that the fact you failed the puzzle (again) does not mean you have given up. Appears in a red box left of the board on the Training page (https://lichess.org/training) when you are retrying a puzzle you have already failed… and fail it again.","But you can keep trying.","Sed vi rajtas daŭrigi la provon."
"victory","Informs the player that they completed the puzzle successfully. Appears in a green box left of the board on the ""Training"" page (https://lichess.org/training) when you beat a puzzle. Can also be translated as ""Success!"", but we found ""Victory!"" to sound more romantic/heroic.","Victory!","Venko!"
"wasThisPuzzleAnyGood","Poses a question to the user on whether the chess puzzle they just played was good or not. This is intended to entice players to vote, so please be encouraging in tone. This message appears occasionally on the ""Training"" page (https://lichess.org/training), after a player has played several puzzles without voting. An alternate way to phrase this sentence could be ""How did you find this puzzle?"".","Was this puzzle any good?","Ĉu vi ŝatis ĉi tiun puzlon?"
"pleaseVotePuzzle","Inform the player why they should vote, and how to vote. Appears above a box with two buttons that you can use to vote on whether the puzzle was good or bad. This message appears occasionally on the ""Training"" page (https://lichess.org/training), after a player has played several puzzles without voting. You can phrase the first part as ""Improve lichess by voting"", if that helps.","Help lichess improve by voting, using the up or down arrow:","Helpu al Lichess pliboniĝi per voĉdoni, uzante la supren- aŭ suben-sagbutonojn:"
"thankYou","Politely thanks the players for voting. Appears on the ""Training"" page (https://lichess.org/training) after voting for a puzzle. Also, a page thanking all contributors of Lichess. Appears on the footer of the menu page. Links to https://lichess.org/thanks . Please use the polite version of ""Thank you"" in your language.","Thank you!","Dankon!"
"ratingX","%s is the numerical rating and rating deviation for the puzzle. This is the rating of individual chess puzzles in the ""Training"" pages (https://lichess.org/training/5705). Appears on the right-hand side box after you have succeeded at or failed at the puzzle. Note that this is the rating of the puzzle, NOT the player.","Rating: %s","Taksado: %s"
"playedXTimes","%s is the number of times this puzzle has been played. Appears in the box on the right-hand side the ""Training"" page (https://lichess.org/training/) after you have succeeded at or failed the puzzle.","Played %s times","Ludita %s-foje"
"fromGameLink","%s is the name of the game. Appears as a button title at the bottom of the ""Training"" page (https://lichess.org/training/) after you have succeeded or failed at the puzzle.","From game %s","El ludo %s"
"startTraining","Clicking this takes you to a new puzzle. Only happens for links to individual puzzles, e.g. https://lichess.org/training/6958. Appears as a button underneath the box on the right hand side after you have succeeded or failed at the puzzle. ""Training"" should be translated as a verb, or as ""[the process of] training"" for this sentence.","Start training","Komenci trejnadon"
"continueTraining","Clicking this takes you to a new puzzle. Appears as a button underneath the box on the right hand side of the ""Training"" page (https://lichess.org/training/) after you have succeeded or failed at the puzzle. ""Training"" should be translated as a verb, or as ""[the process of] training"" for this sentence.","Continue training","Daŭrigi trejnadon"
"retryThisPuzzle","Clicking this lets you try the same the puzzle again. Appears just below the box on the right-hand side of the ""Training"" page (https://lichess.org/training/) after you have failed the puzzle.","Retry this puzzle","Reprovi ĉi tiun puzlon"
"thisPuzzleIsCorrect","The mouseover text of the upwards-pointing triangle (▴), which is a positive vote (+1) for a puzzle. Appears in the box on the right-hand side of the ""Training"" page (https://lichess.org/training/) after you have succeeded or failed at the puzzle.","This puzzle is correct and interesting","Ĉi tiu puzlo estas ĝusta kaj interesa"
"thisPuzzleIsWrong","The mouseover text of the downwards-pointing triangle (▾), which is a negative (-1) vote for a puzzle. Appears in the box on the right-hand side of the ""Training"" page (https://lichess.org/training/) after you have succeeded or failed at the puzzle.","This puzzle is wrong or boring","Ĉi tiu puzlo estas malĝusta aŭ enuiga"
"youHaveNbSecondsToMakeYourFirstMove","Explains the rule for the pools feature. If you do not play in the first, say, 30 seconds, you automatically resign the game. Appears when playing a game in a pool, such as https://lichess.org/pool/3-0","You have %s seconds to make your first move!","Vi havas %s sekundojn por fari vian unuan movon!"
"nbGamesInPlay","%s is the number of games. Appears below the title of ""lichess.org"" on the ""Play"" page (https://lichess.org). Could be translated as ""%s games being played"".","%s games in play","%s aktivaj ludoj"
"automaticallyProceedToNextGameAfterMoving","Informs the player what the button does. This appears as the mouseover text of ""Auto switch"", a button that appears when you are playing more than one game. See the explanation for ""Auto switch"" for more details.","Automatically proceed to next game after moving","Aŭtomate iri al la sekvanta ludo post movi"
"autoSwitch","Short for ""automatically switch [to the next game]"". A toggleable button that appears below the board when playing multiple games. It makes lichess switch to the next game you are playing automatically for you. When enabled: in correspondence, it cycles through your current games; in simuls, it quickly switches game, focusing on urgent ones. Please keep this as short as possible, as it has an explanatory text that appears when you hover the mouse over.","Auto switch","Aŭtomata ludŝanĝado"
"puzzles","One of the 3 rectangular buttons on the ""training"" page (https://lichess.org/training). This chooses puzzles as your training type.","Puzzles","Puzloj"
"coordinates","One of the 3 rectangular buttons on the ""training"" page (https://lichess.org/training). This chooses coordinates as your training type.","Coordinates","Koordinatoj"
"latestUpdates","A list of the last blog updates. Appears as a heading to a box at the bottom of the ""Play"" page (https://lichess.org/).","Latest updates","Lastaj novaĵoj"
"tournamentWinners","A list of tournament winners. Appears on the ""Play"" page (https://lichess.org) as a heading to a box that contains a list of the recent winners.","Tournament winners","Turniro-venkistoj"
"name","This appears in the form for creating a new team (https://lichess.org/team/new). You choose your team name in this field.","Name","Nomo"
"description","This appears in the form for creating a new team (https://lichess.org/team/new). You can write a description for your team in this field.","Description","Priskribo"
"no","Appears in the preferences page for multiple options (https://lichess.org/account/preferences).","No","Ne"
"yes","Appears in the preferences page for multiple options (https://lichess.org/account/preferences).","Yes","Jes"
"help","Appears next to chess CAPTCHAs when signing up, posting on the forum and other actions with a link to the game it is referenced from.","Help:","Helpo:"
"createANewTopic","Click this button in the forum (https://lichess.org/forum/general-chess-discussion) to create a new topic.","Create a new topic","Krei novan temon"
"topics","Appears as a column in the forum and shows how many topics a category has (https://lichess.org/forum).","Topics","Temoj"
"posts","Appears in the forum and shows how many posts a category has (https://lichess.org/forum).","Posts","Afiŝoj"
"lastPost","shows the time the most recent post was made. Appears in the forum (https://lichess.org/forum) as a column. Translation must be kept short.","Last post","Lasta afiŝo"
"views","Appears in the forum and shows how many views a topic has (https://lichess.org/forum/general-chess-discussion).","Views","Legoj"
"replies","Appears in the forum and shows how many replies a topic has (https://lichess.org/forum/general-chess-discussion).","Replies","Respondoj"
"replyToThisTopic","The title over your message when posting in the forum.","Reply to this topic","Resondoj al tiu ĉi temo"
"reply","The button at the bottom of a topic page. Click the button to reply to a topic.","Reply","Respondi"
"message","This is where you write your message for replying to a topic or creating a topic in the forum.","Message","Mesaĝo"
"createTheTopic","The button at the bottom of forum pages (https://lichess.org/forum/general-chess-discussion/form). Click it to create your topic.","Create the topic","Krei novan temon"
"reportAUser","Appears as a heading for this form (https://lichess.org/report). Use this form to report a user.","Report a user","Raporti uzanton"
"user","To report a user, you need to write their name in this field (https://lichess.org/report).","User","Uzanto"
"reason","Choose a reason for reporting a user (https://lichess.org/report).","Reason","Kialo"
"whatIsIheMatter","Default choice in drop-down menu that describes the options to choose from (https://lichess.org/report).","What's the matter?","Pri kio temas la raporto?"
"cheat","Choose this option if a user cheated. Appears in the drop-down menu for reasons in the report form (https://lichess.org/report).","Cheat","Trompo"
"insult","Choose this option if a user insulted you. Appears in the drop-down menu for reasons in the report form (https://lichess.org/report).","Insult","Insulto"
"troll","Choose this option if a user is trolling. Appears in the dropdown menu for reasons in the report form (https://lichess.org/report).","Troll","Trolo"
"other","Choose this option if you have another reason than the ones in the dropdown list. Appears in the drop-down menu for reasons in the report form(https://lichess.org/report).","Other","Io alia"
"reportDescriptionHelp","Appears under the description box on the page for reporting a user (https://lichess.org/report).","Paste the link to the game(s) and explain what is wrong about this user behavior. Don't just say ""they cheat"", but tell us how you came to this conclusion. Your report will be processed faster if written in English.","Inkluzivu la ligilon al la ludo(j) kaj ekspliku tion, kio malbonas pri la konduto de ĉi tiu uzanto."
