"playWithAFriend","One of the 3 rectangular buttons on the ""Play"" page (https://lichess.org/). This creates a unique URL that you can send to someone and play.","Play with a friend","Ludi kun amiko"
"playWithTheMachine","One of the 3 rectangular buttons on the ""Play"" page (https://lichess.org/). Translate ""machine"" as ""[chess] engine"" if it sounds better in your language, omitting the word ""chess"".","Play with the machine","Ludi kontraŭ la komputilo"
"toInviteSomeoneToPlayGiveThisUrl","This appears after you have created a game for a friend (through the ""Play with a friend"" menu). Feel free to translate ""URL"" as ""address"", or whatever is most familiar in your language.","To invite someone to play, give this URL","Por inviti iun al ludo, donu ĉi tiun ligilon"
"gameOver","This appears in the right-hand side box when a game ends.","Game Over","Ludo finiĝis"
"waitingForOpponent","Indicates you are waiting for an opponent to join your game. This appears after you have created a public game (through the ""Create a game"" menu).","Waiting for opponent","Atendante kontraŭulon"
"waiting","This appears in the challenges box, when you are waiting for the opponent the accept the challenge.","Waiting","Atendante"
"yourTurn","This appears in the box while you are playing a game. It indicates it is your turn to play.","Your turn","Via vico"
"aiNameLevelAiLevel","AI name and level, e.g. ""Stockfish level 3"". Note that the ""Stockfish"" part will always be first no matter where you place the %s, though you can rearrange them to e.g. ""%s at %s levels"", which would produce e.g. ""Stockfish at 3 levels"". Use the translation that sounds best in your language. Appears in the box on the left-hand side in the page of the game, and also on your profile, in the list of games.","%s level %s","%s nivelo %s"
"level","This appears in the ""Play with the machine"" menu (https://lichess.org/setup/ai) as a heading. Below it are skill levels (1 through 8) of the AI that you can play against.","Level","Nivelo"
"toggleTheChat","Turns the chat room (or player chat) on or off. This is the mouseover text of the checkbox on the top-right of the chat box.","Toggle the chat","Ŝanĝi videblecon de la babilejo"
"toggleSound","Clicking this turns sound on or off. This is a button on the top-right hand corner of the screen. If you use the Internet Explorer browser, you may not be able to see this.","Toggle sound","(Mal)ŝalti sonon"
"chat","Start a conversation with a player. Appears in the user tooltip when hovering a user name.","Chat","Babilejo"
"resign","Clicking this makes you resign from the game. Small button in the box on the right while playing a game.","Resign","Rezigni"
"checkmate","Appears in the box of a game if you end a game by checkmate.","Checkmate","Ŝakmato"
"stalemate","If you do not know what this rule is, see https://www.chessvariants.org/d.chess/matefaq.html. Appears in the box of a game if you end a game by stalemate. Please use the official term used by your country's or locale's chess federation or club.","Stalemate","Pato"
"white","The mouseover text of the White King button in the game creation menus (e.g. ""Create a game"", ""Play with a friend"") on the ""Play"" page.","White","Blanko"
"black","The mouseover text of the Black King button in the game creation menus (e.g. ""Create a game"", ""Play with a friend"") on the ""Play"" page.","Black","Nigro"
"randomColor","Makes Lichess randomly pick a side (White or Black) for you. The mouseover text of the large button in the game creation menus (e.g. ""Create a game"", ""Play with a friend"") on the ""Play"" page.","Random side","Hazarda koloro"
"createAGame","This button opens a menu (https://lichess.org/setup/hook) that lets you create a game that is listed in the list (or graph) of open games. It is one of the 3 rectangular buttons on the ""Play"" page (https://lichess.org/).","Create a game","Krei ludon"
"whiteIsVictorious","Indicates the white player won the game. This appears in the top left box of a game, and also the player profile.","White is victorious","Blanko venkas"
"blackIsVictorious","Indicates the black player won the game. This appears in the top left box of a game, and also the player profile.","Black is victorious","Nigro venkas"
"kingInTheCenter","Indicates that the game was won by the King being in one of the center tiles (King of the hill variant: https://lichess.org/king-of-the-hill).","King in the center","Reĝo en la centro"
"threeChecks","Indicates that the game was won by a player checking their opponent three times. Only for the Three-check variant.","Three checks","Tri ŝakoj"
"raceFinished","Ending message of a Racing Kings game (https://lichess.org/variant/racingKings).","Race finished","Kuro finiĝis"
"variantEnding","Indicates that the game was won due to variant special rules. Shown when no more specialized message is available.","Variant ending","Variaĵa fino"
"newOpponent","Clicking this takes you back to the ""Play"" page (https://lichess.org). This is a button that appears at the end of a game just below the ""Rematch"" button.","New opponent","Nova kontraŭulo"
"yourOpponentWantsToPlayANewGameWithYou","This sentence appears when your opponent offers you a rematch.","Your opponent wants to play a new game with you","Via kontraŭulo volas ludi denove kun vi"
"joinTheGame","Clicking this lets you join a new game against the same opponent. This is one of the two buttons that appear when your opponent offers you a rematch.","Join the game","Aliĝi al la ludo"
"whitePlays","This is what a spectator sees in the right-hand box when watching a game and it is White's turn to play.","White to play","Blanko ludas"
"blackPlays","This is what a spectator sees in the right-hand box when watching a game and it is Black's turn to play.","Black to play","Nigro ludas"
"theOtherPlayerHasLeftTheGameYouCanForceResignationOrWaitForHim","This appears after 3 minutes have elapsed with one player disconnected. Below it are two buttons: ""Claim victory"" and ""Call draw"".","The other player may have left the game. You can claim victory, call the game a draw, or wait.","La alia ludanto eliris el la ludo. Vi povas postuli venkon, deklari egalvenkon, aŭ atendi."
"makeYourOpponentResign","The mouseover text of ""Claim victory"". You do not have to translate it like this; you can translate to e.g. ""Force victory"", or whatever best explains the button in your language. Mouseover texts can be as long as you want, within reason.","Make your opponent resign","Rezignigi vian kontraŭulon"
"forceResignation","Clicking this ends the game and grants you the win. One of the two buttons that appears when your opponent leaves the game.","Claim victory","Postuli venkon"
"forceDraw","Clicking this draws the game. It is considered the more ""chivalrous"" option of the two. One of the two buttons that appears when your opponent leaves the game.","Call draw","Deklari egalvenkon"
"talkInChat","Chat input placeholder, encouraging players to behave. Visible in every chat, like on https://lichess.org/tournament/summer15. Keep it short so it fits in the input box.","Please be nice in the chat!","Bonvolu esti afable en la babilejo!"
"theFirstPersonToComeOnThisUrlWillPlayWithYou","Informs you that Lichess waiting for your friend to visit the link. This appears at the top of the pane after you have created a game through the ""Play with a friend"" menu.","The first person to come to this URL will play with you.","La unua persono, kiu alvenos al ĉi tiu ligilo, ludos kun vi."
"whiteResigned","This sentence appears in the right hand-side box in a game, the list of games on the profile, and also the left hand-side box in a game when the White player resigns from the game.","White resigned","Blanko rezignis"
"blackResigned","This sentence appears in the right hand-side box in a game, the list of games on the profile, and also the left hand-side box in a game when the Black player resigns from the game.","Black resigned","Nigro rezignis"
"whiteLeftTheGame","This appears when the White player leaves the game either by aborting or by being absent for too long. It can found in the right hand-side box in a game, the list of games on the profile and also the left hand-side box in a game.","White left the game","Blanko eliris el la ludo"
"blackLeftTheGame","This sentence appears when the Black player leaves the game either by aborting or by being absent for too long. It can found in the right hand-side box in a game, the list of games on the profile and also the left hand-side box in a game.","Black left the game","Nigro eliris el la ludo"
"shareThisUrlToLetSpectatorsSeeTheGame","The mouseover text of the link just below the board which you can send to people so they can watch the game.","Share this URL to let spectators see the game","Disdonu ĉi tiun ligilon por allasi spektantojn en la ludon"
"theComputerAnalysisHasFailed","This is an error message that appears when the computer analysis cannot be displayed for some reason. It appears the ""Computer analysis"" tab.","The computer analysis has failed","La komputila analizo ne sukcesis"
"viewTheComputerAnalysis","Clicking this button takes you to the computer analysis. The sentence appears only for the player that requested it, in the ""Computer analysis"" tab.","View the computer analysis","Vidi la komputilan analizon"
"requestAComputerAnalysis","Clicking this puts the game in the queue for computer analysis, which is usually completed within a minute. This is one of the actions below the board in the ""Replay and analyse"" view.","Request a computer analysis","Peti komputilan analizon"
"computerAnalysis","An automated analysis of a game performed by lichess. It provides an advantage charts and possible variation for a game. Appears as a tab below the chess board in replay and analysis views. Example: https://lichess.org/vyvcbk8s","Computer analysis","Komputila analizo"
"analysis","Button that leads to analysis page. Appears only on your own games, after they have finished.","Analysis board","Analizo"
"blunders","This is one of the categories of problems discovered by the computer analysis. If no equivalent word exists, translate to ""Serious mistakes"".","Blunders","Eraregoj"
"mistakes","This is one of the categories of problems discovered by the computer analysis. Appears on the right hand side of pages with analyzed games. Example: https://lichess.org/vyvcbk8s","Mistakes","Eraroj"
"inaccuracies","The most minor of errors a player can make. This is one of the categories of problems discovered by the computer analysis.","Inaccuracies","Eraretoj"
"moveTimes","Time spent on each move by the players. Appears as a tab in the ""Replay and analyse"" view, below the chess board. Example: https://lichess.org/6iaj1eh0","Move times","Movaj tempoj"
"flipBoard","Clicking this flips the board upside-down. This sentence is one of the links in the box normally below the board.","Flip board","Rotacii tabulon"
"threefoldRepetition","This is one of the conditions by which a game ends. It appears on the box on the right-hand side of the screen. It also appears in player profiles. Please use the official term used by your country's or locale's chess federation or club.","Threefold repetition","Triobla ripeto"
"claimADraw","Clicking this draws the game. This a button that appears to players when threefold repetition occurs.","Claim a draw","Postuli egalvenkon"
"offerDraw","Clicking this send an offer to draw the game to your opponent. This is a small button in the right-hand side box.","Offer draw","Oferti egalvenkon"
"draw","This appears in various places, including players' profiles and the right-hand side boxes in individual games. It should be translated as a noun, NOT as a verb.","Draw","Egalvenko"
"nbConnectedPlayers","The %s is the counter of how many players are connected right now. This sentence is displayed at the top of every page on lichess.","%s players","%s konektitaj ludantoj"
"gamesBeingPlayedRightNow","This is a shorter phrase for ""Games being played right now"". It is what the link at the top that says ""Games"" links to (https://lichess.org/games). Please try to keep your translation as short as possible.","Current games","Ludataj ludoj"
"viewAllNbGames","%s here is the number of all the games ever played on Lichess. Links to https://lichess.org/games/all.","%s Games","%s Ludoj"
"viewNbCheckmates","%s is the number of all the games that ended in checkmate on Lichess. Links to https://lichess.org/games/checkmate and is found on the left hand side of the ""Games"" pages.","%s Checkmates","%s Ŝakmatoj"
"nbBookmarks","%s is the number of games you have bookmarked. Links to https://lichess.org/games/bookmark. It only appears to registered users that have bookmarked certain games. It displays a list of your bookmarked games.","%s Bookmarks","%s Paĝmarkoj"
"viewInFullSize","Clicking one of these small boards brings you to the game's unique page. This is the mouseover text of the small chess boards dotted around the site. These small boards are most prominent in the ""Games"" pages (https://lichess.org/games).","View in full size","Vidi plengrande"
"logOut","Clicking this signs you out of your lichess profile. This is part of the profile drop-down menu on the top of every page when you are signed in to an account.","Sign out","Elsaluti"
"signIn","Clicking takes you to a form that allows you to sign into your lichess profile (account). This is a red-coloured button that appears at the navigation bar at the top when you are not signed in to an account, or playing anonymously. Please keep it as short as possible.","Sign in","Ensaluti"
"newToLichess","It is next to a button that allows you to register an account on the website. The translation should be friendly and inviting; free/loose translations are recommended for this sentence. This sentence appears on the ""Sign in"" page.","New to Lichess?","Ne jam konas vi Lichess?"
"youNeedAnAccountToDoThat","This error message appears when trying actions or going to pages that require being signed in with a user account.","You need an account to do that","Vi bezonas konton por fari tion"
"signUp","Clicking this allows you to register an account. Appears as a button on the ""Sign in"" page and the ""Training"" page (https://lichess.org/training) when playing unregistered (encouraging the player to register an account with Lichess). It is recommended to translate this word as a verb.","Register","Registriĝi"
"computersAreNotAllowedToPlay","The text users read when creating an account. Appears in the registration (new account) form (https://lichess.org/signup).","Computers and computer-assisted players are not allowed to play. Please do not get assistance from chess engines, databases, or from other players while playing. Also note that making multiple accounts is strongly discouraged and excessive multi-accounting will lead to being banned.","Estas nepermesate ludi per komputiloj aŭ komputilasisto. Bonvolu ne akiri asiston de iu ŝakaŭtomato, datumbazo aŭ aliaj ludantoj dum ludado. Krome, notu ke la kreado de multaj kontoj estas forte malrekomendata, kaj troa uzo de multaj kontoj rezultigos vian forbaron."
"games","The page displays games currently being played and has links to various other tools on the site to find out about past games on lichess, such as a search engine that queries the database of games. ""Games"" is one of the links at the top of every page, so keep it as short as possible. Links to https://lichess.org/games","Games","Ludoj"
"forum","It is Lichess's webforum, where users can discuss various topics, chess-related or not. These are sometimes called ""bulletin boards"". ""Forum"" is one of the links at the top of every page, so keep it as short as possible. Links to https://lichess.org/forum","Forum","Forumo"
"xPostedInForumY","The first %s is the player's name and the second %s is the title of the topic in the forum. By ""topic"" here we mean a discussion, sometimes called a ""thread"" in this context. Appears in the activity timeline on the left-hand side of the ""Play"" page (https://lichess.org/) after you have started following a player.","%s posted in topic %s","%s skribis en temo %s"
"latestForumPosts","A list of the most recent posts on the forum. Appears as a heading to a box near the bottom of the ""Play"" page (https://lichess.org/).","Latest forum posts","Plej novaj forumaj afiŝoj"
"players","Some have been translating as ""[Chess] Players"". This is acceptable only if it is one word (e.g. ""Szachiści"" in Polish). Otherwise, keep just translate to ""Players"". This appears as one of the links on the navigation bar at the top of every page.  Links to https://lichess.org/people","Players","Ŝakludantoj"
"minutesPerSide","This appears in all the game creation menus (e.g. ""Create a game"", ""Play with a friend"") after you have ticked ""Time control"". Below it is a slider that lets you select how many minutes each player will have on their chess clock.","Minutes per side","Minutoj por ĉiu flanko"
"variant","This appears in all the game creation menus (e.g. ""Create a game"", ""Play with a friend""). Below it is a selection of variants the player can choose from, such as Standard, Chess960, or King of the Hill.","Variant","Variaĵo"
"variants","This appears in the simul creation page (https://lichess.org/simul/new). Below it is a selection of variants the player can choose from, such as Standard, Chess960, or King of the Hill.","Variants","Variaĵoj"
"timeControl","This sentence is a heading to time controls for the game. This appears in all the game creation menus (e.g. ""Create a game"", ""Play with a friend"") that can be found on the ""Play"" page.","Time control","Temporegado"
"realTime","Real time chess is chess played over a short period of time, using a chess clock. This is one of three time control settings in the game creation menus (e.g. ""Create a game"", ""Play with a friend"") on the ""Play"" page. Please do NOT translate literally; if your language does not have an equivalent, established term, translate to ""quick"" games or something similar.","Real time","Reala tempo"
"correspondence","Correspondence chess is chess played over a long period of time, often with several days per move. This is one of three time control settings in the game creation menus (e.g. ""Create a game"", ""Play with a friend"") on the ""Play"" page. Please do NOT translate literally; if your language does not have an equivalent, established term, translate to ""long"" games or something similar.","Correspondence","Korespondo"
"daysPerTurn","This is a slider specifically for correspondence chess games. Appears in the game creation menus (e.g. ""Create a game"", ""Play with a friend"") when you have selected the ""Correspondence"" time control.","Days per turn","Tagoj pomovaj"
"oneDay","Means each turn may take up to one day. This appears next to the slider for the correspondence chess time control in the game creation menus (e.g. ""Create a game"", ""Play with a friend""). Please translate ""one"" as a word (""one""), not a number (not ""1""). It also appears on the clock in correspondence chess games.","One day","Unu tago"
"nbDays","%s is maximum number of days for each turn. This appears next to the slider for the correspondence chess time control in the game creation menus (e.g. ""Create a game"", ""Play with a friend""). It also appears on the clock and information box in correspondence chess games. Please keep this sentence as short as possible.","%s days","%s tagoj"
"nbHours","%s is number of hours. Used to display correspondence clocks.","%s hours","%s horoj"
"time","The time control for the game. This appears as a column heading in the table of games you can join on the ""Play"" page (https://lichess.org/).","Time","Tempo"
"rating","The rating of the player (e.g. 1500). Appears on the lobby list on https://lichess.org/","Rating","Taksado"
"ratingStats","Link to the rating distribution stats page (https://lichess.org/stat/rating/distribution/blitz), in the top menu, under ""Community"".","Rating stats","Taksaj statistikoj"
"username","The name you use to sign in, e.g. ""thibault"". Appears on the registration page (https://lichess.org/signup).","User name","Uzantnomo"
"usernameOrEmail","The name or email you use to sign in, e.g. ""thibault"". Appears on the sign-in page.","User name or email","Uzantnomo aŭ retpoŝtadreso"
"password","This is the password you must type to sign in to your profile. Appears on the sign-in, registration, tournament creation and ""Preferences"" pages. Please keep this sentence as short as possible. Next to the sentence is a box where you can type in your password.","Password","Pasvorto"
"haveAnAccount","This appears on the top-right of the registration page (https://lichess.org/signup -- must be signed out to see this). Next to it is a ""sign in"" button.","Have an account?","Ĉu vi havas konton?"
"changePassword","This is a link in the preferences page to a menu that allows you to change your password (https://lichess.org/account/passwd).","Change password","Ŝanĝi pasvorton"
"changeEmail","Appears as a menu item and heading on the ""Preferences"" pages (https://lichess.org/account/email).","Change email","Ŝanĝi retadreson"
"email","Short for ""Your email address"", but please keep this sentence as short as possible. This appears above text boxes where you can type in your email, on the ""Preferences"" page.","Email","Retadreso"
"emailIsOptional","This is a help text, explaining how email works on lichess. Appears on the ""Change email"" page (https://lichess.org/account/email).","Email is optional. Lichess will use your email address to reset your password if you forget it.","Retadreso ne estas bezonata. Lichess povos uzi vian retadreson por reagordi vian pasvorton, se vi forgesos ĝin."
"passwordReset","Appears as a heading in the link you are given after you asked for an email to reset (change) your password if you have forgotten it.","Password reset","Reagordo de pasvorto"
"forgotPassword","You click here if you forgot your password and want it reset. Please adopt an inviting tone to the user. Also see how other popular websites (e.g. YouTube) phrase the same question in your language. Appears on the ""Sign in"" page.","Forgot password?","Ĉu vi forgesis la pasvorton?"
"rank","This sentence is not currently used on the site, but feel free to translate it.","Rank","Rango"
"gamesPlayed","Before it is the number of games the player has played. For example, https://lichess.org/@/thibault/ currently reads ""2037 Games Played"". Make sure you take the number that appears before this sentence into account when preparing your translation. This sentence appears as a tab on player profiles, just above the list of games.","Games played","Luditaj ludoj"
"nbGamesWithYou","%s is the number of games this player has played with you. This appears as a tab on the profile pages of people that you have played with. Try to keep it fairly short.","%s games with you","%s ludoj kun vi"
"cancel","This is a generic word that appears in a wide variety of places and is used to cancel actions of all sorts. It is recommended to translate it according to whatever your operating system (e.g. Microsoft Windows) uses for your language.","Cancel","Nuligi"
"timeOut","This is the condition of a game ending by time-out, which is when one player's clock runs out of time. This sentence appears in the list of games in the profile page and in the game view.","Time out","Tempo finiĝis"
"drawOfferSent","Informs that a draw offer has been sent. This is a system message that appears in the chat box.","Draw offer sent","Egalvenka oferto estis sendita"
"drawOfferDeclined","Informs that the draw offer has been declined. This is a system message that appears in the chat box.","Draw offer declined","Egalvenka oferto estis malakceptita"
"drawOfferAccepted","Informs that a draw offer has been accepted. This is a system message that appears in the chat box. This ends the game.","Draw offer accepted","Egalvenka oferto estis akceptita"
"drawOfferCanceled","Informs that the player that sent the draw offer canceled it before his/her opponent responded. This is a system message that appears in the chat box","Draw offer canceled","Egalvenka oferto estis nuligita"
"whiteOffersDraw","Informs that the White player wants to draw the game. This is a system message that appears in the chat box.","White offers draw","Blanko ofertas egalvenkon"
"blackOffersDraw","Informs that the Black player wants to draw the game. This is a system message that appears in the chat box.","Black offers draw","Nigro ofertas egalvenkon"
"whiteDeclinesDraw","Informs that the White player declined Black's offer to draw the game. This is a system message that appears in the chat box.","White declines draw","Blanko malakceptas egalvenkon"
"blackDeclinesDraw","Informs that the Black player declined White's offer to draw the game. This is a system message that appears in the chat box.","Black declines draw","Nigro malakceptas egalvenkon"
"yourOpponentOffersADraw","This sentence appears in the right-hand side box while playing a game after your opponent offers you a draw.","Your opponent offers a draw","Via kontraŭulo ofertas egalvenkon"
"accept","Clicking this will accept your opponent's offer and let the action the opponent requested happen. A generic word that appears as a button when your opponent sends an offer to do something (such as a takeback or ending the game by draw). Please translate as a verb if possible.","Accept","Akcepti"
"decline","Clicking this will reject your opponent's offer. A generic word that appears as a button when your opponent sends an offer to do something (such as a takeback or ending the game by draw). Please translate as a verb if possible.","Decline","Malakcepti"
