"by","The %s is the username of the poster in the forum. This is used in the ""Last post"" column (https://lichess.org/forum/general-chess-discussion).","by %s","de %s"
"thisTopicIsNowClosed","This sentence appears in the forum when a topic is closed.","This topic is now closed.","Tiu ĉi temo nun estas fermita."
"theming","Clicking this opens a menu that allows you to change the colour or texture of the chess board. This button that looks like an eye appears on the top bar in all the pages and it says ""Theming"" when you hover over it. You may also translate this to ""Appearance"".","Theming","Aspekto"
"donate","Click this button (at the bottom of all pages) to make a donation.","Donate","Donaci"
"blog","Appears in the bottom left of any page and links to the blog.","Blog","Blogo"
"questionsAndAnswers","Appears when you hover over ""Q&A"" (https://lichess.org/qa) at the bottom left on any page. Translate freely. If you cannot find a good translation, consider leaving this untranslated so another speaker of your language can look at it.","Questions & Answers","Demandoj & Respondoj"
"notes","Appears on the left side while playing a game. You can type your private notes on the game in this tab.","Notes","Notoj"
"typePrivateNotesHere","Click in the box to type your private notes. This is the placeholder text (greyed-out text that disappears when you click) for the ""Notes"" box on the left side while playing a game. Please use a verb and active voice to address the user in this sentence","Type private notes here","Entajpu privatajn notojn ĉi tie"
"gameDisplay","The title on your account preferences page where you can change how the board and pieces are displayed, among other things (https://lichess.org/account/preferences).","Game display","Aspekto de ludoj"
"pieceAnimation","Here you can change the speed of your piece animation or select none (https://lichess.org/account/preferences).","Piece animation","Animacio de ŝakpecoj"
"materialDifference","Choose if you want to see the difference in material while playing a game. (https://lichess.org/account/preferences).","Material difference","Materiala diferenco"
"closeAccount","Clicking this lets you close your account. Appears in the menu on the preferences page https://lichess.org/account/preferences and as a heading on the ""Close account"" page. Please do not translate to ""delete account"" unless you have to, as some data like the games you played on the site are retained.","Close account","Fermi konton"
"closeYourAccount","Appears as a heading on the page for closing your account https://lichess.org/account/close","Close your account","Fermi vian konton"
"changedMindDoNotCloseAccount","This sentence appears on the page for closing your account https://lichess.org/account/close. You can click this button if you do not want to close your account. When you click the button you will get redirected to your profile page.","I changed my mind, don't close my account","Mi ŝanĝis mian opinion, mi ne volas fermi mian konton"
"closeAccountExplanation","These sentences appear under the heading on the page for closing your account https://lichess.org/account/close.","Are you sure you want to close your account? Closing your account is a permanent decision. You will no longer be able to login, and your profile page will no longer be accessible.","Ĉu vi certas, ke vi volas fermi vian konton? Fermi vian konton estas ago nemalfarebla. Vi ne plu povos ensaluti, kaj via profila paĝo ne plu estos alirebla."
"thisAccountIsClosed","This text appears after you have clicked the ""Close my account"" button. https://lichess.org/account/close","This account is closed.","Tiu ĉi konto estas fermita."
"invalidUsernameOrPassword","This text appears on the log in page when you enter the wrong username/password https://lichess.org/login","Invalid username or password","Malĝusta uzantnomo aŭ pasvorto"
"emailMeALink","Click this button to reset your password https://lichess.org/password/reset","Email me a link","Retpoŝte sendu al mi ligilon"
"currentPassword","Appears on the page for changing your password https://lichess.org/account/passwd. Write your current password in this field.","Current password","Nuna pasvorto"
"newPassword","Appears on the page for changing your password https://lichess.org/account/passwd. Write your new password in this field.","New password","Nova pasvorto"
"newPasswordAgain","Appears on the page for changing your password https://lichess.org/account/passwd. Write your new password again in this field. If ""again"" does not sound good in your language, consider translating to something like ""confirm"", but please keep it short and simple.","New password (again)","Nova pasvorto (retajpu)"
"boardHighlights","Choose if you want to see highlights, on the game board, for last move and check. https://lichess.org/account/preferences","Board highlights (last move and check)","Emfazaj aperoj sur tabulo (lasta movo kaj ŝakoj)"
"pieceDestinations","Choose if you want to see where all the pieces can move to on the board. https://lichess.org/account/preferences","Piece destinations (valid moves and premoves)","Destinoj de ŝakpecoj (eblaj movoj kaj antaŭmovoj)"
"boardCoordinates","Choose if you want to see the coordinates on the board, and where to show them. https://lichess.org/account/preferences. A-H and 1-8 are rank and file as they appear on lichess. So even if your language uses different notation, please leave A-H and 1-8 unchanged because that is how they appear on the site.","Board coordinates (A-H, 1-8)","Tabulaj koordinatoj (A-H, 1-8)"
"moveListWhilePlaying","Choose if you want to see a list of all moves made, on the right side of the board. https://lichess.org/account/preferences","Move list while playing","Listo de movoj dum ludado"
"chessClock","One of the subtitles on your account preferences page (https://lichess.org/account/preferences). In this section you can choose between different options regarding the time.","Chess clock","Ŝakhorloĝo"
"tenthsOfSeconds","Choose if you want to see 1/10ths of seconds while playing a game. https://lichess.org/account/preferences","Tenths of seconds","Dekonoj da sekundoj"
"never","Appears in the preferences page for multiple options (https://lichess.org/account/preferences).","Never","Neniam"
"whenTimeRemainingLessThanTenSeconds","An option to show 1/10ths of a second only when there are less than 10 seconds on your clock. Appears in the preferences page (https://lichess.org/account/preferences).","When time remaining < 10 seconds","Kiam restas malpli ol 10 sekundoj"
"horizontalGreenProgressBars","Choose if you want to see a green progress bar while playing a game. (https://lichess.org/account/preferences).","Horizontal green progress bars","Horizontalaj verdaj progreso-strioj"
"soundWhenTimeGetsCritical","Choose if you want to hear a special sound, while playing a game, when you start running out of time. (https://lichess.org/account/preferences).","Sound when time gets critical","Sono, kiam tempo iĝas tre malmulta"
"gameBehavior","One of the subheadings on your account preferences page (https://lichess.org/account/preferences). In this section you can choose between different options regarding the game.","Game behavior","Konduto de ludoj"
"premovesPlayingDuringOpponentTurn","Choose if you want to be able to make premoves while waiting for your opponent to make a move. (https://lichess.org/account/preferences).","Premoves (playing during opponent turn)","Antaŭmovoj (ludi dum la vico de kontraŭulo)"
"takebacksWithOpponentApproval","Choose if you want to enable takebacks (ability to undo moves) in games. (https://lichess.org/account/preferences)","Takebacks (with opponent approval)","Reprenoj (kun konsento de kontraŭulo)"
"promoteToQueenAutomatically","Choose if you want the pawn to promote to a queen automatically when you reach the other side of the board. (https://lichess.org/account/preferences)","Promote to Queen automatically","Aŭtomata ŝanĝo (de peonoj) al damoj"
"claimDrawOnThreefoldRepetitionAutomatically","IMPORTANT: These two %s should be put around the words that you translate ""threefold repetition"" into. This links to Wikipedia in English for a description of the meaning. The two %s can be left out if users of your language generally cannot read English. On the preferences page (https://lichess.org/account/preferences) you can choose if you want to be able to automatically claim a draw when threefold repetition occurs.","Claim draw on %sthreefold repetition%s automatically","Aŭtomate postuli egalvenkon ĉe %striobla ripeto%s"
"privacy","One of the subheadings on your account preferences page (https://lichess.org/account/preferences). In this section you can choose between different options regarding your privacy.","Privacy","Privateco"
"letOtherPlayersFollowYou","Choose if you want to let other players be able to follow you. It is an option on your account preferences page: https://lichess.org/account/preferences","Let other players follow you","Lasi aliajn ludantojn sekvi vin"
"letOtherPlayersChallengeYou","Lets you choose if you want to let other players be able to challenge you to a game. It is an option on your account preferences page: https://lichess.org/account/preferences","Let other players challenge you","Lasi aliajn ludantojn defii vin"
"sound","Subheading for the last section on your account preferences page (https://lichess.org/account/preferences).","Sound","Sonoj"
"yourPreferencesHaveBeenSaved","This sentence appears on the bottom of your account preferences page. https://lichess.org/account/preferences. It informs you that all the changes you have made have been saved.","Your preferences have been saved.","Viaj preferoj estis savitaj."
"none","Choose this option if you want to disable piece animation (movement). Appears on your account preferences page: https://lichess.org/account/preferences","None","Neniu"
"fast","Choose this option if you want your piece animation (movement) to be fast. Appears on your account preferences page: https://lichess.org/account/preferences","Fast","Rapide"
"normal","Choose this option if you want your piece animation (movement) to be normal. Appears on your account preferences page: https://lichess.org/account/preferences","Normal","Normale"
"slow","Choose this option if you want your piece animation (movement) to be slow. Appears on your account preferences page: https://lichess.org/account/preferences","Slow","Malrapide"
"insideTheBoard","Choose if you want to see the coordinates on the game board. Appears on your account preferences page: https://lichess.org/account/preferences","Inside the board","Ene de la tabulo"
"outsideTheBoard","Choose if you want to see the coordinates outside the game board. Appears on your account preferences page: https://lichess.org/account/preferences","Outside the board","Ekstere de la tabulo"
"onSlowGames","Choose this option if you only want to see the list of moves on slow games. Appears on your account preferences page: https://lichess.org/account/preferences","On slow games","Ĉe malrapidaj ludoj"
"always","Appears on the preferences page https://lichess.org/account/preferences","Always","Ĉiam"
"inCasualGamesOnly","Choose this if you only want to allow takebacks on casual games. Casual games are games which are not rated, so you cannot gain or lose points from them. Appears on your account preferences page: https://lichess.org/account/preferences","In casual games only","Nur ĉe amikaj ludoj"
"whenPremoving","One of the options for promoting to a queen automatically. Appears on your account preferences page: https://lichess.org/account/preferences","When premoving","Ĉe antaŭmovoj"
"whenTimeRemainingLessThanThirtySeconds","One of the options for claiming a draw when threefold repetition occurs. Appears on your account preferences page: https://lichess.org/account/preferences","When time remaining < 30 seconds","Kiam restas malpli ol 30 sekundoj"
"difficultyEasy","Click this button to select easy as your difficulty. Appears on the training page when solving puzzles https://lichess.org/training/","Easy","Facile"
"difficultyNormal","Choose this option if you want your piece animation (movement) to be normal. Appears on your account preferences page: https://lichess.org/account/preferences","Normal","Normale"
"difficultyHard","Click this button to select hard as your difficulty. Appears on the training page when solving puzzles https://lichess.org/training/","Hard","Malfacile"
"xLeftANoteOnY","First %s is the name of the player that left a note, and the second %s is the player who got a note on their profile. Appears in the activity timeline on the left-hand side of the ""Play"" page (https://lichess.org/) after you have started following a player.","%s left a note on %s","%s restigis noton pri %s"
"xCompetesInY","First %s is the name of the player that competes in a tournament, and the second %s is the tournament name. Appears in the activity timeline on the left-hand side of the ""Play"" page (https://lichess.org/) after you have started following a player.","%s competes in %s","%s konkuras en %s"
"xAskedY","First %s is the name of the player that asked, and the second %s is the title of the question in Q&A. Appears in the activity timeline on the left-hand side of the ""Play"" page (https://lichess.org/) after you have started following a player.","%s asked %s","%s demandis %s"
"xAnsweredY","First %s is the name of the player that answered, and the second %s is the title of the question in Q&A. Appears in the activity timeline on the left-hand side of the ""Play"" page (https://lichess.org/) after you have started following a player.","%s answered %s","%s respondis %s"
"xCommentedY","First %s is the name of the player that commented, and the second %s is the title of the question in Q&A. Appears in the activity timeline on the left-hand side of the ""Play"" page (https://lichess.org/) after you have started following a player.","%s commented %s","%s komentis %s"
"timeline","An activity timeline showing what people you follow on lichess have been up to. Appears on the main page under logotype https://lichess.org and https://lichess.org/timeline/more. Note: this only appears as soon as you follow a player on lichess.","Timeline","Kronologio"
"seeAllTournaments","This text appears when you hover over the ""more"" link for ""open tournaments"" on the main page https://lichess.org/","See all tournaments","Montri ĉiujn turnirojn"
"starting","This text appears to the left of the ""join"" button and it informs you when the tournament is starting. To see an example click on an open tournament from the tournament page https://lichess.org/tournament.","Starting:","Komenciĝos je:"
"allInformationIsPublicAndOptional","This sentence appears under the header on the page where you change your profile https://lichess.org/account/profile","All information is public and optional.","Ĉiuj informaĵoj estas publikaj kaj nedevigaj."
"yourCityRegionOrDepartment","This text appears under the field where you write your location. You can leave out the word ""your"" if it helps you. Appears in the profile editor: https://lichess.org/account/profile","Your city, region, or province.","Via urbo, regiono aŭ provinco."
"biographyDescription","This sentence appears under the biography description box on the page where you edit your profile https://lichess.org/account/profile","Tell about you, what you like in chess, your favorite openings, games, players…","Rakontu pri vi, kion vi ŝatas pri ŝako, viaj plej ŝatataj debutoj, ludoj, ludantoj…"
"maximumNbCharacters","This text appears under the biography description box to inform you the maximum length your description can have. https://lichess.org/account/profile","Maximum: %s characters.","Maksimumo: %s signoj."
"blocks","%s is the number of players you have blocked. Consider translating to ""%s blocked players"" if you think the context is not sufficient. Appears as a heading on your list of blocked players at https://lichess.org/rel/blocks","%s blocks","%s blokitaj ludantoj"
"listBlockedPlayers","""List"" is used as a verb here. This is a descriptive sentence which appears when you hover the mouse over the block icon on your own profile. Clicking the icon will show you a list of players you have blocked.","List players that you have blocked","Montri blokitajn ludantojn"
"human","Press this to play against a human player (instead of playing against the computer). Appears in the ""Create a game"" menu of the lichess mobile app: https://raw.githubusercontent.com/veloce/lichobile/1.5.x/screens/android/create-human.png. All mobile app sentences *must* be kept compact, as they need to scale to small devices.","Human","Homo"
"computer","Press this button to play against a computer player (instead of playing against a human being). Appears in the ""Create a game"" menu of the lichess mobile app: https://raw.githubusercontent.com/veloce/lichobile/1.5.x/screens/android/create-human.png. All mobile app sentences *must* be kept compact, as they need to scale to small devices.","Computer","Komputilo"
"side","Lets you select what side you want to play as (White, Black, or random). Appears in the ""Create a game"" menu of the lichess mobile app: https://raw.githubusercontent.com/veloce/lichobile/1.5.x/screens/android/create-human.png. All mobile app sentences *must* be kept compact, as they need to scale to small devices.","Side","Koloro"
"clock","Lets you select what time control you want to play with. Appears in the ""Create a game"" menu of the lichess mobile app: https://raw.githubusercontent.com/veloce/lichobile/1.5.x/screens/android/create-human.png. All mobile app sentences *must* be kept compact, as they need to scale to small devices.","Clock","Horloĝo"
"unauthorizedError","This is a generic sentence that usually appears when the player is not signed in, or when an incorrect password is entered. The sentence is only found in the lichess mobile app, and *must* be kept compact, as mobile sentences need to scale to small devices.","Access is unauthorized.","Aliro estas malpermesata."
"noInternetConnection","Descriptive sentence. Is only shown when your mobile device is lacking connectivity to the internet. The sentence is only found in the lichess mobile app, and *must* be kept compact, as mobile sentences need to scale to small devices.","No internet connection. You can still play offline from the menu.","Neniu interreta konekto. Vi ja povas ludi malkonektite de la menuo."
"connectedToLichess","Notifies the player they are successfully connected to the site. This is only for mobile users, because the mobile app can also work offline. The sentence is only found in the lichess mobile app, and *must* be kept compact, as mobile sentences need to scale to small devices.","You are now connected to lichess.org","Vi nun estas konektita al lichess.org"
"signedOut","Notifies the player that they have successfully signed out of their account. The sentence is only found in the lichess mobile app, and *must* be kept compact, as mobile sentences need to scale to small devices.","You have been signed out","Vi elsalutis"
"loginSuccessful","Notifies the player they are successfully logged in with their lichess username. The sentence is only found in the lichess mobile app, and *must* be kept compact, as mobile sentences need to scale to small devices.","You are now signed in","Vi ĵus ensalutis"
"playOnTheBoardOffline","""Over the board"" means playing locally, on the device, usually between two players sitting across from each other. Offline play is only available on the lichess mobile app and thus *must* be kept compact, as mobile sentences need to scale to small devices.","Over the board","Ludi fizike kun aliulo"
"playOfflineComputer","Press this button to play against a computer player (instead of playing against a human being). Appears in the ""Create a game"" menu of the lichess mobile app: https://raw.githubusercontent.com/veloce/lichobile/1.5.x/screens/android/create-human.png. All mobile app sentences *must* be kept compact, as they need to scale to small devices.","Computer","Ludi elrete kontraŭ komputilo"
"opponent","The name of your opponent. Currently appears only in the mobile app. You can see how it looks here: https://raw.githubusercontent.com/veloce/lichobile/1.5.x/screens/android/ai-menu.png","Opponent","Kontraŭulo"
"learn","One of the four menu sections. Contains links to training, openings, coordinates, and video library. ""Learn"" in this context is a verb.","Learn","Lerni"
"community","One of the four menu sections. Contains links to list of players, teams, forums, and Q&A.","Community","Komunumo"
"tools","One of the four menu sections. Contains links to board editor, analysis, import game, and advanced search.","Tools","Iloj"
"increment","Increment of the game. As increment in seconds. It appears only in mobile app in the game creation form. You can see it here: https://raw.githubusercontent.com/veloce/lichobile/1.5.x/screens/android/create-human.png","Increment","Pliiĝo"
"board","appears in mobile app on settings screen, let you choose the board theme. Just translate 'board'","Board","Tabulo"
"pieces","appears in mobile app on settings screen, let you choose the pieces theme. Just translate 'pieces'","Pieces","Ŝakpecoj"
"sharePGN","Pressing this button opens native share widget to share the PGN record. PGN is short for ""Portable Game Notation""; it is the way chess moves are recorded (1. e4 e5, and so on). The sentence is only found in the lichess mobile app, and *must* be kept short, as mobile sentences need to scale to small devices.","Share PGN","Disdoni PGN"
"playOnline","only in mobile app, on side menu. It is a menu label that helps to separate visually what is online from what is offline. *Must* be short","Play online","Ludi enrete"
"playOffline","only in mobile app, on side menu. It is a menu label that helps to separate visually what is online from what is offline. *Must* be short","Play offline","Ludi eksterrete"
"allowAnalytics","In mobile app settings, toggle to allow or not sending of anonymous app usage for statistics. Should be as short as possible.","Allow anonymous statistics","Permesi anoniman statistikon"
"shareGameURL","in mobile app on the game context menu, this button opens the native share widget to send the game URL. To keep very short.","Share game URL","Disdoni URL de la ludo"
"error.required","Error message when a text input fields is left blank. Appears in the registration form and preferences menu (https://lichess.org/account/email).","This field is required","Ĉi tiu kampo estas deviga"
"error.email","Error message for when the email address was typed in incorrectly. Appears in the registration form and preferences menu (https://lichess.org/account/email).","This email address is invalid","Ĉi tiu retadreso ne estas valida"
"error.email_acceptable","Error message for when people associate a disposable email address with their account (e.g. https://www.guerrillamail.com/) -- only permanent email addresses are permitted. Appears in the registration form and preferences menu (https://lichess.org/account/email).","This email address is not acceptable","Ĉi tiu retadreso estas malakceptata"
"error.email_unique","Error message for when you associate an account with an email address that is already in use by another account. Appears in the registration form and preferences menu (https://lichess.org/account/email).","This email address is already taken","Ĉi tiu retadreso jam estas uzata"
"blindfoldChess","Appears as a preference on the preference page. The user may choose to hide their pieces in order to emulate playing blindfold chess.","Blindfold chess (invisible pieces)","Blinda ŝako (nevideblaj ŝakpecoj)"
"moveConfirmation","Appears as a preference on the preference page. The user may choose to use an additional confirmation step when they make moves on the chess board.","Move confirmation","Konfirmo de movoj"
"inCorrespondenceGames","Appears as a selectable option for the ""move confirmation"" setting on the preference page. The user may choose to only have an extra confirmation step for moves they make in correspondence games.","Correspondence games","En korespondaj ludoj"
"ifRatingIsPlusMinusX","Appears as a selectable option for the ""let other players challenge you"" option. The user may choose to only accept challenges from within a certain rating range.","If rating is ± %s","Se taksado estas ± %s"
"onlyFriends","Appears as a selectable option for the ""let other players challenge you"" option. The user may choose to only accept challenges from friends.","Only friends","Nur amikoj"
"menu","Tooltip displayed when mouseover menu button viewable at the top of every lichess page.","Menu","Menuo"
"castling","Castling is a move in the game of chess involving a player's king and either of the player's original rooks. It is the only move in chess in which a player moves two pieces in the same move. Appears on board editor page (https://lichess.org/editor).","Castling","Arokado"
"whiteCastlingKingside","The option of whether white can still castle on the kingside. Appears as a setting on board editor page (https://lichess.org/editor).","White O-O","Blanko O-O"
"whiteCastlingQueenside","The option of whether white can still castle on the queenside. Appears as a setting on board editor page (https://lichess.org/editor).","White O-O-O","Blanko O-O-O"
"blackCastlingKingside","The option of whether black can still castle on the kingside. Appears as a setting on board editor page (https://lichess.org/editor).","Black O-O","Nigro O-O"
"blackCastlingQueenside","The option of whether black can still castle on the queenside. Appears as a setting on board editor page (https://lichess.org/editor).","Black O-O-O","Nigro O-O-O"
