"slow","Choose this option if you want your piece animation (movement) to be slow. Appears on your account preferences page: https://lichess.org/account/preferences","Slow","മന്ദം"
"insideTheBoard","Choose if you want to see the coordinates on the game board. Appears on your account preferences page: https://lichess.org/account/preferences","Inside the board","പലകയിൽ"
"outsideTheBoard","Choose if you want to see the coordinates outside the game board. Appears on your account preferences page: https://lichess.org/account/preferences","Outside the board","പലകക്ക് അപ്പുറം"
"onSlowGames","Choose this option if you only want to see the list of moves on slow games. Appears on your account preferences page: https://lichess.org/account/preferences","On slow games","വേഗം കുറഞ്ഞ കളികളിൽ"
"always","Appears on the preferences page https://lichess.org/account/preferences","Always","നിരന്തരം"
"inCasualGamesOnly","Choose this if you only want to allow takebacks on casual games. Casual games are games which are not rated, so you cannot gain or lose points from them. Appears on your account preferences page: https://lichess.org/account/preferences","In casual games only","സാധാരണ കളികളിൽ മാത്രം"
"whenPremoving","One of the options for promoting to a queen automatically. Appears on your account preferences page: https://lichess.org/account/preferences","When premoving","മുൻകൂട്ടിയുള്ള നീക്കത്തിൽ"
"whenTimeRemainingLessThanThirtySeconds","One of the options for claiming a draw when threefold repetition occurs. Appears on your account preferences page: https://lichess.org/account/preferences","When time remaining < 30 seconds","ശേഷിക്കുന്ന സമയം <30 സെക്കന്റുകൾ"
"difficultyEasy","Click this button to select easy as your difficulty. Appears on the training page when solving puzzles https://lichess.org/training/","Easy","ലളിതം"
"difficultyNormal","Choose this option if you want your piece animation (movement) to be normal. Appears on your account preferences page: https://lichess.org/account/preferences","Normal","സ്വാഭാവികം"
"difficultyHard","Click this button to select hard as your difficulty. Appears on the training page when solving puzzles https://lichess.org/training/","Hard","കഠിനം"
"xLeftANoteOnY","First %s is the name of the player that left a note, and the second %s is the player who got a note on their profile. Appears in the activity timeline on the left-hand side of the ""Play"" page (https://lichess.org/) after you have started following a player.","%s left a note on %s",""
"xCompetesInY","First %s is the name of the player that competes in a tournament, and the second %s is the tournament name. Appears in the activity timeline on the left-hand side of the ""Play"" page (https://lichess.org/) after you have started following a player.","%s competes in %s",""
"xAskedY","First %s is the name of the player that asked, and the second %s is the title of the question in Q&A. Appears in the activity timeline on the left-hand side of the ""Play"" page (https://lichess.org/) after you have started following a player.","%s asked %s","%sചോദിച്ചിരിക്കുന്നു %s"
"xAnsweredY","First %s is the name of the player that answered, and the second %s is the title of the question in Q&A. Appears in the activity timeline on the left-hand side of the ""Play"" page (https://lichess.org/) after you have started following a player.","%s answered %s","%s നൽകിയ ഉത്തരം %s"
"xCommentedY","First %s is the name of the player that commented, and the second %s is the title of the question in Q&A. Appears in the activity timeline on the left-hand side of the ""Play"" page (https://lichess.org/) after you have started following a player.","%s commented %s","%s അഭിപ്രായപ്പെട്ടിരിക്കുന്നത് %s"
"timeline","An activity timeline showing what people you follow on lichess have been up to. Appears on the main page under logotype https://lichess.org and https://lichess.org/timeline/more. Note: this only appears as soon as you follow a player on lichess.","Timeline","ജീവിതകാലം"
"seeAllTournaments","This text appears when you hover over the ""more"" link for ""open tournaments"" on the main page https://lichess.org/","See all tournaments","എല്ലാ പരമ്പരകളും കാണാം"
"starting","This text appears to the left of the ""join"" button and it informs you when the tournament is starting. To see an example click on an open tournament from the tournament page https://lichess.org/tournament.","Starting:","തുടങ്ങിയത്:"
"allInformationIsPublicAndOptional","This sentence appears under the header on the page where you change your profile https://lichess.org/account/profile","All information is public and optional.","എല്ലാ വിവരങ്ങളും പൊതുവായതും ഐച്ഛികവുമാണ്."
"yourCityRegionOrDepartment","This text appears under the field where you write your location. You can leave out the word ""your"" if it helps you. Appears in the profile editor: https://lichess.org/account/profile","Your city, region, or province.","നിങ്ങളുടെ നഗരം, മേഖല, അല്ലെങ്കിൽ ദേശം"
"biographyDescription","This sentence appears under the biography description box on the page where you edit your profile https://lichess.org/account/profile","Tell about you, what you like in chess, your favorite openings, games, players…","നിങ്ങളെ കുറിച്ച് പറയൂ, നിങ്ങൾക്ക് ചതുരംഗത്തിൽ എന്താണ് ഇഷ്ടo, നിങ്ങൾക്ക് ഇഷ്ടപ്പെട്ട തുടക്കങ്ങൾ, കളികൾ, കളിക്കാർ..."
"maximumNbCharacters","This text appears under the biography description box to inform you the maximum length your description can have. https://lichess.org/account/profile","Maximum: %s characters.","പരമാവധി: %s അക്ഷരങ്ങള്‍"
"blocks","%s is the number of players you have blocked. Consider translating to ""%s blocked players"" if you think the context is not sufficient. Appears as a heading on your list of blocked players at https://lichess.org/rel/blocks","%s blocks","%s തടയപ്പെട്ടവർ"
"listBlockedPlayers","""List"" is used as a verb here. This is a descriptive sentence which appears when you hover the mouse over the block icon on your own profile. Clicking the icon will show you a list of players you have blocked.","List players that you have blocked","നിങ്ങൾ തടഞ്ഞ കളിക്കാരുടെ പട്ടിക"
"human","Press this to play against a human player (instead of playing against the computer). Appears in the ""Create a game"" menu of the lichess mobile app: https://raw.githubusercontent.com/veloce/lichobile/1.5.x/screens/android/create-human.png. All mobile app sentences *must* be kept compact, as they need to scale to small devices.","Human","മനുഷ്യന്‍"
"computer","Press this button to play against a computer player (instead of playing against a human being). Appears in the ""Create a game"" menu of the lichess mobile app: https://raw.githubusercontent.com/veloce/lichobile/1.5.x/screens/android/create-human.png. All mobile app sentences *must* be kept compact, as they need to scale to small devices.","Computer","കമ്പ്യൂട്ടര്‍"
"side","Lets you select what side you want to play as (White, Black, or random). Appears in the ""Create a game"" menu of the lichess mobile app: https://raw.githubusercontent.com/veloce/lichobile/1.5.x/screens/android/create-human.png. All mobile app sentences *must* be kept compact, as they need to scale to small devices.","Side","വശം"
"clock","Lets you select what time control you want to play with. Appears in the ""Create a game"" menu of the lichess mobile app: https://raw.githubusercontent.com/veloce/lichobile/1.5.x/screens/android/create-human.png. All mobile app sentences *must* be kept compact, as they need to scale to small devices.","Clock","ഘടികാരം"
"unauthorizedError","This is a generic sentence that usually appears when the player is not signed in, or when an incorrect password is entered. The sentence is only found in the lichess mobile app, and *must* be kept compact, as mobile sentences need to scale to small devices.","Access is unauthorized.","പ്രവേശനം വിലക്കിയിരിക്കുന്നു."
"noInternetConnection","Descriptive sentence. Is only shown when your mobile device is lacking connectivity to the internet. The sentence is only found in the lichess mobile app, and *must* be kept compact, as mobile sentences need to scale to small devices.","No internet connection. You can still play offline from the menu.","ഇന്റർനെറ്റ് കണക്ഷൻ ഇല്ല. നിങ്ങൾക്ക് ഇപ്പോഴും പട്ടികയുടെ സഹായത്തോടെ ഓഫ്‌ലൈനായി കളിക്കാവുന്നതാണ്."
"connectedToLichess","Notifies the player they are successfully connected to the site. This is only for mobile users, because the mobile app can also work offline. The sentence is only found in the lichess mobile app, and *must* be kept compact, as mobile sentences need to scale to small devices.","You are now connected to lichess.org","നിങ്ങൾ ഇപ്പോൾ lichess.org ആയി ബന്ധപ്പെട്ടിരിക്കുന്നു"
"signedOut","Notifies the player that they have successfully signed out of their account. The sentence is only found in the lichess mobile app, and *must* be kept compact, as mobile sentences need to scale to small devices.","You have been signed out","നിങ്ങൾ സൈൻ ഔട്ട് ചെയ്തിരിക്കുന്നു"
"loginSuccessful","Notifies the player they are successfully logged in with their lichess username. The sentence is only found in the lichess mobile app, and *must* be kept compact, as mobile sentences need to scale to small devices.","You are now signed in","നിങ്ങൾ ഇപ്പോൾ സൈൻ ഇൻ ചെയ്തു"
"playOnTheBoardOffline","""Over the board"" means playing locally, on the device, usually between two players sitting across from each other. Offline play is only available on the lichess mobile app and thus *must* be kept compact, as mobile sentences need to scale to small devices.","Over the board","ചതുരംഗ പലകയിൽ"
"playOfflineComputer","Press this button to play against a computer player (instead of playing against a human being). Appears in the ""Create a game"" menu of the lichess mobile app: https://raw.githubusercontent.com/veloce/lichobile/1.5.x/screens/android/create-human.png. All mobile app sentences *must* be kept compact, as they need to scale to small devices.","Computer","കമ്പ്യൂട്ടർ"
"opponent","The name of your opponent. Currently appears only in the mobile app. You can see how it looks here: https://raw.githubusercontent.com/veloce/lichobile/1.5.x/screens/android/ai-menu.png","Opponent","എതിരാളി"
"learn","One of the four menu sections. Contains links to training, openings, coordinates, and video library. ""Learn"" in this context is a verb.","Learn","അഭ്യസിക്കുക"
"community","One of the four menu sections. Contains links to list of players, teams, forums, and Q&A.","Community","സമാജം"
"tools","One of the four menu sections. Contains links to board editor, analysis, import game, and advanced search.","Tools","ഉപകരണങ്ങൾ"
"increment","Increment of the game. As increment in seconds. It appears only in mobile app in the game creation form. You can see it here: https://raw.githubusercontent.com/veloce/lichobile/1.5.x/screens/android/create-human.png","Increment","കയറ്റം"
"board","appears in mobile app on settings screen, let you choose the board theme. Just translate 'board'","Board","പലക"
"pieces","appears in mobile app on settings screen, let you choose the pieces theme. Just translate 'pieces'","Pieces","കരുക്കൾ"
"sharePGN","Pressing this button opens native share widget to share the PGN record. PGN is short for ""Portable Game Notation""; it is the way chess moves are recorded (1. e4 e5, and so on). The sentence is only found in the lichess mobile app, and *must* be kept short, as mobile sentences need to scale to small devices.","Share PGN","PGN പങ്കുവെക്കുക"
"playOnline","only in mobile app, on side menu. It is a menu label that helps to separate visually what is online from what is offline. *Must* be short","Play online","ഓൺലൈൻ കളി"
"playOffline","only in mobile app, on side menu. It is a menu label that helps to separate visually what is online from what is offline. *Must* be short","Play offline","ഓഫ്‌ലൈൻ കളി"
"allowAnalytics","In mobile app settings, toggle to allow or not sending of anonymous app usage for statistics. Should be as short as possible.","Allow anonymous statistics","അജ്ഞാതമായ സ്ഥിതി വിവരണാനുമതി"
"shareGameURL","in mobile app on the game context menu, this button opens the native share widget to send the game URL. To keep very short.","Share game URL","കളിയുടെ URL പങ്കു വെക്കൂ"
"error.required","Error message when a text input fields is left blank. Appears in the registration form and preferences menu (https://lichess.org/account/email).","This field is required","ഈ ഭാഗം ആവശ്യമാണ്"
"error.email","Error message for when the email address was typed in incorrectly. Appears in the registration form and preferences menu (https://lichess.org/account/email).","This email address is invalid","ഈ ഇമെയിൽ വിലാസം അസാധുവാണ്"
"error.email_acceptable","Error message for when people associate a disposable email address with their account (e.g. https://www.guerrillamail.com/) -- only permanent email addresses are permitted. Appears in the registration form and preferences menu (https://lichess.org/account/email).","This email address is not acceptable","ഈ ഇമെയിൽ വിലാസം സ്വീകാര്യമല്ല"
"error.email_unique","Error message for when you associate an account with an email address that is already in use by another account. Appears in the registration form and preferences menu (https://lichess.org/account/email).","This email address is already taken","ഈ ഇമെയിൽ വിലാസം ഇതിനു മുന്നേ എടുത്തിട്ടുണ്ട്"
"blindfoldChess","Appears as a preference on the preference page. The user may choose to hide their pieces in order to emulate playing blindfold chess.","Blindfold chess (invisible pieces)","കണ്ണു കെട്ടിയ ചതുരംഗം (അദൃശ്യമായ കരുക്കൾ)"
"moveConfirmation","Appears as a preference on the preference page. The user may choose to use an additional confirmation step when they make moves on the chess board.","Move confirmation","നീക്കം സ്ഥിരീകരണം"
"inCorrespondenceGames","Appears as a selectable option for the ""move confirmation"" setting on the preference page. The user may choose to only have an extra confirmation step for moves they make in correspondence games.","Correspondence games","തത്തുല്യമായ കളികൾ"
"ifRatingIsPlusMinusX","Appears as a selectable option for the ""let other players challenge you"" option. The user may choose to only accept challenges from within a certain rating range.","If rating is ± %s","± %s ക്രമത്തിലാണോ"
"onlyFriends","Appears as a selectable option for the ""let other players challenge you"" option. The user may choose to only accept challenges from friends.","Only friends","സുഹൃത്തുക്കൾക്കു മാത്രം"
"menu","Tooltip displayed when mouseover menu button viewable at the top of every lichess page.","Menu","പട്ടിക"
"castling","Castling is a move in the game of chess involving a player's king and either of the player's original rooks. It is the only move in chess in which a player moves two pieces in the same move. Appears on board editor page (https://lichess.org/editor).","Castling","കേസ്‌ലിങ്"
"whiteCastlingKingside","The option of whether white can still castle on the kingside. Appears as a setting on board editor page (https://lichess.org/editor).","White O-O","വെള്ള O-O"
"whiteCastlingQueenside","The option of whether white can still castle on the queenside. Appears as a setting on board editor page (https://lichess.org/editor).","White O-O-O","വെള്ള O-O-O"
"blackCastlingKingside","The option of whether black can still castle on the kingside. Appears as a setting on board editor page (https://lichess.org/editor).","Black O-O","കറുപ്പ് O-O"
"blackCastlingQueenside","The option of whether black can still castle on the queenside. Appears as a setting on board editor page (https://lichess.org/editor).","Black O-O-O","കറുപ്പ് O-O-O"
"nbForumPosts","%s The number of times the user has posted on the forum (https://lichess.org/forum). Appears on profile pages. Example: https://lichess.org/@/thibault — Thibault has 3038 forum points as of the time of writing.","%s Forum Posts","ഫോറം കുറിപ്പുകൾ %s"
"tpTimeSpentPlaying","%s The total time the user has spent playing on Lichess. Appears on profile pages. Example: https://lichess.org/@/thibault/ has spent 15 days, 9 hours and 25 minutes playing at the time of writing.","Time spent playing: %s","ചെലവിട്ട സമയം: %s"
"watchGames","A button that allows users to watch the chess games of a particular player. Appears on profile pages. Example: Links to https://lichess.org/@/thibault/tv","Watch games","കളികൾ കാണാം"
"tpTimeSpentOnTV","%s The total time the user has spent watching Lichess TV (https://lichess.org/tv). Appears on profile pages. Example: https://lichess.org/@/thibault/ has spent 12 minutes watching at the time of writing.","Time on TV: %s","ടീവിയിൽ സമയം: %s"
"watch","One of the four menu sections. Contains links to Lichess TV, international events and the curated video library.","Watch","നോക്കാം"
"internationalEvents","Real-time worldwide chess tournaments, powered by FICS. Appears as a dropdown option on the menu bar as well as on menu page. Links to https://lichess.org/watch","International events","അന്താരാഷ്ട്ര പരമ്പരകൾ"
"videoLibrary","A carefully curated library of free chess videos. Appears as a dropdown option on the menu bar as well as on menu page. Links to https://lichess.org/video","Video library","വീഡിയോ ശേഖരം"
"mobileApp","Lichess' very own free and open source Android and IOS application. Appears on the footer of the menu page. Links to https://lichess.org/mobile","Mobile App","മൊബൈൽ ആപ്പ്"
"webmasters","Information on how webmasters can embed Lichess features such as the daily puzzle or Lichess TV. Appears on the footer of the menu page. Links to https://lichess.org/developers","Webmasters","വെബ് മാസ്റ്റേഴ്സ്"
"contribute","Information on how people can contribute to Lichess whether it be through code, translation or donation. Appears on the footer of the menu page. Links to https://lichess.org/help-lichess","Contribute","സംഭാവന"
"contact","A page detailing the ways in which one can contact Lichess. Appears on the footer of the menu page. Links to https://lichess.org/contact","Contact","സമ്പര്‍ക്കം"
"termsOfService","","Terms of Service","സേവന വ്യവസ്ഥകൾ"
"sourceCode","Lichess' source code repository. Appears on the footer of the menu page. Links to https://github.com/ornicar/lila","Source Code","സോഴ്സ് കോഡ്"
"simultaneousExhibitions","Clicking this takes you to a page all about simuls on Lichess, where you can see open, running and finished simuls, as well as create your own. Appears as one of the links at the top of the navigation bar and on menu page. Links to https://lichess.org/simul","Simultaneous exhibitions","ഈ വേളയിലെ പ്രദർശനങ്ങൾ"
"host","The person who created the simul. Appears as a column heading on https://lichess.org/simul","Host","ഹോസ്റ്റ്"
"createdSimuls","Appears as a heading on https://lichess.org/simul under which currently running and starting simuls are listed.","Newly created simuls","പുതിയ സിമുൽ"
"hostANewSimul","A button that allows players to create a new simul event. Appears on https://lichess.org/simul and links to https://lichess.org/simul/new","Host a new simul","ഒരു പുതിയ സിമുലിന് ആതിഥ്യം നൽകൂ"
"noSimulFound","A header warning when a simul event cannot be found. Displayed here https://lichess.org/simul/notfound","Simul not found","സിമുൽ കണ്ടെത്തിയില്ല"
"noSimulExplanation","When a simul event cannot be found a new page is displayed here https://lichess.org/simul/notfound notifying the user why and how to proceed.","This simultaneous exhibition does not exist.","ഈ ഒരേ സമയത്തുള്ള പ്രദര്ശനം നിലവിലില്ല."
"returnToSimulHomepage","A link to the simul homepage (https://lichess.org/simul/) displayed here https://lichess.org/simul/notfound","Return to simul homepage","സിമുൽ ഹോംപേജിലേക്ക് മടക്കം"
"aboutSimul","A short explanation about what a simul is on the simul homepage (https://lichess.org/simul)","Simuls involve a single player facing several players at once.",""
"aboutSimulImage","A short caption for the Bobby Fischer image found on the simul homepage (https://lichess.org/simul) after clicking'More...'","Out of 50 opponents, Fischer won 47 games, drew 2 and lost 1.",""
"aboutSimulRealLife","A short explanation about what a simul is on the simul homepage (https://lichess.org/simul) after clicking'More...'","The concept is taken from real world events. In real life, this involves the simul host moving from table to table to play a single move.",""
"aboutSimulRules","A short explanation about the rules of a simul found on the simul homepage (https://lichess.org/simul) after clicking'More...'","When the simul starts, every player starts a game with the host, who gets to play the white pieces. The simul ends when all games are complete.",""
"aboutSimulSettings","More explanations about lichess simuls, on the simul homepage (https://lichess.org/simul).","Simuls are always casual. Rematches, takebacks and ""moretime"" are disabled.",""
"create","A button that finalises the creation of some event. Found, for insance, at the bottom of the create simul form page (https://lichess.org/simul/new)","Create","തുടങ്ങുക"
"whenCreateSimul","A short explanation of what to expect from creating a simul. Found on the create simul form page (https://lichess.org/simul/new)","When you create a Simul, you get to play several players at once.",""
"simulVariantsHint","Explains the variants checkboxes found on the create simul form page (https://lichess.org/simul/new)","If you select several variants, each player gets to choose which one to play.",""
"simulClockHint","Explains the Fischer clock time control settings found on the create simul form page (https://lichess.org/simul/new)","Fischer Clock setup. The more players you take on, the more time you may need.",""
"simulAddExtraTime","Suggests adding extra time for the simul. Found on the create simul form page (https://lichess.org/simul/new)","You may add extra time to your clock to help cope with the simul.",""
"simulHostExtraTime","A setting for the simul host to add extra time. Found on the create simul form page (https://lichess.org/simul/new)","Host extra clock time",""
"lichessTournaments","A heading on the side of the tournaments homepage (https://lichess.org/tournament) under which the official tournaments of Lichess are listed.","Lichess tournaments","Lichess പരമ്പരകൾ"
"tournamentFAQ","A link to an FAQ page for Lichess tournaments. Links to https://lichess.org/tournament/help?system=arena and found on every tournament page as a small question mark.","Arena tournament FAQ","അറീന പരമ്പര"
"tournamentOfficial","All official (not user created) Lichess tournaments have this shown in said tournament's information box shows that appears on the top left of the screen.","Official","ഔദ്യോഗികമായ"
"timeBeforeTournamentStarts","Users creating new tournaments can decide when their tournament begins. Appears on the form used to create a new tournament (https://lichess.org/tournament/new)","Time before tournament starts","പരമ്പര തുടങ്ങുന്നതിനു മുൻപുള്ള സമയം"
"averageCentipawnLoss","ACPL. This is one of the categories of problems discovered by the computer analysis. Appears on the right hand side of pages with analyzed games.","Average centipawn loss",""
