"xCreatedTeamY","The first %s is the name of the player, and the second %s is the team the player created. Appears in the activity timeline on the left-hand side of the ""Play"" page (https://lichess.org/) after you have started following a player.","%s created team %s","%s നിർമിച്ച %s സംഘം"
"averageElo","This is the mean average rating of all players in the team. Appears on the information box on team pages. Example: https://lichess.org/team/linux","Average rating","ശരാശരി നിലവാരം"
"location","This is before an input box that lets you write where you are located (a city, town, or whatever you want to write in it). Appears in the ""Edit profile"" page (https://lichess.org/account/profile).","Location","സ്ഥലം"
"settings","Appears in the profile dropdown on the top-right of every page, and also as a heading. Please keep it short. Links to the settings page: https://lichess.org/account/preferences","Settings","ക്രമീകരണങ്ങള്‍"
"filterGames","Clicking this opens a menu that lets you define criteria by which you can filter games in the game list. This appears above and to the right of the game list on the ""Play"" page (https://lichess.org/). Note that ""filter"" does not necessarily mean ""reduce"". It is recommended to translate this as search engines such as Google Search, Yandex or Baidu do.","Filter games","മത്സരങ്ങള്‍ തരംതിരിക്കുക"
"reset","Clicking it resets all options back to their defaults. Appears in the ""Filter games"" sub-menu and your profile configuration (https://lichess.org/account/profile).","Reset","റീസെറ്റ് (പുനക്രമീകരിക്കുക)"
"apply","","Submit","പ്രയോഗിക്കുക"
"leaderboard","A table of the best players on Lichess. Appears on the ""Players"" page (https://lichess.org/people). Could be translated as ""Score table"" or even ""Best players"" (though it is recommended to avoid this) if your language has no equivalent.","Leaderboard","മികച്ച കളിക്കാര്‍"
"pasteTheFenStringHere","This is the placeholder text (greyed-out text that disappears when you click)  for FEN pasting, so you can play a game from a certain position against the computer. Appears in the ""Play with the computer"" menu (https://lichess.org/setup/ai).","Paste the FEN text here","FEN ടെക്സ്റ്റ്‌ ഇവിടെ കൊടുക്കുക"
"pasteThePgnStringHere","This is the placeholder text (greyed-out text that disappears when you click)  for importing games stored in PGN files. Appears in the ""Import game"" menu (https://lichess.org/paste).","Paste the PGN text here","PGN ടെക്സ്റ്റ്‌ ഇവിടെ കൊടുക്കുക"
"fromPosition","""From position"" means the game was started from a board set up in a non-standard way. Typically used to continue games. Appears on the pages of games started from position, as well as games lists on player profiles. Example: https://lichess.org/JHFiNdy2/black","From position","സ്ഥാനത്തു നിന്ന്"
"continueFromHere","Clicking this lets you continue the game from that position against the AI, or a friend. Appears as a button with two crossed swords on it, just below the board on game pages. Example: https://lichess.org/vyvcbk8s — click on any move, then click the ""Continue from here"" button.","Continue from here","ഇവിടെ മുതല്‍ പുനരാരംഭിക്കുക"
"importGame","This form lets you paste a PGN (Portable Game Notation), which imports the game into lichess. Links to https://lichess.org/paste. Appears as a tab in the ""Games"" pages.","Import game","മത്സരം അപ്പ്‌ലോഡ് ചെയ്യുക"
"nbImportedGames","%s is the number of games imported into the Lichess database using the ""Import games"" tool. Links to https://lichess.org/games/imported and is found on the left hand side of the ""Games"" pages.","%s Imported games","ഇറക്കിയ കളികൾ %s"
"thisIsAChessCaptcha","A ""CAPTCHA"" is, in short, a test to see if the user is human or a bot. You have probably comes across them before; they usually involve putting in a word or answering a question that only a human would know the answer to. CAPTCHAs appear before registering and when posting on the forum.","This is a chess CAPTCHA.","ഇതാണ് ചതുരംഗ ക്യാപ്ച്യ"
"clickOnTheBoardToMakeYourMove","Informs the player on how to complete the CAPTCHA test. Appears next to the chess CAPTCHA. CAPTCHAs appear before registering and when posting on the forum.","Click on the board to make your move, and prove you are human.","നിങ്ങളുടെ നീക്കം ചതുരംഗ പലകയിൽ ക്ലിക്ക് ചെയ്ത് മനുഷ്യൻ ആണെന്നു തെളിയിക്കൂ."
"notACheckmate","Appears next to the chess CAPTCHA when you make a wrong move. CAPTCHAs appear before registering and when posting on the forum.","Not a checkmate","അതൊരു അടിയറവ് അല്ല"
"colorPlaysCheckmateInOne","%s is the side that you are playing. Appears next to the chess CAPTCHA. CAPTCHAs appear before registering and when posting on the forum.","%s plays; checkmate in one move","%s കളിക്കാർ; അടിയറവ് ഒരു നീക്കം കൊണ്ട്"
"retry","Clicking this clears the board and lets you try again. Appears as a button when you get a chess CAPTCHA wrong. CAPTCHAs appear before registering and when posting on the forum.","Retry","വീണ്ടും ശ്രമിക്കുക"
"reconnecting","Informs the player that lichess is in the process of re-establishing a connection. Appears at the top of the page in red colour when lichess loses connection.","Reconnecting","വീണ്ടും ബന്ധപ്പെടുന്നു"
"onlineFriends","Appears as a heading for the friends box on the bottom-right hand corner of the screen; it is a list of friends that are on lichess right now. Translate simply as ""Friends"" if no good-sounding equivalent to ""Online friends"" or ""Connected friends"" exists in your language.","Online friends","ഓണ്‍ലൈന്‍ സുഹൃത്തുക്കള്‍"
"noFriendsOnline","Informs you that none of your friends are on lichess right now. Appears when the friends box is raised on the bottom-right hand corner of the page.","No friends online","സുഹൃത്തുക്കളാരും ഓണ്‍ലൈന്‍ ഇല്ല"
"findFriends","Clicking on this takes you to a page that suggests players that could be made friends based on how many times you have played with them. Appears as a button when you hover the mouse cursor over the friends box (when raised) on the bottom-right hand corner of the page, when none of your friends are online. Also appears as a heading on the page with suggested friends. Example: these are Thibault's suggested friends: https://lichess.org/@/thibault/suggestions","Find friends","സുഹൃത്തുക്കളെ കണ്ടെത്തുക"
"favoriteOpponents","The players you play most against. Appears in profile pages and leads to a table of favorite opponents. Example https://lichess.org/@/thibault/opponents — this lists the players Thibault plays most against.","Favorite opponents","ഇഷ്ടപ്പെട്ട എതിരാളികള്‍"
"follow","Clicking this lets you follow the player and find out what they have been up doing around lichess through the activity timeline. Appears as a mouseover text of the thumbs up symbol, which in turn appears on profile pages and player name information boxes. It is recommended to use the translation for this on Twitter, where the words were taken from in the interests of familiarity. Should be translated as a verb.","Follow","പിന്തുടരുക"
"following","Indicates that you are following the player. Replaces the ""Follow"" button, which appears on profile pages and in popups over player names. It is recommended to use the same translation for this as the one on Twitter, where the words were taken from in the interests of familiarity.","Following","പിന്തുടരുന്നു"
"unfollow","Clicking this makes you stop following that player. Appears when you hover the mouse cursor over the ""Following"" button, after you have followed the player. It is recommended to use the same translation for this as the one on Twitter, where the words were taken from in the interests of familiarity. Should be translated as a verb if possible.","Unfollow","പിന്തുടരുന്നത് നിര്‍ത്തുക"
"block","Clicking this blocks the user, which prevents you from challenging them to games and talking to them privately, among other things. Appears in profile pages and popups over players' names. Should be translated as a verb.","Block","തടയുക"
"blocked","Indicates that you have blocked the player. Replaces the ""Block"" button, which appears in profile pages and popups over players' names.","Blocked","തടഞ്ഞു"
"unblock","Appears when you hover the mouse cursor over the ""Blocked"" button, after you have blocked the player. Should be translated as a verb if possible.","Unblock","തടയുന്നത് നിര്‍ത്തുക"
"followsYou","Indicates that this player is following you. Appears on the informative popups that appear when you hover the mouse cursor over players' names.","Follows you","നിങ്ങളെ പിന്തുടരുന്നു"
"xStartedFollowingY","The two %s's are players' names. The first %s is the name of the follower, and the second %s is the name of the followed. Appears in the activity timeline on the left-hand side of the ""Play"" page (https://lichess.org/) after you have started following a player.","%s started following %s","%s പിന്തുടരാൻ %s തുടങ്ങി"
"nbFollowers","%s is the number of people that follow this player. Example: https://lichess.org/@/thibault — as of the time of writing, Thibault has 263 people following him.","%s followers","പിന്തുടർച്ചക്കാർ %s"
"nbFollowing","%s is the number of players this player is following. Example: https://lichess.org/@/thibault — as of the time of writing, Thibault is following 81 players.","%s following","%s പേർ പിന്തുടരുന്നു"
"more","Generic message that lets you view more. Appears on the left-hand side of https://lichess.org/people, which lets you view a list of connected players. Also appears on the activity timeline on the left-hand side of the ""Play"" page (https://lichess.org/) if there are too many messages in the timeline. ""More"" may be used in other places around Lichess in the future, so please make your translation as generic as possible.","More","കൂടുതൽ"
"memberSince","Tells how long the player has been a member of lichess. Appears on profile pages. For example, https://lichess.org/@/thibault has been a member since 2010-11-22.","Member since","അംഗമായത്"
"lastSeenActive","The last time a player was seen on the site; %s is a duration. Appears on profile pages. Example: https://lichess.org/@/thibault — ""Active 4 minutes ago"" (as of the time of writing).","Active %s","%s പേർ സജീവം"
"challengeToPlay","Clicking this lets you ask the player to play a game with you, and takes you to the game set-up view. Appears on profile pages and popups over player names as a mouseover text for the crossed swords symbol. Please translate ""Challenge"" as a verb if possible. Example. https://lichess.org/@/thibault.","Challenge to a game","ഒരു മത്സരത്തിനു ക്ഷണിക്കുക"
"player","Clicking on this lets you sort the list of games by player names. Appears as a column heading in the list of open games on the ""Play"" page (https://lichess.org/).","Player","കളിക്കാരന്‍"
"list","This is one of the two ways of sorting open games on the ""Play"" page (https://lichess.org/). Clicking it presents all games you can join in a list format.","List","പട്ടിക"
"graph","This is one of the two ways of sorting open games on the ""Play"" page (https://lichess.org/). Clicking it presents all games you can join on a graph, with x (time) and y (player rating) axes.","Graph","ഗ്രാഫ്"
"lessThanNbMinutes","%s is the number of minutes. Ticking this checkbox means that games that last less than 3 minutes will show up in the list of games. The sentence appears in the ""Filter games"" menu, which can be accessed through the ""Play"" page (https://lichess.org).","Less than %s minutes","%s നിമിഷങ്ങൾക്ക് ഉള്ളിൽ"
"xToYMinutes","%s, in both cases, is the number of minutes. Ticking this checkbox means that games that last certain predefined amounts (e.g. Blitz is 3 to 8 minutes) will show up in the list of games. The sentence appears in the ""Filter games"" menu, which can be accessed through the ""Play"" page (https://lichess.org).","%s to %s minutes","%s മുതൽ %s വരെ മിനിട്ടുകള്‍"
"textIsTooShort","Error message that indicates the text put in the form is too short. Appears in forms around the site of all kinds, including registration and team creation.","Text is too short.","വാചകം വളരെ ചെറുതാണ്."
"textIsTooLong","Error message that indicates the text put in the form is too long. Appears in forms around the site of all kinds, including registration and team creation.","Text is too long.","വാചകം വളരെ വലുതാണ്."
"required","Error message that indicates that some required text fields in the form were not filled in. Appears in forms around the site of all kinds, including registration and team creation.","Required.","നിർബന്ധമാണ്."
"openTournaments","""Open"" here means you can join the tournament. Below it is a list of tournaments you are able to join. Appears as a heading on https://lichess.org/tournament and also on the ""Play"" page (https://lichess.org/)","Open tournaments","തുറന്ന മൽസര പരമ്പരകൾ"
"duration","Length of the tournament in minutes. Appears on the left-hand side box on the pages of tournaments. Example: https://lichess.org/tournament/67hj23c2","Duration","ദൈര്‍ഘ്യം"
"winner","Indicates the player won the tournament. This is the mouseover text of the trophy icon on tournaments pages. Example: https://lichess.org/tournament/67hj23c2","Winner","ജേതാവ്‌"
"standing","Shows the order of the players in a tournament, ordered by their score. Could be translated as ""position"" or ""score"" if your language has no equivalent. Appears in the left-most column on the pages of individual tournaments. Example: https://lichess.org/tournament/67hj23c2","Standing","സ്ഥാനത്തു നിൽക്കുന്നു"
"createANewTournament","Clicking this lets you create a new tournament. Appears as a heading and a button on the tournament creation page, among other places. Links to https://lichess.org/tournament/new.","Create a new tournament","ഒരു പുതിയ മൽസര പരമ്പര തുടങ്ങാം"
"join","Clicking this lets you enter the tournament. This button is found on the ""Play"" (https://lichess.org) and ""Tournaments"" (https://lichess.org/tournament) pages.","Join","പങ്കെടുക്കാം"
"withdraw","Clicking this makes you withdraw from (leave) the tournament you have entered. Appears on the tournament page after you have entered it.","Withdraw","റദ്ദാക്കുക"
"points","The number of points the player has attained in this tournament. Appears as a column heading on tournament pages. Example: https://lichess.org/tournament/67hj23c2","Points","പോയിന്റുകൾ"
"wins","The number of games the player has won in this tournament. Appears as a column heading on tournament pages. Example: https://lichess.org/tournament/67hj23c2","Wins","ജയങ്ങൾ"
"losses","The number of games the player has lost in this tournament. Appears as a column heading on tournament pages. Example: https://lichess.org/tournament/67hj23c2","Losses","പരാജയങ്ങൾ"
"winStreak","The number of games the player won consecutively without losing. Appears as a column heading on tournament pages. Example: https://lichess.org/tournament/67hj23c2 — Thibault won all 6 games in a row, jordach 3 and graphitemaster 2.","Win streak","വിജയ രേഖ"
"createdBy","This appears in a box on the top-left hand corner of tournament pages. The sentence is followed by the name of the player that created it. Example: https://lichess.org/tournament/gwlomxqd — ""Created by thibault"".","Created by","നിർമ്മാണം"
"tournamentIsStarting","Appears as a pop-up when the tournament you have joined is about to start.","The tournament is starting","പരമ്പര തുടങ്ങുന്നു"
"membersOnly","Ticking this checkbox makes the game so only lichess members can join it. Appears in the game creation menu (https://lichess.org/setup/hook).","Members only","അംഗങ്ങൾക്ക് മാത്രം"
"boardEditor","The board editor lets you prepare a chess board and play from the position you set up. Appears as a heading on the editor page, and also as a tab in the ""Games"" pages. Links to https://lichess.org/editor","Board editor","പലക ചിട്ടപ്പെടുത്തുക"
"startPosition","Clicking this resets the state of the board to the starting position in standard chess. Being a board editor feature, it appears on the board editor's page — https://lichess.org/editor","Starting position","പ്രാരംഭ സ്ഥാനം"
"clearBoard","Clicking this removes all the pieces from the chess board you are setting up. Being a board editor feature, it appears on the board editor's page — https://lichess.org/editor","Clear board","പലക വ്യക്തമാക്കുക"
"savePosition","This sentence is not currently used on the site, but feel free to translate it","Save position","സ്ഥാനം കാത്തു വെക്കാം"
"loadPosition","Clicking this opens a form that lets you paste a FEN text (FEN is a notation system used to store precise positions on a board). Being a board editor feature, it appears on the board editor's page — https://lichess.org/editor","Load position","സ്ഥാനത്തു നിന്ന്"
"isPrivate","Means the tournament you are looking at is protected with a password. Appears in the information box on the tournament's page. Example: https://lichess.org/tournament/67hj23c2","Private","സ്വകാര്യം"
"reportXToModerators","%s is the name of the player. Clicking this will take you to a form where you can report the player for things like cheating and trolling. Appears on player profiles.","Report %s to moderators","നിയന്ത്രകരോട് %s നെ സൂചിപ്പിക്കാം"
"profile","Links to your player profile (account). Appears in the drop-down menu for your name at the navigation bar on the top of every page on lichess.","Profile","രൂപരേഖ"
"editProfile","Clicking this lets you edit the information about you displayed on your player profile. Appears on your profile page and also as a heading and tab on the preferences configuration pages. Links to https://lichess.org/account/profile","Edit profile","രൂപരേഖ തിരുത്താം"
"firstName","Also known as a ""first name"", ""forename"" or even ""Christian name"" in some countries. This sentence appears in the ""Edit profile"" menu (https://lichess.org/account/profile). Translate to whatever best describes this in your language or culture.","Given name","നൽകിയ പേര്"
"lastName","Also known as ""surname"" or ""family name"". You put in your last name in this field, which will in turn appear on your profile page. This sentence appears in the ""Edit profile"" menu (https://lichess.org/account/profile). Translate to whatever best describes this in your language or culture.","Last name","അവസാന പേര്"
"biography","This is next to a text field where you can write anything you wish to describe yourself. For example, https://lichess.org/@/thibault reads ""I write bugs for lichess.org"". This sentence appears in the ""Edit profile"" menu (https://lichess.org/account/profile).","Biography","ജീവചരിത്രം"
"country","This is a field for the country you are located at. Appears on player profiles (example: https://lichess.org/@/thibault). The sentence appears in the ""Edit profile"" menu (https://lichess.org/account/profile).","Country","രാജ്യം"
"preferences","Lets you configure lichess so it responds the way you prefer. Appears in the profile drop-down menu at the top of all pages when signed in. Links to https://lichess.org/account/preferences","Preferences","പരിഗണനകൾ"
"watchLichessTV","Clicking this take you to the TV page, where you can watch the current game being aired on lichess TV. Appears on the ""Play"" page (https://lichess.org/) below the miniboard showing the current TV game, as well as appearing as a tab on the ""Games"" pages (https://lichess.org/games). Links to https://lichess.org/tv — the TV page. Please keep this sentence as short as possible.","Watch Lichess TV","കാണാം Lichess TV"
"previouslyOnLichessTV","A list of games that were aired on lichess TV before. Appears as a heading to a box below the board on the TV page (https://lichess.org/tv).","Previously on Lichess TV","Lichess TV യിൽ നേരെത്തെയുള്ളത്"
"onlinePlayers","A list of players that are connected right now. Appears as a heading on https://lichess.org/people","Online players","ഓൺലൈൻ കളിക്കാർ"
"activeToday","A list of players ordered by how many games they played today. Appears as a heading on the ""Players"" page (https://lichess.org/people).","Active today","ഇന്ന് സജീവമായ"
"activePlayers","A list of players ordered by how many games they have played over the last 30 days. Appears as a heading on the ""Players"" page (https://lichess.org/people).","Active players","സജീവ കളിക്കാർ"
"bewareTheGameIsRatedButHasNoClock","Warning message that appears when you are about to join a game of unlimited time. This is only for games created via the ""Play with a friend"" menu (https://lichess.org/setup/friend), as creating public rated games with no time control is not allowed.","Beware, the game is rated but has no clock!","നോക്കൂ, ഈ കളി ക്രമപ്പെടുത്തിയതാണ്. പക്ഷെ സമയ പരിധിയില്ല!"
"training","A page that offers chess puzzles. These help you improve how you play chess. Could also be translated as ""Practise"" (verb) or a similar word. This appears as one of the links on the navigation bar at the top of every page, so it should be kept as short as possible. Links to https://lichess.org/training","Training","പരിശീലനം"
"yourPuzzleRatingX","%s is your numerical puzzle rating. Appears in a box left of the board on the ""Training"" page (https://lichess.org/training), above the graph.","Your puzzle rating: %s","നിങ്ങളുടെ സമസ്യ ക്രമം: %s"
"findTheBestMoveForWhite","Informs the player what side they are playing. Appears on the right-hand side of the puzzle trainer, on the ""Training"" page (https://lichess.org/training).","Find the best move for white.","വെള്ളയുടെ ഉത്തമ നീക്കം കണ്ടു പിടിക്കൂ"
"findTheBestMoveForBlack","Informs the player what side they are playing. Appears on the right-hand side of the puzzle trainer, on the ""Training"" page (https://lichess.org/training).","Find the best move for black.","കറുപ്പിന്റെ ഉത്തമ നീക്കം കണ്ടു പിടിക്കൂ."
"toTrackYourProgress","Encourages the player to register. Below this message is a ""Register"" button. Appears in a box left of the board on the ""Training"" page (https://lichess.org/training) when trying puzzles and not being signed in.","To track your progress:","നിങ്ങളുടെ നിലവാരം പിന്തുടരാൻ:"
"trainingSignupExplanation","Encourages the player to register an account to enjoy Lichess's ""Training"" feature more. Appears below the ""Register"" button when doing chess puzzles without being logged in, in a box left of the board on the ""Training"" page (https://lichess.org/training).","Lichess will provide puzzles that match your ability, making for better training sessions.","മികച്ച പരിശീലന കളരികളിലേക്കു നിങ്ങളുടെ കഴിവിനൊത്തുള്ള സമസ്യകൾ Lichess ലഭ്യമാക്കും."
"puzzleId","%s is the number of the puzzle. This means the way it appears on the site will be something like ""Puzzle 5705"". Appears on the ""Training"" page (https://lichess.org/training).","Puzzle %s","%s സമസ്യ"
"puzzleOfTheDay","A random chess puzzle presented on right-hand side the ""Play"" page (https://lichess.org). As the name suggests, there is a different puzzle every day.","Puzzle of the day","ഇന്നത്തെ സമസ്യ"
