"playWithAFriend","One of the 3 rectangular buttons on the ""Play"" page (https://lichess.org/). This creates a unique URL that you can send to someone and play.","Play with a friend","സുഹൃത്തിനോടൊപ്പം കളിക്കുക"
"playWithTheMachine","One of the 3 rectangular buttons on the ""Play"" page (https://lichess.org/). Translate ""machine"" as ""[chess] engine"" if it sounds better in your language, omitting the word ""chess"".","Play with the machine","മെഷീനോടൊത്തു മത്സരിക്കുക"
"toInviteSomeoneToPlayGiveThisUrl","This appears after you have created a game for a friend (through the ""Play with a friend"" menu). Feel free to translate ""URL"" as ""address"", or whatever is most familiar in your language.","To invite someone to play, give this URL","മറ്റാരുടെയെങ്കിലും കൂടെ മത്സരിക്കുവാനായി ഈ ലിങ്ക് നല്കുക"
"gameOver","This appears in the right-hand side box when a game ends.","Game Over","കളി അവസാനിച്ചിരിക്കുന്നു"
"waitingForOpponent","Indicates you are waiting for an opponent to join your game. This appears after you have created a public game (through the ""Create a game"" menu).","Waiting for opponent","മൽസരാർഥിക്കായി കാത്തിരിക്കുന്നു"
"waiting","This appears in the challenges box, when you are waiting for the opponent the accept the challenge.","Waiting","കാത്തിരിക്കുന്നു"
"yourTurn","This appears in the box while you are playing a game. It indicates it is your turn to play.","Your turn","താങ്കളുടെ ഊഴം"
"aiNameLevelAiLevel","AI name and level, e.g. ""Stockfish level 3"". Note that the ""Stockfish"" part will always be first no matter where you place the %s, though you can rearrange them to e.g. ""%s at %s levels"", which would produce e.g. ""Stockfish at 3 levels"". Use the translation that sounds best in your language. Appears in the box on the left-hand side in the page of the game, and also on your profile, in the list of games.","%s level %s","%s തരം %s"
"level","This appears in the ""Play with the machine"" menu (https://lichess.org/setup/ai) as a heading. Below it are skill levels (1 through 8) of the AI that you can play against.","Level","തരം"
"toggleTheChat","Turns the chat room (or player chat) on or off. This is the mouseover text of the checkbox on the top-right of the chat box.","Toggle the chat","സംഭാഷണം തുടങ്ങുകയോ നിര്തുകയോ ചെയ്യുന്നതിന്"
"toggleSound","Clicking this turns sound on or off. This is a button on the top-right hand corner of the screen. If you use the Internet Explorer browser, you may not be able to see this.","Toggle sound","ശബ്ദം തുടങ്ങുകയോ നിര്തുകയോ ചെയ്യുന്നതിന്"
"chat","Start a conversation with a player. Appears in the user tooltip when hovering a user name.","Chat","സംഭാഷണം"
"resign","Clicking this makes you resign from the game. Small button in the box on the right while playing a game.","Resign","കീഴടങ്ങുക"
"checkmate","Appears in the box of a game if you end a game by checkmate.","Checkmate","ചെക്ക്മേറ്റ്"
"stalemate","If you do not know what this rule is, see https://www.chessvariants.org/d.chess/matefaq.html. Appears in the box of a game if you end a game by stalemate. Please use the official term used by your country's or locale's chess federation or club.","Stalemate","സ്റ്റെൽമേറ്റ്"
"white","The mouseover text of the White King button in the game creation menus (e.g. ""Create a game"", ""Play with a friend"") on the ""Play"" page.","White","വെളുപ്പ്‌"
"black","The mouseover text of the Black King button in the game creation menus (e.g. ""Create a game"", ""Play with a friend"") on the ""Play"" page.","Black","കറുപ്പ്"
"randomColor","Makes Lichess randomly pick a side (White or Black) for you. The mouseover text of the large button in the game creation menus (e.g. ""Create a game"", ""Play with a friend"") on the ""Play"" page.","Random side","ഏതെങ്കിലും നിറം"
"createAGame","This button opens a menu (https://lichess.org/setup/hook) that lets you create a game that is listed in the list (or graph) of open games. It is one of the 3 rectangular buttons on the ""Play"" page (https://lichess.org/).","Create a game","പുതിയ കളി തുടങ്ങുക"
"whiteIsVictorious","Indicates the white player won the game. This appears in the top left box of a game, and also the player profile.","White is victorious","വെള്ള വിജയിച്ചു"
"blackIsVictorious","Indicates the black player won the game. This appears in the top left box of a game, and also the player profile.","Black is victorious","കരപ്പു വിജയിച്ചു"
"kingInTheCenter","Indicates that the game was won by the King being in one of the center tiles (King of the hill variant: https://lichess.org/king-of-the-hill).","King in the center","രാജാവ്‌ മധ്യത്തില്‍"
"threeChecks","Indicates that the game was won by a player checking their opponent three times. Only for the Three-check variant.","Three checks","മൂനു ചെക്ക്"
"raceFinished","Ending message of a Racing Kings game (https://lichess.org/variant/racingKings).","Race finished","ഓട്ടം അവസാനിച്ചിരിക്കുന്നു"
"variantEnding","Indicates that the game was won due to variant special rules. Shown when no more specialized message is available.","Variant ending","വ്യത്യാസപ്പെട്ട സമാപ്തി"
"newOpponent","Clicking this takes you back to the ""Play"" page (https://lichess.org). This is a button that appears at the end of a game just below the ""Rematch"" button.","New opponent","പുതിയ എതിരാളി"
"yourOpponentWantsToPlayANewGameWithYou","This sentence appears when your opponent offers you a rematch.","Your opponent wants to play a new game with you","നിങ്ങളുടെ എതിരാളിക്ക് നിങ്ങളുമായി ഒരു പുതിയ മത്സരം കളിക്കണം"
"joinTheGame","Clicking this lets you join a new game against the same opponent. This is one of the two buttons that appear when your opponent offers you a rematch.","Join the game","കളിയിൽ ചേരുക"
"whitePlays","This is what a spectator sees in the right-hand box when watching a game and it is White's turn to play.","White to play","വെള്ള കളിക്കുക"
"blackPlays","This is what a spectator sees in the right-hand box when watching a game and it is Black's turn to play.","Black to play","കറുപ്പു കളിക്കുക"
"theOtherPlayerHasLeftTheGameYouCanForceResignationOrWaitForHim","This appears after 3 minutes have elapsed with one player disconnected. Below it are two buttons: ""Claim victory"" and ""Call draw"".","The other player may have left the game. You can claim victory, call the game a draw, or wait.","മറ്റേ കളിക്കാര൯ പോയിരിക്കാം. വിജയം വിളിക്കാം, കളി സമനിലയിൽ വിളിക്കാം, അല്ലെങ്കിൽ കാത്തിരിക്കാം."
"makeYourOpponentResign","The mouseover text of ""Claim victory"". You do not have to translate it like this; you can translate to e.g. ""Force victory"", or whatever best explains the button in your language. Mouseover texts can be as long as you want, within reason.","Make your opponent resign","എതിരാളിയെ രാജി വെപ്പിക്കുക"
"forceResignation","Clicking this ends the game and grants you the win. One of the two buttons that appears when your opponent leaves the game.","Claim victory","വിജയം പ്രഖ്യാപിക്കുക"
"forceDraw","Clicking this draws the game. It is considered the more ""chivalrous"" option of the two. One of the two buttons that appears when your opponent leaves the game.","Call draw","സമനില പ്രഖ്യാപിക്കുക"
"talkInChat","Chat input placeholder, encouraging players to behave. Visible in every chat, like on https://lichess.org/tournament/summer15. Keep it short so it fits in the input box.","Please be nice in the chat!","ദയാലു ആയി സല്ലാപിക്കുക"
"theFirstPersonToComeOnThisUrlWillPlayWithYou","Informs you that Lichess waiting for your friend to visit the link. This appears at the top of the pane after you have created a game through the ""Play with a friend"" menu.","The first person to come to this URL will play with you.","ഈ ലിങ്കിൽ വരുന്ന ആദ്യത്തെ വ്യക്തി നിങ്ങളുമായി കളിക്കും"
"whiteResigned","This sentence appears in the right hand-side box in a game, the list of games on the profile, and also the left hand-side box in a game when the White player resigns from the game.","White resigned","വെള്ള രാജി വെച്ചു"
"blackResigned","This sentence appears in the right hand-side box in a game, the list of games on the profile, and also the left hand-side box in a game when the Black player resigns from the game.","Black resigned","കറുപ്പു രാജി വെച്ചു"
"whiteLeftTheGame","This appears when the White player leaves the game either by aborting or by being absent for too long. It can found in the right hand-side box in a game, the list of games on the profile and also the left hand-side box in a game.","White left the game","വെള്ള ഉപേക്ഷിച്ചു"
"blackLeftTheGame","This sentence appears when the Black player leaves the game either by aborting or by being absent for too long. It can found in the right hand-side box in a game, the list of games on the profile and also the left hand-side box in a game.","Black left the game","കറുപ്പു ഉപേക്ഷിച്ചു"
"shareThisUrlToLetSpectatorsSeeTheGame","The mouseover text of the link just below the board which you can send to people so they can watch the game.","Share this URL to let spectators see the game","കാണികളുമായി  ഈ ലിങ്ക് പങ്കിടുക"
"theComputerAnalysisHasFailed","This is an error message that appears when the computer analysis cannot be displayed for some reason. It appears the ""Computer analysis"" tab.","The computer analysis has failed","കമ്പ്യൂട്ടർ പരിശോധന പരാജയപ്പെട്ടു"
"viewTheComputerAnalysis","Clicking this button takes you to the computer analysis. The sentence appears only for the player that requested it, in the ""Computer analysis"" tab.","View the computer analysis","കമ്പ്യൂട്ടർ പരിശോധന നോക്കുക"
"requestAComputerAnalysis","Clicking this puts the game in the queue for computer analysis, which is usually completed within a minute. This is one of the actions below the board in the ""Replay and analyse"" view.","Request a computer analysis","കമ്പ്യൂട്ടർ പരിശോധന അപേക്ഷിക്കുക"
"computerAnalysis","An automated analysis of a game performed by lichess. It provides an advantage charts and possible variation for a game. Appears as a tab below the chess board in replay and analysis views. Example: https://lichess.org/vyvcbk8s","Computer analysis","കമ്പ്യൂട്ടർ പരിശോധന"
"analysis","Button that leads to analysis page. Appears only on your own games, after they have finished.","Analysis board","പരിശോധന പലക"
"blunders","This is one of the categories of problems discovered by the computer analysis. If no equivalent word exists, translate to ""Serious mistakes"".","Blunders","മണ്ടത്തരം"
"mistakes","This is one of the categories of problems discovered by the computer analysis. Appears on the right hand side of pages with analyzed games. Example: https://lichess.org/vyvcbk8s","Mistakes","തെറ്റുകൾ"
"inaccuracies","The most minor of errors a player can make. This is one of the categories of problems discovered by the computer analysis.","Inaccuracies","പിഴകൾ"
"moveTimes","Time spent on each move by the players. Appears as a tab in the ""Replay and analyse"" view, below the chess board. Example: https://lichess.org/6iaj1eh0","Move times","മാറ്റങളുടെ സമയങൾ"
"flipBoard","Clicking this flips the board upside-down. This sentence is one of the links in the box normally below the board.","Flip board","ബോര്‍ഡ്‌ തിരിക്കുക"
"threefoldRepetition","This is one of the conditions by which a game ends. It appears on the box on the right-hand side of the screen. It also appears in player profiles. Please use the official term used by your country's or locale's chess federation or club.","Threefold repetition","മൂന്നാമതും ആവര്‍ത്തിച്ചിരിക്കുന്നു"
"claimADraw","Clicking this draws the game. This a button that appears to players when threefold repetition occurs.","Claim a draw","സമനില ആവശ്യപ്പെടുക"
"offerDraw","Clicking this send an offer to draw the game to your opponent. This is a small button in the right-hand side box.","Offer draw","സമനിലയ്ക്ക് സമ്മതിക്കുക"
"draw","This appears in various places, including players' profiles and the right-hand side boxes in individual games. It should be translated as a noun, NOT as a verb.","Draw","സമനില"
"nbConnectedPlayers","The %s is the counter of how many players are connected right now. This sentence is displayed at the top of every page on lichess.","%s players","%s കളിക്കാർ"
"gamesBeingPlayedRightNow","This is a shorter phrase for ""Games being played right now"". It is what the link at the top that says ""Games"" links to (https://lichess.org/games). Please try to keep your translation as short as possible.","Current games","ഇപ്പോഴത്തെ കളികൾ"
"viewAllNbGames","%s here is the number of all the games ever played on Lichess. Links to https://lichess.org/games/all.","%s Games","%s കളികൾ"
"viewNbCheckmates","%s is the number of all the games that ended in checkmate on Lichess. Links to https://lichess.org/games/checkmate and is found on the left hand side of the ""Games"" pages.","%s Checkmates","%s അടിയറവ്"
"nbBookmarks","%s is the number of games you have bookmarked. Links to https://lichess.org/games/bookmark. It only appears to registered users that have bookmarked certain games. It displays a list of your bookmarked games.","%s Bookmarks","%s സൂചികകൾ"
"nbPopularGames","%s is the number of games with one or more bookmarks. Links to https://lichess.org/games/popular. It is a list of games bookmarked by many people.","%s Popular games","ജനപ്രീതിയാര്‍ജ്ജിച്ച %s കളികൾ"
"nbAnalysedGames","%s is the number of games with a complete computer analysis. Links to https://lichess.org/games/analysed. It is a list of any game that has had a computer analysis performed on it.","%s Analysed games","അപഗ്രഥിച്ച %s കളികൾ"
"viewInFullSize","Clicking one of these small boards brings you to the game's unique page. This is the mouseover text of the small chess boards dotted around the site. These small boards are most prominent in the ""Games"" pages (https://lichess.org/games).","View in full size","പൂര്‍ണ രൂപത്തില്‍ കാണുക"
"logOut","Clicking this signs you out of your lichess profile. This is part of the profile drop-down menu on the top of every page when you are signed in to an account.","Sign out","സൈന്‍ ഔട്ട്‌"
"signIn","Clicking takes you to a form that allows you to sign into your lichess profile (account). This is a red-coloured button that appears at the navigation bar at the top when you are not signed in to an account, or playing anonymously. Please keep it as short as possible.","Sign in","സൈന്‍ ഇന്‍"
"newToLichess","It is next to a button that allows you to register an account on the website. The translation should be friendly and inviting; free/loose translations are recommended for this sentence. This sentence appears on the ""Sign in"" page.","New to Lichess?","Lichessൽ ആദ്യമാണോ?"
"youNeedAnAccountToDoThat","This error message appears when trying actions or going to pages that require being signed in with a user account.","You need an account to do that","ഇത് ചെയ്യണമെങ്കില്‍ നിങ്ങള്‍ക്ക് ഒരു അക്കൗണ്ട്‌ വേണം"
"signUp","Clicking this allows you to register an account. Appears as a button on the ""Sign in"" page and the ""Training"" page (https://lichess.org/training) when playing unregistered (encouraging the player to register an account with Lichess). It is recommended to translate this word as a verb.","Register","രജിസ്റ്റര്‍"
"computersAreNotAllowedToPlay","The text users read when creating an account. Appears in the registration (new account) form (https://lichess.org/signup).","Computers and computer-assisted players are not allowed to play. Please do not get assistance from chess engines, databases, or from other players while playing. Also note that making multiple accounts is strongly discouraged and excessive multi-accounting will lead to being banned.","കമ്പ്യൂട്ടറുകള്‍ക്കും കമ്പ്യൂട്ടര്‍ സഹായമുള്ള കളിക്കാര്‍ക്കും കളിക്കാന്‍ അനുവാദമില്ല. ദയവായി കളിക്കിടെ ചെസ്സ്‌ എഞ്ചിനുകളുടെയോ ഡാറ്റാബേസുകളുടെയോ മറ്റു കളിക്കാരുടെയോ സഹായം തേടരുത്. നിരവധി അക്കൗണ്ടുകളുണ്ടാക്കുന്നത് ശക്തമായി നിരുത്സാഹപ്പെടുത്തുകയും അങ്ങനെ ചെയ്താല്‍ വിലക്കേര്‍പ്പെടുത്തും എന്നും പ്രത്യേകം ശ്രദ്ധിക്കുക."
"games","The page displays games currently being played and has links to various other tools on the site to find out about past games on lichess, such as a search engine that queries the database of games. ""Games"" is one of the links at the top of every page, so keep it as short as possible. Links to https://lichess.org/games","Games","കളികള്‍"
"forum","It is Lichess's webforum, where users can discuss various topics, chess-related or not. These are sometimes called ""bulletin boards"". ""Forum"" is one of the links at the top of every page, so keep it as short as possible. Links to https://lichess.org/forum","Forum","ഫോറം"
"xPostedInForumY","The first %s is the player's name and the second %s is the title of the topic in the forum. By ""topic"" here we mean a discussion, sometimes called a ""thread"" in this context. Appears in the activity timeline on the left-hand side of the ""Play"" page (https://lichess.org/) after you have started following a player.","%s posted in topic %s","%s കുറിച്ചു %s എന്ന വിഷയത്തെ പറ്റി"
"latestForumPosts","A list of the most recent posts on the forum. Appears as a heading to a box near the bottom of the ""Play"" page (https://lichess.org/).","Latest forum posts","ഏറ്റവും പുതിയ ഫോറം പോസ്റ്റുകള്‍"
"players","Some have been translating as ""[Chess] Players"". This is acceptable only if it is one word (e.g. ""Szachiści"" in Polish). Otherwise, keep just translate to ""Players"". This appears as one of the links on the navigation bar at the top of every page.  Links to https://lichess.org/people","Players","കളിക്കാര്"
"minutesPerSide","This appears in all the game creation menus (e.g. ""Create a game"", ""Play with a friend"") after you have ticked ""Time control"". Below it is a slider that lets you select how many minutes each player will have on their chess clock.","Minutes per side","ഇരുഭാഗത്തും അനുവദിച്ച മിനിറ്റുകള്‍"
"variant","This appears in all the game creation menus (e.g. ""Create a game"", ""Play with a friend""). Below it is a selection of variants the player can choose from, such as Standard, Chess960, or King of the Hill.","Variant","വ്യത്യാസം"
"variants","This appears in the simul creation page (https://lichess.org/simul/new). Below it is a selection of variants the player can choose from, such as Standard, Chess960, or King of the Hill.","Variants","വ്യത്യാസങൾ"
"timeControl","This sentence is a heading to time controls for the game. This appears in all the game creation menus (e.g. ""Create a game"", ""Play with a friend"") that can be found on the ""Play"" page.","Time control","സമയ നിയന്ത്രണം"
"realTime","Real time chess is chess played over a short period of time, using a chess clock. This is one of three time control settings in the game creation menus (e.g. ""Create a game"", ""Play with a friend"") on the ""Play"" page. Please do NOT translate literally; if your language does not have an equivalent, established term, translate to ""quick"" games or something similar.","Real time","റിയല്‍ ടൈം"
"correspondence","Correspondence chess is chess played over a long period of time, often with several days per move. This is one of three time control settings in the game creation menus (e.g. ""Create a game"", ""Play with a friend"") on the ""Play"" page. Please do NOT translate literally; if your language does not have an equivalent, established term, translate to ""long"" games or something similar.","Correspondence","കറസ്പോണ്ടന്‍സ്"
"daysPerTurn","This is a slider specifically for correspondence chess games. Appears in the game creation menus (e.g. ""Create a game"", ""Play with a friend"") when you have selected the ""Correspondence"" time control.","Days per turn","ഓരോ നീക്കത്തിനും വേണ്ട ദിവസങ്ങള്‍"
"oneDay","Means each turn may take up to one day. This appears next to the slider for the correspondence chess time control in the game creation menus (e.g. ""Create a game"", ""Play with a friend""). Please translate ""one"" as a word (""one""), not a number (not ""1""). It also appears on the clock in correspondence chess games.","One day","ഒരു ദിവസം"
"nbDays","%s is maximum number of days for each turn. This appears next to the slider for the correspondence chess time control in the game creation menus (e.g. ""Create a game"", ""Play with a friend""). It also appears on the clock and information box in correspondence chess games. Please keep this sentence as short as possible.","%s days","%s ദിവസങ്ങള്‍"
"nbHours","%s is number of hours. Used to display correspondence clocks.","%s hours","%s മണിക്കുറുകള്‍"
"time","The time control for the game. This appears as a column heading in the table of games you can join on the ""Play"" page (https://lichess.org/).","Time","സമയം"
"rating","The rating of the player (e.g. 1500). Appears on the lobby list on https://lichess.org/","Rating","നിലവാരം (റേറ്റിംഗ്)"
"ratingStats","Link to the rating distribution stats page (https://lichess.org/stat/rating/distribution/blitz), in the top menu, under ""Community"".","Rating stats","നിലവാര സ്ഥിതിവിവരം"
"username","The name you use to sign in, e.g. ""thibault"". Appears on the registration page (https://lichess.org/signup).","User name","യൂസര്‍ നെയിം"
"usernameOrEmail","The name or email you use to sign in, e.g. ""thibault"". Appears on the sign-in page.","User name or email","യൂസര്‍ നെയിം അല്ലെങ്കില്‍ ഇമെയില്‍"
"password","This is the password you must type to sign in to your profile. Appears on the sign-in, registration, tournament creation and ""Preferences"" pages. Please keep this sentence as short as possible. Next to the sentence is a box where you can type in your password.","Password","പാസ്‌വേഡ്"
"haveAnAccount","This appears on the top-right of the registration page (https://lichess.org/signup -- must be signed out to see this). Next to it is a ""sign in"" button.","Have an account?","അക്കൗണ്ട്‌ ഉണ്ടോ?"
"changePassword","This is a link in the preferences page to a menu that allows you to change your password (https://lichess.org/account/passwd).","Change password","പാസ്‌വേഡ് മാറ്റുക"
"changeEmail","Appears as a menu item and heading on the ""Preferences"" pages (https://lichess.org/account/email).","Change email","ഇമെയില്‍ മാറ്റുക"
