"email","Short for ""Your email address"", but please keep this sentence as short as possible. This appears above text boxes where you can type in your email, on the ""Preferences"" page.","Email","ഇമെയില്‍"
"emailIsOptional","This is a help text, explaining how email works on lichess. Appears on the ""Change email"" page (https://lichess.org/account/email).","Email is optional. Lichess will use your email address to reset your password if you forget it.","ഇമെയില്‍ നിര്‍ബന്ധമില്ല. നിങ്ങള്‍ പാസ്‌വേഡ് മറന്നുപോവുകയാണെങ്കില്‍ അത് റീസെറ്റ് ചെയ്യാന്‍ നിങ്ങളുടെ ഇമെയില്‍ വിലാസം ഞങ്ങള്‍ ഉപയോഗിക്കും."
"passwordReset","Appears as a heading in the link you are given after you asked for an email to reset (change) your password if you have forgotten it.","Password reset","പാസ്‌വേഡ് റീസെറ്റ് ചെയ്യുക"
"forgotPassword","You click here if you forgot your password and want it reset. Please adopt an inviting tone to the user. Also see how other popular websites (e.g. YouTube) phrase the same question in your language. Appears on the ""Sign in"" page.","Forgot password?","പാസ്‌വേഡ് മറന്നുപോയോ?"
"rank","This sentence is not currently used on the site, but feel free to translate it.","Rank","റാങ്ക്"
"gamesPlayed","Before it is the number of games the player has played. For example, https://lichess.org/@/thibault/ currently reads ""2037 Games Played"". Make sure you take the number that appears before this sentence into account when preparing your translation. This sentence appears as a tab on player profiles, just above the list of games.","Games played","മത്സരങ്ങള്‍ കളിച്ചു"
"nbGamesWithYou","%s is the number of games this player has played with you. This appears as a tab on the profile pages of people that you have played with. Try to keep it fairly short.","%s games with you","നിങ്ങളോടോത്തു %s കളികൾ"
"cancel","This is a generic word that appears in a wide variety of places and is used to cancel actions of all sorts. It is recommended to translate it according to whatever your operating system (e.g. Microsoft Windows) uses for your language.","Cancel","ഒഴിവാക്കുക"
"timeOut","This is the condition of a game ending by time-out, which is when one player's clock runs out of time. This sentence appears in the list of games in the profile page and in the game view.","Time out","സമയം കഴിഞ്ഞു"
"drawOfferSent","Informs that a draw offer has been sent. This is a system message that appears in the chat box.","Draw offer sent","സമനിലാ വാഗ്ദാനം അയച്ചു"
"drawOfferDeclined","Informs that the draw offer has been declined. This is a system message that appears in the chat box.","Draw offer declined","സമനിലാ വാഗ്ദാനം നിരസിക്കപ്പെട്ടു"
"drawOfferAccepted","Informs that a draw offer has been accepted. This is a system message that appears in the chat box. This ends the game.","Draw offer accepted","സമനിലാ വാഗ്ദാനം സ്വീകരിക്കപ്പെട്ടു"
"drawOfferCanceled","Informs that the player that sent the draw offer canceled it before his/her opponent responded. This is a system message that appears in the chat box","Draw offer canceled","സമനിലാ വാഗ്ദാനം റദ്ദാക്കപ്പെട്ടു"
"whiteOffersDraw","Informs that the White player wants to draw the game. This is a system message that appears in the chat box.","White offers draw","വെള്ള സമനില വാഗ്ദാനം ചെയ്യുന്നു"
"blackOffersDraw","Informs that the Black player wants to draw the game. This is a system message that appears in the chat box.","Black offers draw","കറുപ്പ് സമനില വാഗ്ദാനം ചെയ്യുന്നു"
"whiteDeclinesDraw","Informs that the White player declined Black's offer to draw the game. This is a system message that appears in the chat box.","White declines draw","വെള്ള സമനില നിരസിക്കുന്നു"
"blackDeclinesDraw","Informs that the Black player declined White's offer to draw the game. This is a system message that appears in the chat box.","Black declines draw","കറുപ്പ് സമനില നിരസിക്കുന്നു"
"yourOpponentOffersADraw","This sentence appears in the right-hand side box while playing a game after your opponent offers you a draw.","Your opponent offers a draw","നിങ്ങളുടെ എതിരാളി സമനില വാഗ്ദാനം ചെയ്യുന്നു"
"accept","Clicking this will accept your opponent's offer and let the action the opponent requested happen. A generic word that appears as a button when your opponent sends an offer to do something (such as a takeback or ending the game by draw). Please translate as a verb if possible.","Accept","സ്വീകരിക്കുക"
"decline","Clicking this will reject your opponent's offer. A generic word that appears as a button when your opponent sends an offer to do something (such as a takeback or ending the game by draw). Please translate as a verb if possible.","Decline","നിരസിക്കുക"
"playingRightNow","This sentence indicates that the game you are looking at is playing right now. Appears on the ""Tournaments"" page (https://lichess.org/tournament) if any tournaments are currently being played, and also on the pages of individual games.","Playing right now","ഇപ്പോള്‍ കളിച്ചുക്കൊണ്ടിരിക്കുന്നു"
"finished","This is for tournaments. It means the tournament is over. Appears on individual tournament pages (e.g. https://lichess.org/tournament/67hj23c2) and also on the ""Tournaments"" page (https://lichess.org/tournament) to denote finished tournaments. Translate as plural; another sentence will be added at some point for individual tournament pages.","Finished","പൂര്‍ത്തിയായി"
"abortGame","Clicking this aborts the game. This means that no points are won or lost. You can only perform this action until the second move of the game. It is NOT a resignation (which has a different sentence). Appears in the right-hand side box on the page of a game you are playing.","Abort game","മത്സരം ഉപേക്ഷിക്കുക"
"gameAborted","Indicates that the game has been aborted. Appears in the left and right hand side boxes, as well as in the games list, for aborted games. Note that aborted games are removed from the database after 48 hours.","Game aborted","മത്സരം ഉപേക്ഷിച്ചു"
"standard","""Standard"" here means ""not a variant"". Selecting this means you play international standard chess, not Chess960 or another variant. Appears in the game creation menus (e.g. ""Create a game"", ""Play with a friend"") on the ""Play"" page.","Standard","സ്റ്റാന്‍ഡേര്‍ഡ്"
"unlimited","This is short for ""Unlimited time"". It describes games that have no time controls and can therefore run for an infinite amount of time. This sentence appears in many locations, including game pages and the ""Create a game"" menu. Please keep this sentence as short as possible.","Unlimited","അപരിമിതം"
"mode","""Mode"" here is in the context of filtering between Casual (casual games are not rated) and Rated games. The sentence appears in the ""Filter games"" menu, which is just above the list of games on the ""Play"" page (https://lichess.org/).","Mode","മോഡ്"
"casual","""Casual"" in this context means the game is unrated; players will not gain or lose points. Has been translated to ""Friendly"" (after the football term) and simply ""Unrated"" in some languages. Be creative. The sentence appears in the ""Filter games"" menu, which can be accessed through the ""Play"" page (https://lichess.org).","Casual","സൗഹാര്‍ദ്ദം"
"rated","""Rated"" means that the outcome of the game will result in a gain or loss of rating points for either players. This sentence appears in a variety of places, including the pages of individual games (which are rated) and the ""Filter games"" page.","Rated","മൂല്യാധിഷ്ഠിതം"
"thisGameIsRated","""Rated"" means that the outcome of the game will result in a gain or loss of rating points for either players. This sentence appears in profile page listings of games and games lists (e.g. https://lichess.org/games/all).","This game is rated","ഈ മത്സരം മൂല്യാധിഷ്ഠിതമാണ്"
"rematch","Translated as a verb if possible. This is a button that appears at the end of a game in the right hand side box. Clicking it sends a rematch offer.","Rematch","റീമാച്ച് (വീണ്ടും കളിക്കുക)"
"rematchOfferSent","Informs you that your offer of a rematch has been sent to your opponent. This is a system message that appears in the chat box, and also in the right-hand side box.","Rematch offer sent","റീമാച്ച് വാഗ്ദാനം അയച്ചു"
"rematchOfferAccepted","Informs that the rematch offer was accepted. This is a system message that appears in the chat box.","Rematch offer accepted","റീമാച്ച് വാഗ്ദാനം സ്വീകരിക്കപ്പെട്ടു"
"rematchOfferCanceled","Informs that the rematch offer a player sent was canceled.This is a system message that appears in the chat box.","Rematch offer canceled","വീണ്ടും കളിക്കാനുള്ള നിർദേശം നിരാകരിച്ചു"
"rematchOfferDeclined","Informs that the rematch offer a player sent was declined.This is a system message that appears in the chat box.","Rematch offer declined","റീമാച്ച് വാഗ്ദാനം നിരസിക്കപ്പെട്ടു"
"cancelRematchOffer","Clicking this cancels the rematch you offered. Obviously, this button appears after you have sent a rematch offer.","Cancel rematch offer","റീമാച്ച് വാഗ്ദാനം റദ്ദാക്കുക"
"viewRematch","A button that appears on game pages if the two players had a rematch. Example: https://lichess.org/rc7l3n66/black","View rematch","റീമാച്ച് കാണുക"
"play","One of the four menu sections. Contains links to game creation, tournaments, simuls, and lichess TV. ""Play"" in this context is a verb.","Play","കളിക്കുക"
"inbox","This is in the title for the ""Inbox"" page (https://lichess.org/inbox) that you can go to by clicking the mail link at the top when you are signed in. The translation should match whatever is used for popular email clients such as GMail and Outlook in your language.","Inbox","ഇന്‍ബോക്സ്‌"
"chatRoom","The chat function for one-to-one chat. A box on the left-hand side on games pages. Appears only in games you are in, not games you are spectating.","Chat room","ചാറ്റ് റൂം"
"spectatorRoom","The chat room for spectators. Appears in a box to the left-hand side on analysis pages, as well as games pages while the game is playing. Example: https://lichess.org/vyvcbk8s","Spectator room","വീക്ഷണ റൂം"
"composeMessage","Another word for this could be ""Create message"". This is a link on the left-hand side of https://lichess.org/inbox. Please follow the standard set by popular email clients such as GMail or Outlook in translating this sentence.","Compose message","സന്ദേശം എഴുതുക"
"noNewMessages","This is the text that appears when you mouseover the mail icon at the top, but have no new messages to read.","No new messages","പുതിയ സന്ദേശങ്ങള്‍ ഇല്ല"
"subject","Next to this is the field where you put in a few words about the subject, or topic, of your message. It appears on the page on which you can compose a new message. (https://lichess.org/inbox/new)","Subject","വിഷയം"
"recipient","Next to this is a field where you can input the name of the player that receives this message.","Recipient","സ്വീകര്‍ത്താവ്"
"send","This is the button you use to send messages in the compose message page. (https://lichess.org/inbox/new)","Send","അയക്കുക"
"incrementInSeconds","Increment in this context means how many seconds are added every time you make a move. So if you set time to 5 minutes and increment in seconds to 2, it would be a ""5+2"" game. This means that each player would have 5 minutes on the clock, and every time the player makes a move, 2 seconds are added. Appears in the game creation menus (e.g. ""Create a game"", ""Play with a friend"") on the ""Play"" page with the ""Clock"" time control.","Increment in seconds","സെക്കന്‍ഡുകളുടെ വര്‍ദ്ധന"
"freeOnlineChess","This sentence appears in the title of every page e.g. ""lichess  • Free Online Chess"" on the ""Play"" page as it appears in the English version. This means it shows up as the title of browser windows and tabs. Technical information: by title here we are literally referring to the HTML <title> tag that carries this.","Free Online Chess","സൗജന്യ ഓണ്‍ലൈന്‍ ചെസ്സ്‌"
"spectators","""Spectators:"" precedes a list of spectators. It appears just below the chat box on any game that is being spectated, such as the games on Lichess TV (https://lichess.org/tv).","Spectators:","വീക്ഷകര്‍"
"nbWins","This appears as a clickable tab in player profiles. The %s is the number of games won.","%s wins","ജയങ്ങൾ %s"
"nbLosses","This appears as a clickable tab in player profiles. The %s is the number of games lost.","%s losses","പരാജയങ്ങൾ %s"
"nbDraws","This appears as a clickable tab in player profiles. The %s is the number of games that ended in draw.","%s draws","സമനിലകൾ %s"
"exportGames","This function lets you download a table of all your games in CSV format. The button in question is a folder with an arrow pointing downwards overlayed on it. It can be seen at profile pages, e.g. https://lichess.org/@/thibault.","Export games","മത്സരങ്ങള്‍ ഡൗന്‍ലോഡ് ചെയ്യുക"
"ratingRange","Below this is a slider that lets you choose the accepted player ratings. The sentence appears in the ""Create a game"" (https://lichess.org/setup/hook) and ""Filter games"" menus. Please do NOT translate ""rating"" to ""Elo"", because lichess has been using the superior Glicko-2 rating system since late 2013.","Rating range","റേറ്റിംഗ് പരിധി"
"giveNbSeconds","%s here is the number of seconds, usually 15. This is the mouseover text of the ""+"" button that appears next to players' names in timed matches. Clicking it adds ""%s"" seconds to the player's clock.","Give %s seconds","%s നിമിഷങ്ങൾ നൽകുക"
"thisPlayerUsesChessComputerAssistance","Appears in a red box on player profiles that have been marked as cheater accounts by the site moderators. An example is https://lichess.org/@/ko1.","This player uses chess computer assistance","ഈ കളിക്കാരന്‍ കമ്പ്യൂട്ടര്‍ സഹായം തേടുന്നു"
"thisPlayerArtificiallyIncreasesTheirRating","Appears as a red box on the profiles of players that have been trying to cheat the rating system. An example is https://lichess.org/@/GrandMasterGnel1.","This player artificially increases/decreases their rating","ഈ കളിക്കാരന്‍ കൃത്രിമമായി റേറ്റിംഗ് കൂട്ടുകയോ കുറയ്ക്കുകയോ ചെയ്യുന്നു"
"openingExplorer","","Opening explorer & tablebase","എക്സ്പ്ലോററും ടേബിൾ ബേസും തുറക്കാം"
"takeback","This is an action you can take in-game that undoes a move. Clicking it sends an offer to your opponent. Appears in the box on right right-hand side. Translate freely, but keep it short. For instance, this has been translated to ""Cancel move"" in several languages.","Takeback","തിരിച്ചെടുക്കുക"
"proposeATakeback","The mouseover text of ""Takeback"". See its description for details.","Propose a takeback","തിരിച്ചെടുക്കാന്‍ നിര്‍ദേശിക്കുക"
"takebackPropositionSent","Informs the player that a takeback proposition has been sent. This is a system message that appears in the chat box.","Takeback proposition sent","തിരിച്ചെടുക്കാനുള്ള നിര്‍ദേശം അയച്ചു"
"takebackPropositionDeclined","Informs the player that the takeback proposition was declined. This is a system message that appears in the chat box.","Takeback proposition declined","തിരിച്ചെടുക്കാനുള്ള നിര്‍ദേശം നിരസിക്കപ്പെട്ടു"
"takebackPropositionAccepted","Informs the player that a takeback proposition was accepted. This is a system message that appears in the chat box.","Takeback proposition accepted","തിരിച്ചെടുക്കാനുള്ള നിര്‍ദേശം സ്വീകരിക്കപ്പെട്ടു"
"takebackPropositionCanceled","Informs the player that a takeback proposition was canceled. This is a system message that appears in the chat box.","Takeback proposition canceled","തിരിച്ചെടുക്കാനുള്ള നിര്‍ദേശം റദ്ദാക്കപ്പെട്ടു"
"yourOpponentProposesATakeback","Appears on the right-hand side box while playing a game. Below it are two buttons that allow you to either accept or decline the takeback proposal.","Your opponent proposes a takeback","നിങ്ങളുടെ എതിരാളി തിരിച്ചെടുക്കാന്‍ നിര്‍ദേശിക്കുന്നു"
"bookmarkThisGame","The mouseover text of the bookmark button (a star-shaped symbol — ★). Appears on the pages of individual games. Example: https://lichess.org/vyvcbk8s","Bookmark this game","ഈ മത്സരം ബുക്ക്‌മാര്‍ക്ക് ചെയ്യുക"
"search","This is the placeholder text (greyed-out text that disappears when you click) for the search box on the forum page (https://lichess.org/forum). Should be translated as a verb if possible. Do not make it too long because it may not fit in the box.","Search","തിരയുക"
"advancedSearch","A powerful search engine that searches games in the database. Appears as a heading on the advanced search function's page, in the ""Games"" pages. Should be translated as a noun. Link: https://lichess.org/games/search","Advanced search","മികച്ച തിരച്ചില്‍"
"tournament","Clicking this takes you to the page of the tournament. Appears on the lists of games on player profiles, for games that were played as part of a tournament on Lichess.","Tournament","ടൂര്‍ണമെന്‍റ് (മത്സര പരമ്പര)"
"tournaments","Clicking this takes you to a page all about tournaments on lichess, where you can see open, running and finished tournaments, as well as create your own. Appears as one of the links at the top of the navigation bar. Links to https://lichess.org/tournament","Tournaments","ടൂര്‍ണമെന്‍റുകള്‍ (മത്സര പരമ്പരകള്‍)"
"tournamentPoints","The number of points the player has gained in tournament games. Could be translated as ""points from tournaments"", but please keep it as short as possible. Appears on profile pages. Example: https://lichess.org/@/thibault — Thibault has 40 tournament points as of the time of writing.","Tournament points","ടൂര്‍ണമെന്‍റ് പോയിന്‍റുകള്‍"
"viewTournament","Clicking this button takes you to the tournament overview page. Can also be translated to ""Watch tournament"" (watch being a verb). Appears when you are watching a game that is part of a tournament. This button only appears when watching a tournament game when the tournament is still running.","View tournament","ടൂര്‍ണമെന്‍റ് കാണുക"
"backToTournament","","Back to tournament","ടൂര്‍ണമെന്‍റിലേക്ക് തിരികെ പോവുക"
"backToGame","","Back to game","മത്സരത്തിലേക്ക് തിരികെ പോവുക"
"freeOnlineChessGamePlayChessNowInACleanInterfaceNoRegistrationNoAdsNoPluginRequiredPlayChessWithComputerFriendsOrRandomOpponents","This is what search engines (like Google, Baidu or Yandex) see when Lichess.org appears as a search result. Keep it as short as possible and make Lichess sound good!","Free online Chess server. Play Chess now in a clean interface. No registration, no ads, no plugin required. Play Chess with the computer, friends or random opponents.","സൗജന്യ ഓണ്‍ലൈന്‍ ചെസ്സ്‌ സെര്‍വര്‍. ഇപ്പോള്‍ മികച്ച രീതിയില്‍ ചെസ്സ്‌ കളിക്കാം. രജിസ്റ്റര്‍ ചെയ്യണ്ട, പരസ്യങ്ങള്‍ ഇല്ല, പ്ലഗിനുകള്‍ വേണ്ട. കമ്പ്യൂട്ടറുമായോ സുഹൃത്തുക്കളുമായോ പുതിയ എതിരാളികളുമായോ ചെസ്സ്‌ കളിക്കാം."
"teams","Teams on lichess are groups of people with their own forum boards and chat channels. Appears at the top of every page on lichess.","Teams","ടീമുകള്‍"
"nbMembers","%s is the number of members. Appears on the top-right hand side on a team's page (e.g. https://lichess.org/team/linux).","%s members","അംഗങ്ങള്‍ %s"
"allTeams","A list of all teams on lichess. Links to https://lichess.org/team. Appears as a tab in the ""Teams"" page.","All teams","എല്ലാ ടീമുകളും"
"newTeam","Clicking this takes you to a form for creating a new team. Links to https://lichess.org/team/new. Appears as a tab on the ""Teams"" pages.","New team","പുതിയ ടീം"
"myTeams","A list of the teams you are a member of. Links to: https://lichess.org/team/me. Appears as a tab in the ""Teams"" pages after you have joined a team.","My teams","എന്‍റെ ടീമുകള്‍"
"noTeamFound","Appears when you are not a member of any team on https://lichess.org/team/me.","No team found","ഒരു ടീമും കണ്ടെത്തിയില്ല"
"joinTeam","Clicking this button makes you join the team you are looking at. Appears on the pages of teams (such as https://lichess.org/team/linux).","Join team","ടീമില്‍ അംഗമാവുക"
"quitTeam","Clicking this button makes you leave the team. Appears on the pages of teams (such as https://lichess.org/team/linux).","Leave team","ടീം ഉപേക്ഷിക്കുക"
"anyoneCanJoin","This is the joining policy of a team that has no application or invitation process; ""free for all"" means anyone can join it, without an application process of any sort.","Free for all","എല്ലാവര്‍ക്കും ലഭ്യമായത്"
"aConfirmationIsRequiredToJoin","Means that the team leader must confirm every player's application to join the team. Appears as an option on the new team creation page (https://lichess.org/team/new).","A confirmation is required to join","അംഗമാവുന്നതിനു സ്ഥിരീകരണം വേണം"
"joiningPolicy","This determines how players can join the team: by application or without restrictions. Appears on the new team creation page (https://lichess.org/team/new).","Joining policy","അംഗത്വ നയങ്ങള്‍"
"teamLeader","Shows who the leader of the team is (usually its creator). Appears on team pages. Example: https://lichess.org/team/linux — ""untitled"" is the leader of the team.","Team leader","ടീം മേധാവി"
"teamBestPlayers","This is for teams. It is a listing of the best players in the team. It appears on the left-hand side of any team's page. Example https://lichess.org/team/saloon","Best players","മികച്ച കളിക്കാര്‍"
"teamRecentMembers","This is for teams. It is a listing of all players in the team sorted by who joined most recently. It appears on the left-hand side of any team's page (e.g. https://lichess.org/team/saloon).","Recent members","പുതിയ അംഗങ്ങള്‍"
"xJoinedTeamY","The first %s is the name of the player, and the second %s is the team the player joined. Appears in the activity timeline on the left-hand side of the ""Play"" page (https://lichess.org/) after you have started following a player.","%s joined team %s","%s സംഘത്തിൽ %s അംഗമായി"
