"clickOnTheBoardToMakeYourMove","Informs the player on how to complete the CAPTCHA test. Appears next to the chess CAPTCHA. CAPTCHAs appear before registering and when posting on the forum.","Click on the board to make your move, and prove you are human.","คลิกบนกระดานเพื่อเดินหมากของคุณ และพิสูจน์ว่าคุณคือมนุษย์"
"notACheckmate","Appears next to the chess CAPTCHA when you make a wrong move. CAPTCHAs appear before registering and when posting on the forum.","Not a checkmate","ไม่ใช่รุกจน"
"colorPlaysCheckmateInOne","%s is the side that you are playing. Appears next to the chess CAPTCHA. CAPTCHAs appear before registering and when posting on the forum.","%s plays; checkmate in one move","%sเล่น; รุกจนโดยเดินครั้งเดียว"
"retry","Clicking this clears the board and lets you try again. Appears as a button when you get a chess CAPTCHA wrong. CAPTCHAs appear before registering and when posting on the forum.","Retry","ลองอีกครั้ง"
"reconnecting","Informs the player that lichess is in the process of re-establishing a connection. Appears at the top of the page in red colour when lichess loses connection.","Reconnecting","กำลังเชื่อมต่อใหม่"
"onlineFriends","Appears as a heading for the friends box on the bottom-right hand corner of the screen; it is a list of friends that are on lichess right now. Translate simply as ""Friends"" if no good-sounding equivalent to ""Online friends"" or ""Connected friends"" exists in your language.","Online friends","เพื่อนออนไลน์"
"noFriendsOnline","Informs you that none of your friends are on lichess right now. Appears when the friends box is raised on the bottom-right hand corner of the page.","No friends online","ไม่มีเพื่อนออนไลน์"
"findFriends","Clicking on this takes you to a page that suggests players that could be made friends based on how many times you have played with them. Appears as a button when you hover the mouse cursor over the friends box (when raised) on the bottom-right hand corner of the page, when none of your friends are online. Also appears as a heading on the page with suggested friends. Example: these are Thibault's suggested friends: https://lichess.org/@/thibault/suggestions","Find friends","ค้นหาเพื่อน"
"favoriteOpponents","The players you play most against. Appears in profile pages and leads to a table of favorite opponents. Example https://lichess.org/@/thibault/opponents — this lists the players Thibault plays most against.","Favorite opponents","คู่แข่งที่ชอบเล่น"
"follow","Clicking this lets you follow the player and find out what they have been up doing around lichess through the activity timeline. Appears as a mouseover text of the thumbs up symbol, which in turn appears on profile pages and player name information boxes. It is recommended to use the translation for this on Twitter, where the words were taken from in the interests of familiarity. Should be translated as a verb.","Follow","ติดตาม"
"following","Indicates that you are following the player. Replaces the ""Follow"" button, which appears on profile pages and in popups over player names. It is recommended to use the same translation for this as the one on Twitter, where the words were taken from in the interests of familiarity.","Following","กำลังติดตาม"
"unfollow","Clicking this makes you stop following that player. Appears when you hover the mouse cursor over the ""Following"" button, after you have followed the player. It is recommended to use the same translation for this as the one on Twitter, where the words were taken from in the interests of familiarity. Should be translated as a verb if possible.","Unfollow","เลิกติดตาม"
"block","Clicking this blocks the user, which prevents you from challenging them to games and talking to them privately, among other things. Appears in profile pages and popups over players' names. Should be translated as a verb.","Block","กีดกัน"
"blocked","Indicates that you have blocked the player. Replaces the ""Block"" button, which appears in profile pages and popups over players' names.","Blocked","ถูกกีดกัน"
"unblock","Appears when you hover the mouse cursor over the ""Blocked"" button, after you have blocked the player. Should be translated as a verb if possible.","Unblock","เลิกกีดกัน"
"followsYou","Indicates that this player is following you. Appears on the informative popups that appear when you hover the mouse cursor over players' names.","Follows you","ติดตามคุณ"
"xStartedFollowingY","The two %s's are players' names. The first %s is the name of the follower, and the second %s is the name of the followed. Appears in the activity timeline on the left-hand side of the ""Play"" page (https://lichess.org/) after you have started following a player.","%s started following %s","%s ได้เริ่มติดตาม %s"
"nbFollowers","%s is the number of people that follow this player. Example: https://lichess.org/@/thibault — as of the time of writing, Thibault has 263 people following him.","%s followers","ผู้ติดตาม %s"
"nbFollowing","%s is the number of players this player is following. Example: https://lichess.org/@/thibault — as of the time of writing, Thibault is following 81 players.","%s following","กำลังติดตาม %s"
"more","Generic message that lets you view more. Appears on the left-hand side of https://lichess.org/people, which lets you view a list of connected players. Also appears on the activity timeline on the left-hand side of the ""Play"" page (https://lichess.org/) if there are too many messages in the timeline. ""More"" may be used in other places around Lichess in the future, so please make your translation as generic as possible.","More","เพิ่มเติม"
"memberSince","Tells how long the player has been a member of lichess. Appears on profile pages. For example, https://lichess.org/@/thibault has been a member since 2010-11-22.","Member since","สมาชิกตั้งแต่"
"lastSeenActive","The last time a player was seen on the site; %s is a duration. Appears on profile pages. Example: https://lichess.org/@/thibault — ""Active 4 minutes ago"" (as of the time of writing).","Active %s","ลงชื่อเข้าครั้งล่าสุด %s"
"challengeToPlay","Clicking this lets you ask the player to play a game with you, and takes you to the game set-up view. Appears on profile pages and popups over player names as a mouseover text for the crossed swords symbol. Please translate ""Challenge"" as a verb if possible. Example. https://lichess.org/@/thibault.","Challenge to a game","ท้าดวลเกม"
"player","Clicking on this lets you sort the list of games by player names. Appears as a column heading in the list of open games on the ""Play"" page (https://lichess.org/).","Player","ผู้เล่น"
"list","This is one of the two ways of sorting open games on the ""Play"" page (https://lichess.org/). Clicking it presents all games you can join in a list format.","List","รายการ"
"graph","This is one of the two ways of sorting open games on the ""Play"" page (https://lichess.org/). Clicking it presents all games you can join on a graph, with x (time) and y (player rating) axes.","Graph","กราฟ"
"lessThanNbMinutes","%s is the number of minutes. Ticking this checkbox means that games that last less than 3 minutes will show up in the list of games. The sentence appears in the ""Filter games"" menu, which can be accessed through the ""Play"" page (https://lichess.org).","Less than %s minutes","น้อยกว่า %s นาที"
"xToYMinutes","%s, in both cases, is the number of minutes. Ticking this checkbox means that games that last certain predefined amounts (e.g. Blitz is 3 to 8 minutes) will show up in the list of games. The sentence appears in the ""Filter games"" menu, which can be accessed through the ""Play"" page (https://lichess.org).","%s to %s minutes","%s ถึง %s นาที"
"textIsTooShort","Error message that indicates the text put in the form is too short. Appears in forms around the site of all kinds, including registration and team creation.","Text is too short.","ข้อความสั้นไป"
"textIsTooLong","Error message that indicates the text put in the form is too long. Appears in forms around the site of all kinds, including registration and team creation.","Text is too long.","ข้อความยาวไป"
"required","Error message that indicates that some required text fields in the form were not filled in. Appears in forms around the site of all kinds, including registration and team creation.","Required.","ต้องการ"
"openTournaments","""Open"" here means you can join the tournament. Below it is a list of tournaments you are able to join. Appears as a heading on https://lichess.org/tournament and also on the ""Play"" page (https://lichess.org/)","Open tournaments","ทัวร์นาเมนต์ที่เปิด"
"duration","Length of the tournament in minutes. Appears on the left-hand side box on the pages of tournaments. Example: https://lichess.org/tournament/67hj23c2","Duration","ระยะเวลา"
"winner","Indicates the player won the tournament. This is the mouseover text of the trophy icon on tournaments pages. Example: https://lichess.org/tournament/67hj23c2","Winner","ผู้ชนะ"
"standing","Shows the order of the players in a tournament, ordered by their score. Could be translated as ""position"" or ""score"" if your language has no equivalent. Appears in the left-most column on the pages of individual tournaments. Example: https://lichess.org/tournament/67hj23c2","Standing","อันดับ"
"createANewTournament","Clicking this lets you create a new tournament. Appears as a heading and a button on the tournament creation page, among other places. Links to https://lichess.org/tournament/new.","Create a new tournament","สร้างทัวร์นาเมนต์ใหม่"
"join","Clicking this lets you enter the tournament. This button is found on the ""Play"" (https://lichess.org) and ""Tournaments"" (https://lichess.org/tournament) pages.","Join","เข้าร่วม"
"withdraw","Clicking this makes you withdraw from (leave) the tournament you have entered. Appears on the tournament page after you have entered it.","Withdraw","ถอนตัว"
"points","The number of points the player has attained in this tournament. Appears as a column heading on tournament pages. Example: https://lichess.org/tournament/67hj23c2","Points","แต้ม"
"wins","The number of games the player has won in this tournament. Appears as a column heading on tournament pages. Example: https://lichess.org/tournament/67hj23c2","Wins","ชนะ"
"losses","The number of games the player has lost in this tournament. Appears as a column heading on tournament pages. Example: https://lichess.org/tournament/67hj23c2","Losses","แพ้"
"winStreak","The number of games the player won consecutively without losing. Appears as a column heading on tournament pages. Example: https://lichess.org/tournament/67hj23c2 — Thibault won all 6 games in a row, jordach 3 and graphitemaster 2.","Win streak","ชนะรวด"
"createdBy","This appears in a box on the top-left hand corner of tournament pages. The sentence is followed by the name of the player that created it. Example: https://lichess.org/tournament/gwlomxqd — ""Created by thibault"".","Created by","สร้างโดย"
"tournamentIsStarting","Appears as a pop-up when the tournament you have joined is about to start.","The tournament is starting","ทัวร์นาเมนต์กำลังเริ่มต้น"
"membersOnly","Ticking this checkbox makes the game so only lichess members can join it. Appears in the game creation menu (https://lichess.org/setup/hook).","Members only","เฉพาะสมาชิก"
"boardEditor","The board editor lets you prepare a chess board and play from the position you set up. Appears as a heading on the editor page, and also as a tab in the ""Games"" pages. Links to https://lichess.org/editor","Board editor","ตัวแก้ไขกระดาน"
"startPosition","Clicking this resets the state of the board to the starting position in standard chess. Being a board editor feature, it appears on the board editor's page — https://lichess.org/editor","Starting position","ตำแหน่งเริ่มต้น"
"clearBoard","Clicking this removes all the pieces from the chess board you are setting up. Being a board editor feature, it appears on the board editor's page — https://lichess.org/editor","Clear board","ล้างกระดาน"
"savePosition","This sentence is not currently used on the site, but feel free to translate it","Save position","บันทึกตำแหน่ง"
"loadPosition","Clicking this opens a form that lets you paste a FEN text (FEN is a notation system used to store precise positions on a board). Being a board editor feature, it appears on the board editor's page — https://lichess.org/editor","Load position","โหลดตำแหน่ง"
"isPrivate","Means the tournament you are looking at is protected with a password. Appears in the information box on the tournament's page. Example: https://lichess.org/tournament/67hj23c2","Private","ส่วนตัว"
"reportXToModerators","%s is the name of the player. Clicking this will take you to a form where you can report the player for things like cheating and trolling. Appears on player profiles.","Report %s to moderators","ร้องเรียน %s สู่ผู้ดูแล"
"profile","Links to your player profile (account). Appears in the drop-down menu for your name at the navigation bar on the top of every page on lichess.","Profile","ข้อมูลประจำตัว"
"editProfile","Clicking this lets you edit the information about you displayed on your player profile. Appears on your profile page and also as a heading and tab on the preferences configuration pages. Links to https://lichess.org/account/profile","Edit profile","แก้ไขข้อมูลประจำตัว"
"firstName","Also known as a ""first name"", ""forename"" or even ""Christian name"" in some countries. This sentence appears in the ""Edit profile"" menu (https://lichess.org/account/profile). Translate to whatever best describes this in your language or culture.","Given name","ชื่อจริง"
"lastName","Also known as ""surname"" or ""family name"". You put in your last name in this field, which will in turn appear on your profile page. This sentence appears in the ""Edit profile"" menu (https://lichess.org/account/profile). Translate to whatever best describes this in your language or culture.","Last name","นามสกุล"
"biography","This is next to a text field where you can write anything you wish to describe yourself. For example, https://lichess.org/@/thibault reads ""I write bugs for lichess.org"". This sentence appears in the ""Edit profile"" menu (https://lichess.org/account/profile).","Biography","ชีวประวัติ"
"country","This is a field for the country you are located at. Appears on player profiles (example: https://lichess.org/@/thibault). The sentence appears in the ""Edit profile"" menu (https://lichess.org/account/profile).","Country","ประเทศ"
"preferences","Lets you configure lichess so it responds the way you prefer. Appears in the profile drop-down menu at the top of all pages when signed in. Links to https://lichess.org/account/preferences","Preferences","การตั้งค่า"
"watchLichessTV","Clicking this take you to the TV page, where you can watch the current game being aired on lichess TV. Appears on the ""Play"" page (https://lichess.org/) below the miniboard showing the current TV game, as well as appearing as a tab on the ""Games"" pages (https://lichess.org/games). Links to https://lichess.org/tv — the TV page. Please keep this sentence as short as possible.","Watch Lichess TV","ดู Lichess TV"
"previouslyOnLichessTV","A list of games that were aired on lichess TV before. Appears as a heading to a box below the board on the TV page (https://lichess.org/tv).","Previously on Lichess TV","Lichess TV ก่อนหน้า"
"onlinePlayers","A list of players that are connected right now. Appears as a heading on https://lichess.org/people","Online players","ผู้เล่นออนไลน์"
"activeToday","A list of players ordered by how many games they played today. Appears as a heading on the ""Players"" page (https://lichess.org/people).","Active today","ขยันในวันนี้"
"activePlayers","A list of players ordered by how many games they have played over the last 30 days. Appears as a heading on the ""Players"" page (https://lichess.org/people).","Active players","ผู้เล่นที่ขยัน"
"bewareTheGameIsRatedButHasNoClock","Warning message that appears when you are about to join a game of unlimited time. This is only for games created via the ""Play with a friend"" menu (https://lichess.org/setup/friend), as creating public rated games with no time control is not allowed.","Beware, the game is rated but has no clock!","ระวัง, เกมนี้ถูกคิดคะแนนแต่ไม่จับเวลา!"
"training","A page that offers chess puzzles. These help you improve how you play chess. Could also be translated as ""Practise"" (verb) or a similar word. This appears as one of the links on the navigation bar at the top of every page, so it should be kept as short as possible. Links to https://lichess.org/training","Training","ฝึก"
"yourPuzzleRatingX","%s is your numerical puzzle rating. Appears in a box left of the board on the ""Training"" page (https://lichess.org/training), above the graph.","Your puzzle rating: %s","ระดับคะแนนแก้ปริศนาของคุณ: %s"
"findTheBestMoveForWhite","Informs the player what side they are playing. Appears on the right-hand side of the puzzle trainer, on the ""Training"" page (https://lichess.org/training).","Find the best move for white.","หาการเดินที่ดีที่สุดสำหรับฝ่ายขาว"
"findTheBestMoveForBlack","Informs the player what side they are playing. Appears on the right-hand side of the puzzle trainer, on the ""Training"" page (https://lichess.org/training).","Find the best move for black.","หาการเดินที่ดีที่สุดสำหรับฝ่ายดำ"
"toTrackYourProgress","Encourages the player to register. Below this message is a ""Register"" button. Appears in a box left of the board on the ""Training"" page (https://lichess.org/training) when trying puzzles and not being signed in.","To track your progress:","เพื่อติดตามความก้าวหน้าของคุณ:"
"trainingSignupExplanation","Encourages the player to register an account to enjoy Lichess's ""Training"" feature more. Appears below the ""Register"" button when doing chess puzzles without being logged in, in a box left of the board on the ""Training"" page (https://lichess.org/training).","Lichess will provide puzzles that match your ability, making for better training sessions.","Lichess จะสรรหาปริศนาที่เหมาะสมกับความสามารถของคุณ, เพื่อสร้างโจทย์ฝึกที่ดียิ่งขึ้น"
"puzzleId","%s is the number of the puzzle. This means the way it appears on the site will be something like ""Puzzle 5705"". Appears on the ""Training"" page (https://lichess.org/training).","Puzzle %s","ปริศนา %s"
"puzzleOfTheDay","A random chess puzzle presented on right-hand side the ""Play"" page (https://lichess.org). As the name suggests, there is a different puzzle every day.","Puzzle of the day","ปริศนาประจำวัน"
"clickToSolve","The mouseover text of the chess board for the puzzle of the day on the ""Play"" page (https://lichess.org).","Click to solve","คลิกเพื่อแก้ปริศนา"
"goodMove","Informs the player that they played a good move, but not the best they could make. Appears in a green box on the left-hand side of the ""Training"" page (https://lichess.org/training), in reference to the chess puzzle you are currently playing. Keep your translation short, as a longer sentence (also translatable) just below this one informs them it is not the best move they could play.","Good move","เดินได้ดี"
"butYouCanDoBetter","Informs you that your move was good, but not the best move possible. ""But there is a better move"" is an alternate way to translate this. Appears in a green box left of the board on the ""Training"" page (https://lichess.org/), just below the ""Good move"" sentence. It is used in reference to the chess puzzle you are currently playing.","But you can do better.","แต่คุณสามารถเดินได้ดีกว่าจุดนั้น"
"bestMove","Informs the player that the move they just played is the best they could possibly play. Appears in a green box on the left-hand side ""Training"" page (https://lichess.org/training) while playing a puzzle.","Best move!","เดินได้ดีที่สุด!"
"keepGoing","Informs you that the puzzle is not yet finished. Appears just below ""Best move!"" in a green box on the left of the board on the Training page (https://lichess.org/training), after you have made the best possible move.","Keep going…","เดินต่อไป..."
"puzzleFailed","Informs you that you lost the puzzle. Appears in a red box left of the board on the Training page (https://lichess.org/training) when you fail the puzzle by making a wrong move. Could also be translated as ""You have failed the puzzle"", if it is short enough and sounds better.","Puzzle failed","แก้ปริศนาไม่สำเร็จ"
"butYouCanKeepTrying","Informs you that the fact you failed the puzzle (again) does not mean you have given up. Appears in a red box left of the board on the Training page (https://lichess.org/training) when you are retrying a puzzle you have already failed… and fail it again.","But you can keep trying.","แต่คุณสามารถลองแก้ต่อได้"
"victory","Informs the player that they completed the puzzle successfully. Appears in a green box left of the board on the ""Training"" page (https://lichess.org/training) when you beat a puzzle. Can also be translated as ""Success!"", but we found ""Victory!"" to sound more romantic/heroic.","Victory!","ชัยชนะ!"
"wasThisPuzzleAnyGood","Poses a question to the user on whether the chess puzzle they just played was good or not. This is intended to entice players to vote, so please be encouraging in tone. This message appears occasionally on the ""Training"" page (https://lichess.org/training), after a player has played several puzzles without voting. An alternate way to phrase this sentence could be ""How did you find this puzzle?"".","Was this puzzle any good?","ปริศนานี้ดีพอหรือไม่?"
"pleaseVotePuzzle","Inform the player why they should vote, and how to vote. Appears above a box with two buttons that you can use to vote on whether the puzzle was good or bad. This message appears occasionally on the ""Training"" page (https://lichess.org/training), after a player has played several puzzles without voting. You can phrase the first part as ""Improve lichess by voting"", if that helps.","Help lichess improve by voting, using the up or down arrow:","ช่วย lichess ปรับปรุงโดยใช้ปุ่มลูกศรขึ้นหรือลง เพื่อทำการโหวต:"
"thankYou","Politely thanks the players for voting. Appears on the ""Training"" page (https://lichess.org/training) after voting for a puzzle. Also, a page thanking all contributors of Lichess. Appears on the footer of the menu page. Links to https://lichess.org/thanks . Please use the polite version of ""Thank you"" in your language.","Thank you!","ขอบคุณ!"
"ratingX","%s is the numerical rating and rating deviation for the puzzle. This is the rating of individual chess puzzles in the ""Training"" pages (https://lichess.org/training/5705). Appears on the right-hand side box after you have succeeded at or failed at the puzzle. Note that this is the rating of the puzzle, NOT the player.","Rating: %s","ระดับคะแนน: %s"
"playedXTimes","%s is the number of times this puzzle has been played. Appears in the box on the right-hand side the ""Training"" page (https://lichess.org/training/) after you have succeeded at or failed the puzzle.","Played %s times","ถูกเล่น %s ครั้ง"
"fromGameLink","%s is the name of the game. Appears as a button title at the bottom of the ""Training"" page (https://lichess.org/training/) after you have succeeded or failed at the puzzle.","From game %s","จากเกม %s"
