"playWithAFriend","One of the 3 rectangular buttons on the ""Play"" page (https://lichess.org/). This creates a unique URL that you can send to someone and play.","Play with a friend","เล่นกับเพื่อน"
"playWithTheMachine","One of the 3 rectangular buttons on the ""Play"" page (https://lichess.org/). Translate ""machine"" as ""[chess] engine"" if it sounds better in your language, omitting the word ""chess"".","Play with the machine","เล่นกับคอมพิวเตอร์"
"toInviteSomeoneToPlayGiveThisUrl","This appears after you have created a game for a friend (through the ""Play with a friend"" menu). Feel free to translate ""URL"" as ""address"", or whatever is most familiar in your language.","To invite someone to play, give this URL","โปรดให้ URL นี้ แก่ผู้ที่จะเชิญให้มาเล่น,"
"gameOver","This appears in the right-hand side box when a game ends.","Game Over","จบเกม"
"waitingForOpponent","Indicates you are waiting for an opponent to join your game. This appears after you have created a public game (through the ""Create a game"" menu).","Waiting for opponent","กำลังรอคู่แข่ง"
"waiting","This appears in the challenges box, when you are waiting for the opponent the accept the challenge.","Waiting","กำลังรอ"
"yourTurn","This appears in the box while you are playing a game. It indicates it is your turn to play.","Your turn","ตาคุณ"
"aiNameLevelAiLevel","AI name and level, e.g. ""Stockfish level 3"". Note that the ""Stockfish"" part will always be first no matter where you place the %s, though you can rearrange them to e.g. ""%s at %s levels"", which would produce e.g. ""Stockfish at 3 levels"". Use the translation that sounds best in your language. Appears in the box on the left-hand side in the page of the game, and also on your profile, in the list of games.","%s level %s","%s ระดับ %s"
"level","This appears in the ""Play with the machine"" menu (https://lichess.org/setup/ai) as a heading. Below it are skill levels (1 through 8) of the AI that you can play against.","Level","ระดับ"
"toggleTheChat","Turns the chat room (or player chat) on or off. This is the mouseover text of the checkbox on the top-right of the chat box.","Toggle the chat","เปิด/ปิดแชท"
"toggleSound","Clicking this turns sound on or off. This is a button on the top-right hand corner of the screen. If you use the Internet Explorer browser, you may not be able to see this.","Toggle sound","เปิด/ปิดเสียง"
"chat","Start a conversation with a player. Appears in the user tooltip when hovering a user name.","Chat","แชท"
"resign","Clicking this makes you resign from the game. Small button in the box on the right while playing a game.","Resign","ยอมแพ้"
"checkmate","Appears in the box of a game if you end a game by checkmate.","Checkmate","รุกจน"
"stalemate","If you do not know what this rule is, see https://www.chessvariants.org/d.chess/matefaq.html. Appears in the box of a game if you end a game by stalemate. Please use the official term used by your country's or locale's chess federation or club.","Stalemate","อับ"
"white","The mouseover text of the White King button in the game creation menus (e.g. ""Create a game"", ""Play with a friend"") on the ""Play"" page.","White","ขาว"
"black","The mouseover text of the Black King button in the game creation menus (e.g. ""Create a game"", ""Play with a friend"") on the ""Play"" page.","Black","ดำ"
"randomColor","Makes Lichess randomly pick a side (White or Black) for you. The mouseover text of the large button in the game creation menus (e.g. ""Create a game"", ""Play with a friend"") on the ""Play"" page.","Random side","สุ่มสี"
"createAGame","This button opens a menu (https://lichess.org/setup/hook) that lets you create a game that is listed in the list (or graph) of open games. It is one of the 3 rectangular buttons on the ""Play"" page (https://lichess.org/).","Create a game","สร้างเกม"
"whiteIsVictorious","Indicates the white player won the game. This appears in the top left box of a game, and also the player profile.","White is victorious","ขาวเป็นผู้ชนะ"
"blackIsVictorious","Indicates the black player won the game. This appears in the top left box of a game, and also the player profile.","Black is victorious","ดำเป็นผู้ชนะ"
"kingInTheCenter","Indicates that the game was won by the King being in one of the center tiles (King of the hill variant: https://lichess.org/king-of-the-hill).","King in the center","คิงเข้าศูนย์กลาง"
"threeChecks","Indicates that the game was won by a player checking their opponent three times. Only for the Three-check variant.","Three checks","สามรุก"
"raceFinished","Ending message of a Racing Kings game (https://lichess.org/variant/racingKings).","Race finished","แข่งจบแล้ว"
"variantEnding","Indicates that the game was won due to variant special rules. Shown when no more specialized message is available.","Variant ending","จบโดยตัวแปรกติกา"
"newOpponent","Clicking this takes you back to the ""Play"" page (https://lichess.org). This is a button that appears at the end of a game just below the ""Rematch"" button.","New opponent","คู่แข่งรายใหม่"
"yourOpponentWantsToPlayANewGameWithYou","This sentence appears when your opponent offers you a rematch.","Your opponent wants to play a new game with you","คู่แข่งของคุณต้องการเล่นเกมใหม่กับคุณ"
"joinTheGame","Clicking this lets you join a new game against the same opponent. This is one of the two buttons that appear when your opponent offers you a rematch.","Join the game","เข้าร่วมเกม"
"whitePlays","This is what a spectator sees in the right-hand box when watching a game and it is White's turn to play.","White to play","ขาวเล่น"
"blackPlays","This is what a spectator sees in the right-hand box when watching a game and it is Black's turn to play.","Black to play","ดำเล่น"
"theOtherPlayerHasLeftTheGameYouCanForceResignationOrWaitForHim","This appears after 3 minutes have elapsed with one player disconnected. Below it are two buttons: ""Claim victory"" and ""Call draw"".","The other player may have left the game. You can claim victory, call the game a draw, or wait.","ผู้เล่นอีกฝ่ายอาจทิ้งเกมไปแล้ว คุณสามารถใช้สิทธิ์ชนะ, ให้เสมอกัน หรือรอต่อไป"
"makeYourOpponentResign","The mouseover text of ""Claim victory"". You do not have to translate it like this; you can translate to e.g. ""Force victory"", or whatever best explains the button in your language. Mouseover texts can be as long as you want, within reason.","Make your opponent resign","ทำให้คู่แข่งยอมแพ้"
"forceResignation","Clicking this ends the game and grants you the win. One of the two buttons that appears when your opponent leaves the game.","Claim victory","ใช้สิทธิ์ชนะ"
"forceDraw","Clicking this draws the game. It is considered the more ""chivalrous"" option of the two. One of the two buttons that appears when your opponent leaves the game.","Call draw","ให้เสมอกัน"
"talkInChat","Chat input placeholder, encouraging players to behave. Visible in every chat, like on https://lichess.org/tournament/summer15. Keep it short so it fits in the input box.","Please be nice in the chat!","คุยในแชท"
"theFirstPersonToComeOnThisUrlWillPlayWithYou","Informs you that Lichess waiting for your friend to visit the link. This appears at the top of the pane after you have created a game through the ""Play with a friend"" menu.","The first person to come to this URL will play with you.","คนแรกที่เข้ามาใน URL นี้ จะได้เล่นกับคุณ"
"whiteResigned","This sentence appears in the right hand-side box in a game, the list of games on the profile, and also the left hand-side box in a game when the White player resigns from the game.","White resigned","ขาวยอมแพ้"
"blackResigned","This sentence appears in the right hand-side box in a game, the list of games on the profile, and also the left hand-side box in a game when the Black player resigns from the game.","Black resigned","ดำยอมแพ้"
"whiteLeftTheGame","This appears when the White player leaves the game either by aborting or by being absent for too long. It can found in the right hand-side box in a game, the list of games on the profile and also the left hand-side box in a game.","White left the game","ขาวได้ทิ้งเกม"
"blackLeftTheGame","This sentence appears when the Black player leaves the game either by aborting or by being absent for too long. It can found in the right hand-side box in a game, the list of games on the profile and also the left hand-side box in a game.","Black left the game","ดำได้ทิ้งเกม"
"shareThisUrlToLetSpectatorsSeeTheGame","The mouseover text of the link just below the board which you can send to people so they can watch the game.","Share this URL to let spectators see the game","แบ่งปัน URL นี้ เพื่อให้ผู้อื่นเข้ามาดูเกม"
"theComputerAnalysisHasFailed","This is an error message that appears when the computer analysis cannot be displayed for some reason. It appears the ""Computer analysis"" tab.","The computer analysis has failed","การวิเคราะห์ด้วยคอมพิวเตอร์ล้มเหลว"
"viewTheComputerAnalysis","Clicking this button takes you to the computer analysis. The sentence appears only for the player that requested it, in the ""Computer analysis"" tab.","View the computer analysis","ดูผลการวิเคราะห์ด้วยคอมพิวเตอร์"
"requestAComputerAnalysis","Clicking this puts the game in the queue for computer analysis, which is usually completed within a minute. This is one of the actions below the board in the ""Replay and analyse"" view.","Request a computer analysis","ร้องขอการวิเคราะห์ด้วยคอมพิวเตอร์"
"computerAnalysis","An automated analysis of a game performed by lichess. It provides an advantage charts and possible variation for a game. Appears as a tab below the chess board in replay and analysis views. Example: https://lichess.org/vyvcbk8s","Computer analysis","การวิเคราะห์ด้วยคอมพิวเตอร์"
"analysis","Button that leads to analysis page. Appears only on your own games, after they have finished.","Analysis board","กระดานวิเคราะห์"
"blunders","This is one of the categories of problems discovered by the computer analysis. If no equivalent word exists, translate to ""Serious mistakes"".","Blunders","ความผิดพลาดมหันต์"
"mistakes","This is one of the categories of problems discovered by the computer analysis. Appears on the right hand side of pages with analyzed games. Example: https://lichess.org/vyvcbk8s","Mistakes","ความผิดพลาด"
"inaccuracies","The most minor of errors a player can make. This is one of the categories of problems discovered by the computer analysis.","Inaccuracies","ความไม่ถูกต้อง"
"moveTimes","Time spent on each move by the players. Appears as a tab in the ""Replay and analyse"" view, below the chess board. Example: https://lichess.org/6iaj1eh0","Move times","เวลาการเดิน"
"flipBoard","Clicking this flips the board upside-down. This sentence is one of the links in the box normally below the board.","Flip board","พลิกกระดาน"
"threefoldRepetition","This is one of the conditions by which a game ends. It appears on the box on the right-hand side of the screen. It also appears in player profiles. Please use the official term used by your country's or locale's chess federation or club.","Threefold repetition","รุกล้อ"
"claimADraw","Clicking this draws the game. This a button that appears to players when threefold repetition occurs.","Claim a draw","ใช้สิทธิ์เสมอ"
"offerDraw","Clicking this send an offer to draw the game to your opponent. This is a small button in the right-hand side box.","Offer draw","เสนอว่าเสมอ"
"draw","This appears in various places, including players' profiles and the right-hand side boxes in individual games. It should be translated as a noun, NOT as a verb.","Draw","เสมอ"
"nbConnectedPlayers","The %s is the counter of how many players are connected right now. This sentence is displayed at the top of every page on lichess.","%s players","%s ผู้เล่น"
"gamesBeingPlayedRightNow","This is a shorter phrase for ""Games being played right now"". It is what the link at the top that says ""Games"" links to (https://lichess.org/games). Please try to keep your translation as short as possible.","Current games","เกมในขณะนี้"
"viewAllNbGames","%s here is the number of all the games ever played on Lichess. Links to https://lichess.org/games/all.","%s Games","%s เกม"
"viewNbCheckmates","%s is the number of all the games that ended in checkmate on Lichess. Links to https://lichess.org/games/checkmate and is found on the left hand side of the ""Games"" pages.","%s Checkmates","%s รุกจน"
"nbBookmarks","%s is the number of games you have bookmarked. Links to https://lichess.org/games/bookmark. It only appears to registered users that have bookmarked certain games. It displays a list of your bookmarked games.","%s Bookmarks","%s เกมที่หมายไว้"
"viewInFullSize","Clicking one of these small boards brings you to the game's unique page. This is the mouseover text of the small chess boards dotted around the site. These small boards are most prominent in the ""Games"" pages (https://lichess.org/games).","View in full size","ดูแบบเต็มขนาด"
"logOut","Clicking this signs you out of your lichess profile. This is part of the profile drop-down menu on the top of every page when you are signed in to an account.","Sign out","ลงชื่อออก"
"signIn","Clicking takes you to a form that allows you to sign into your lichess profile (account). This is a red-coloured button that appears at the navigation bar at the top when you are not signed in to an account, or playing anonymously. Please keep it as short as possible.","Sign in","ลงชื่อเข้า"
"newToLichess","It is next to a button that allows you to register an account on the website. The translation should be friendly and inviting; free/loose translations are recommended for this sentence. This sentence appears on the ""Sign in"" page.","New to Lichess?","มา Lichess ครั้งแรก?"
"youNeedAnAccountToDoThat","This error message appears when trying actions or going to pages that require being signed in with a user account.","You need an account to do that","คุณต้องมีบัญชีผู้ใช้เพื่อทำสิ่งนั้น"
"signUp","Clicking this allows you to register an account. Appears as a button on the ""Sign in"" page and the ""Training"" page (https://lichess.org/training) when playing unregistered (encouraging the player to register an account with Lichess). It is recommended to translate this word as a verb.","Register","ลงทะเบียน"
"computersAreNotAllowedToPlay","The text users read when creating an account. Appears in the registration (new account) form (https://lichess.org/signup).","Computers and computer-assisted players are not allowed to play. Please do not get assistance from chess engines, databases, or from other players while playing. Also note that making multiple accounts is strongly discouraged and excessive multi-accounting will lead to being banned.","ผู้เล่นที่เป็นคอมพิวเตอร์หรือใช้คอมพิวเตอร์ช่วย จะไม่ได้รับอนุญาตให้เล่น  โปรดอย่าใช้การช่วยเหลือจากตัวช่วยเล่นหมากรุก, ฐานข้อมูล หรือบุคคลอื่น ในขณะเล่น"
"games","The page displays games currently being played and has links to various other tools on the site to find out about past games on lichess, such as a search engine that queries the database of games. ""Games"" is one of the links at the top of every page, so keep it as short as possible. Links to https://lichess.org/games","Games","เกม"
"forum","It is Lichess's webforum, where users can discuss various topics, chess-related or not. These are sometimes called ""bulletin boards"". ""Forum"" is one of the links at the top of every page, so keep it as short as possible. Links to https://lichess.org/forum","Forum","ห้องอภิปราย"
"xPostedInForumY","The first %s is the player's name and the second %s is the title of the topic in the forum. By ""topic"" here we mean a discussion, sometimes called a ""thread"" in this context. Appears in the activity timeline on the left-hand side of the ""Play"" page (https://lichess.org/) after you have started following a player.","%s posted in topic %s","%s ได้โพสต์ในหัวข้อ  %s"
"latestForumPosts","A list of the most recent posts on the forum. Appears as a heading to a box near the bottom of the ""Play"" page (https://lichess.org/).","Latest forum posts","โพสต์อภิปรายล่าสุด"
"players","Some have been translating as ""[Chess] Players"". This is acceptable only if it is one word (e.g. ""Szachiści"" in Polish). Otherwise, keep just translate to ""Players"". This appears as one of the links on the navigation bar at the top of every page.  Links to https://lichess.org/people","Players","ผู้เล่น"
"minutesPerSide","This appears in all the game creation menus (e.g. ""Create a game"", ""Play with a friend"") after you have ticked ""Time control"". Below it is a slider that lets you select how many minutes each player will have on their chess clock.","Minutes per side","นาทีต่อฝ่าย"
"variant","This appears in all the game creation menus (e.g. ""Create a game"", ""Play with a friend""). Below it is a selection of variants the player can choose from, such as Standard, Chess960, or King of the Hill.","Variant","ตัวแปรกติกา"
"variants","This appears in the simul creation page (https://lichess.org/simul/new). Below it is a selection of variants the player can choose from, such as Standard, Chess960, or King of the Hill.","Variants","ตัวแปรกติกา"
"timeControl","This sentence is a heading to time controls for the game. This appears in all the game creation menus (e.g. ""Create a game"", ""Play with a friend"") that can be found on the ""Play"" page.","Time control","การควบคุมเวลา"
"realTime","Real time chess is chess played over a short period of time, using a chess clock. This is one of three time control settings in the game creation menus (e.g. ""Create a game"", ""Play with a friend"") on the ""Play"" page. Please do NOT translate literally; if your language does not have an equivalent, established term, translate to ""quick"" games or something similar.","Real time","เวลาตามจริง"
"correspondence","Correspondence chess is chess played over a long period of time, often with several days per move. This is one of three time control settings in the game creation menus (e.g. ""Create a game"", ""Play with a friend"") on the ""Play"" page. Please do NOT translate literally; if your language does not have an equivalent, established term, translate to ""long"" games or something similar.","Correspondence","ยาวนาน"
"daysPerTurn","This is a slider specifically for correspondence chess games. Appears in the game creation menus (e.g. ""Create a game"", ""Play with a friend"") when you have selected the ""Correspondence"" time control.","Days per turn","วันต่อตาเดิน"
"oneDay","Means each turn may take up to one day. This appears next to the slider for the correspondence chess time control in the game creation menus (e.g. ""Create a game"", ""Play with a friend""). Please translate ""one"" as a word (""one""), not a number (not ""1""). It also appears on the clock in correspondence chess games.","One day","หนึ่งวัน"
"nbDays","%s is maximum number of days for each turn. This appears next to the slider for the correspondence chess time control in the game creation menus (e.g. ""Create a game"", ""Play with a friend""). It also appears on the clock and information box in correspondence chess games. Please keep this sentence as short as possible.","%s days","%s วัน"
"nbHours","%s is number of hours. Used to display correspondence clocks.","%s hours","%s ชั่วโมง"
"time","The time control for the game. This appears as a column heading in the table of games you can join on the ""Play"" page (https://lichess.org/).","Time","เวลา"
"rating","The rating of the player (e.g. 1500). Appears on the lobby list on https://lichess.org/","Rating","ระดับคะแนน"
"ratingStats","Link to the rating distribution stats page (https://lichess.org/stat/rating/distribution/blitz), in the top menu, under ""Community"".","Rating stats","สถิติระดับคะแนน"
"username","The name you use to sign in, e.g. ""thibault"". Appears on the registration page (https://lichess.org/signup).","User name","ชื่อผู้ใช้"
"usernameOrEmail","The name or email you use to sign in, e.g. ""thibault"". Appears on the sign-in page.","User name or email","ชื่อผู้ใช้"
"password","This is the password you must type to sign in to your profile. Appears on the sign-in, registration, tournament creation and ""Preferences"" pages. Please keep this sentence as short as possible. Next to the sentence is a box where you can type in your password.","Password","รหัสผ่าน"
"haveAnAccount","This appears on the top-right of the registration page (https://lichess.org/signup -- must be signed out to see this). Next to it is a ""sign in"" button.","Have an account?","มีบัญชีแล้วหรือยัง?"
"changePassword","This is a link in the preferences page to a menu that allows you to change your password (https://lichess.org/account/passwd).","Change password","เปลี่ยนรหัสผ่าน"
"changeEmail","Appears as a menu item and heading on the ""Preferences"" pages (https://lichess.org/account/email).","Change email","เปลี่ยนอีเมล"
"email","Short for ""Your email address"", but please keep this sentence as short as possible. This appears above text boxes where you can type in your email, on the ""Preferences"" page.","Email","อีเมล"
"emailIsOptional","This is a help text, explaining how email works on lichess. Appears on the ""Change email"" page (https://lichess.org/account/email).","Email is optional. Lichess will use your email address to reset your password if you forget it.","อีเมลเป็นตัวเลือกซึ่ง Lichess จะใช้เพื่อการตั้งรหัสผ่านของคุณใหม่ในกรณีที่คุณลืมมัน"
"passwordReset","Appears as a heading in the link you are given after you asked for an email to reset (change) your password if you have forgotten it.","Password reset","ตั้งรหัสผ่านใหม่"
"forgotPassword","You click here if you forgot your password and want it reset. Please adopt an inviting tone to the user. Also see how other popular websites (e.g. YouTube) phrase the same question in your language. Appears on the ""Sign in"" page.","Forgot password?","ลืมรหัสผ่าน?"
"rank","This sentence is not currently used on the site, but feel free to translate it.","Rank","อันดับ"
"gamesPlayed","Before it is the number of games the player has played. For example, https://lichess.org/@/thibault/ currently reads ""2037 Games Played"". Make sure you take the number that appears before this sentence into account when preparing your translation. This sentence appears as a tab on player profiles, just above the list of games.","Games played","เกมที่ได้เล่น"
"nbGamesWithYou","%s is the number of games this player has played with you. This appears as a tab on the profile pages of people that you have played with. Try to keep it fairly short.","%s games with you","%s เกมเล่นกับคุณ"
"cancel","This is a generic word that appears in a wide variety of places and is used to cancel actions of all sorts. It is recommended to translate it according to whatever your operating system (e.g. Microsoft Windows) uses for your language.","Cancel","ยกเลิก"
