"allInformationIsPublicAndOptional","This sentence appears under the header on the page where you change your profile https://lichess.org/account/profile","All information is public and optional.","ข้อมูลทั้งหมดเป็นสาธารณะ และไม่บังคับกรอก"
"yourCityRegionOrDepartment","This text appears under the field where you write your location. You can leave out the word ""your"" if it helps you. Appears in the profile editor: https://lichess.org/account/profile","Your city, region, or province.","เมือง, ภูมิภาค, หรือจังหวัดของคุณ"
"biographyDescription","This sentence appears under the biography description box on the page where you edit your profile https://lichess.org/account/profile","Tell about you, what you like in chess, your favorite openings, games, players…","บอกเกี่ยวกับตัวคุณ, คุณชอบอะไรในหมากรุก, การเปิดเกม, เกม, หรือผู้เล่น ฯลฯ"
"maximumNbCharacters","This text appears under the biography description box to inform you the maximum length your description can have. https://lichess.org/account/profile","Maximum: %s characters.","สูงสุด: %s ตัวอักษร"
"blocks","%s is the number of players you have blocked. Consider translating to ""%s blocked players"" if you think the context is not sufficient. Appears as a heading on your list of blocked players at https://lichess.org/rel/blocks","%s blocks","กีดกันไว้ %s ราย"
"listBlockedPlayers","""List"" is used as a verb here. This is a descriptive sentence which appears when you hover the mouse over the block icon on your own profile. Clicking the icon will show you a list of players you have blocked.","List players that you have blocked","แสดงรายชื่อผู้เล่นที่คุณกีดกันไว้"
"human","Press this to play against a human player (instead of playing against the computer). Appears in the ""Create a game"" menu of the lichess mobile app: https://raw.githubusercontent.com/veloce/lichobile/1.5.x/screens/android/create-human.png. All mobile app sentences *must* be kept compact, as they need to scale to small devices.","Human","บุคคล"
"computer","Press this button to play against a computer player (instead of playing against a human being). Appears in the ""Create a game"" menu of the lichess mobile app: https://raw.githubusercontent.com/veloce/lichobile/1.5.x/screens/android/create-human.png. All mobile app sentences *must* be kept compact, as they need to scale to small devices.","Computer","คอมพิวเตอร์"
"side","Lets you select what side you want to play as (White, Black, or random). Appears in the ""Create a game"" menu of the lichess mobile app: https://raw.githubusercontent.com/veloce/lichobile/1.5.x/screens/android/create-human.png. All mobile app sentences *must* be kept compact, as they need to scale to small devices.","Side","ฝ่าย"
"clock","Lets you select what time control you want to play with. Appears in the ""Create a game"" menu of the lichess mobile app: https://raw.githubusercontent.com/veloce/lichobile/1.5.x/screens/android/create-human.png. All mobile app sentences *must* be kept compact, as they need to scale to small devices.","Clock","นาฬิกา"
"unauthorizedError","This is a generic sentence that usually appears when the player is not signed in, or when an incorrect password is entered. The sentence is only found in the lichess mobile app, and *must* be kept compact, as mobile sentences need to scale to small devices.","Access is unauthorized.","สิทธิ์เข้าถึงยังไม่ถูกต้อง"
"noInternetConnection","Descriptive sentence. Is only shown when your mobile device is lacking connectivity to the internet. The sentence is only found in the lichess mobile app, and *must* be kept compact, as mobile sentences need to scale to small devices.","No internet connection. You can still play offline from the menu.","ไม่มีการเชื่อมต่ออินเตอร์เน็ต แต่คุณสามารถเล่นออฟไลน์ได้จากเมนู"
"connectedToLichess","Notifies the player they are successfully connected to the site. This is only for mobile users, because the mobile app can also work offline. The sentence is only found in the lichess mobile app, and *must* be kept compact, as mobile sentences need to scale to small devices.","You are now connected to lichess.org","ขณะนี้คุณเชื่อมต่ออยู่กับ lichess.org"
"signedOut","Notifies the player that they have successfully signed out of their account. The sentence is only found in the lichess mobile app, and *must* be kept compact, as mobile sentences need to scale to small devices.","You have been signed out","คุณได้ลงชื่อออกแล้ว"
"loginSuccessful","Notifies the player they are successfully logged in with their lichess username. The sentence is only found in the lichess mobile app, and *must* be kept compact, as mobile sentences need to scale to small devices.","You are now signed in","ตอนนี้คุณลงชื่อเข้าแล้ว"
"playOnTheBoardOffline","""Over the board"" means playing locally, on the device, usually between two players sitting across from each other. Offline play is only available on the lichess mobile app and thus *must* be kept compact, as mobile sentences need to scale to small devices.","Over the board","เล่นกระดานเดียวกัน"
"playOfflineComputer","Press this button to play against a computer player (instead of playing against a human being). Appears in the ""Create a game"" menu of the lichess mobile app: https://raw.githubusercontent.com/veloce/lichobile/1.5.x/screens/android/create-human.png. All mobile app sentences *must* be kept compact, as they need to scale to small devices.","Computer","คอมพิวเตอร์"
"opponent","The name of your opponent. Currently appears only in the mobile app. You can see how it looks here: https://raw.githubusercontent.com/veloce/lichobile/1.5.x/screens/android/ai-menu.png","Opponent","คู่แข่ง"
"learn","One of the four menu sections. Contains links to training, openings, coordinates, and video library. ""Learn"" in this context is a verb.","Learn","เรียนรู้"
"community","One of the four menu sections. Contains links to list of players, teams, forums, and Q&A.","Community","ชุมชน"
"tools","One of the four menu sections. Contains links to board editor, analysis, import game, and advanced search.","Tools","เครื่องมือ"
"increment","Increment of the game. As increment in seconds. It appears only in mobile app in the game creation form. You can see it here: https://raw.githubusercontent.com/veloce/lichobile/1.5.x/screens/android/create-human.png","Increment","เพิ่มขึ้น"
"board","appears in mobile app on settings screen, let you choose the board theme. Just translate 'board'","Board","กระดาน"
"pieces","appears in mobile app on settings screen, let you choose the pieces theme. Just translate 'pieces'","Pieces","หมาก"
"sharePGN","Pressing this button opens native share widget to share the PGN record. PGN is short for ""Portable Game Notation""; it is the way chess moves are recorded (1. e4 e5, and so on). The sentence is only found in the lichess mobile app, and *must* be kept short, as mobile sentences need to scale to small devices.","Share PGN","แชร์ PGN"
"playOnline","only in mobile app, on side menu. It is a menu label that helps to separate visually what is online from what is offline. *Must* be short","Play online","เล่นออนไลน์"
"playOffline","only in mobile app, on side menu. It is a menu label that helps to separate visually what is online from what is offline. *Must* be short","Play offline","เล่นออฟไลน์"
"allowAnalytics","In mobile app settings, toggle to allow or not sending of anonymous app usage for statistics. Should be as short as possible.","Allow anonymous statistics","อนุญาตสถิติผู้ใช้นิรนาม"
"shareGameURL","in mobile app on the game context menu, this button opens the native share widget to send the game URL. To keep very short.","Share game URL","แชร์ URL เกม"
"error.required","Error message when a text input fields is left blank. Appears in the registration form and preferences menu (https://lichess.org/account/email).","This field is required","ช่องนี้จำเป็น"
"error.email","Error message for when the email address was typed in incorrectly. Appears in the registration form and preferences menu (https://lichess.org/account/email).","This email address is invalid","ที่อยู่อีเมลนี้ไม่ถูกต้อง"
"error.email_acceptable","Error message for when people associate a disposable email address with their account (e.g. https://www.guerrillamail.com/) -- only permanent email addresses are permitted. Appears in the registration form and preferences menu (https://lichess.org/account/email).","This email address is not acceptable","ที่อยู่อีเมลนี้ไม่ถูกยอมรับ"
"error.email_unique","Error message for when you associate an account with an email address that is already in use by another account. Appears in the registration form and preferences menu (https://lichess.org/account/email).","This email address is already taken","ที่อยู่อีเมลนี้ถูกใช้ไปแล้ว"
"blindfoldChess","Appears as a preference on the preference page. The user may choose to hide their pieces in order to emulate playing blindfold chess.","Blindfold chess (invisible pieces)","หมากรุกอำพราง (ไม่เห็นตัวหมาก)"
"moveConfirmation","Appears as a preference on the preference page. The user may choose to use an additional confirmation step when they make moves on the chess board.","Move confirmation","ยืนยันการเดิน"
"inCorrespondenceGames","Appears as a selectable option for the ""move confirmation"" setting on the preference page. The user may choose to only have an extra confirmation step for moves they make in correspondence games.","Correspondence games","เกมแบบยาวนาน"
"ifRatingIsPlusMinusX","Appears as a selectable option for the ""let other players challenge you"" option. The user may choose to only accept challenges from within a certain rating range.","If rating is ± %s","ถ้าระดับคะแนน ± %s"
"onlyFriends","Appears as a selectable option for the ""let other players challenge you"" option. The user may choose to only accept challenges from friends.","Only friends","เฉพาะเพื่อน"
"menu","Tooltip displayed when mouseover menu button viewable at the top of every lichess page.","Menu","เมนู"
"castling","Castling is a move in the game of chess involving a player's king and either of the player's original rooks. It is the only move in chess in which a player moves two pieces in the same move. Appears on board editor page (https://lichess.org/editor).","Castling","การเข้าป้อม"
"whiteCastlingKingside","The option of whether white can still castle on the kingside. Appears as a setting on board editor page (https://lichess.org/editor).","White O-O","ขาว O-O"
"whiteCastlingQueenside","The option of whether white can still castle on the queenside. Appears as a setting on board editor page (https://lichess.org/editor).","White O-O-O","ขาว O-O-O"
"blackCastlingKingside","The option of whether black can still castle on the kingside. Appears as a setting on board editor page (https://lichess.org/editor).","Black O-O","ดำ O-O"
"blackCastlingQueenside","The option of whether black can still castle on the queenside. Appears as a setting on board editor page (https://lichess.org/editor).","Black O-O-O","ดำ O-O-O"
"nbForumPosts","%s The number of times the user has posted on the forum (https://lichess.org/forum). Appears on profile pages. Example: https://lichess.org/@/thibault — Thibault has 3038 forum points as of the time of writing.","%s Forum Posts","%s โพสต์อภิปราย"
"tpTimeSpentPlaying","%s The total time the user has spent playing on Lichess. Appears on profile pages. Example: https://lichess.org/@/thibault/ has spent 15 days, 9 hours and 25 minutes playing at the time of writing.","Time spent playing: %s","เวลาที่ใช้เล่น: %s"
"watchGames","A button that allows users to watch the chess games of a particular player. Appears on profile pages. Example: Links to https://lichess.org/@/thibault/tv","Watch games","รับชมเกม"
"tpTimeSpentOnTV","%s The total time the user has spent watching Lichess TV (https://lichess.org/tv). Appears on profile pages. Example: https://lichess.org/@/thibault/ has spent 12 minutes watching at the time of writing.","Time on TV: %s","เวลาบน TV: %s"
"watch","One of the four menu sections. Contains links to Lichess TV, international events and the curated video library.","Watch","รับชม"
"internationalEvents","Real-time worldwide chess tournaments, powered by FICS. Appears as a dropdown option on the menu bar as well as on menu page. Links to https://lichess.org/watch","International events","การแข่งขันนานาชาติ"
"videoLibrary","A carefully curated library of free chess videos. Appears as a dropdown option on the menu bar as well as on menu page. Links to https://lichess.org/video","Video library","คลังวิดีโอ"
"mobileApp","Lichess' very own free and open source Android and IOS application. Appears on the footer of the menu page. Links to https://lichess.org/mobile","Mobile App","แอปมือถือ"
"webmasters","Information on how webmasters can embed Lichess features such as the daily puzzle or Lichess TV. Appears on the footer of the menu page. Links to https://lichess.org/developers","Webmasters","เว็บมาสเตอร์"
"contribute","Information on how people can contribute to Lichess whether it be through code, translation or donation. Appears on the footer of the menu page. Links to https://lichess.org/help-lichess","Contribute","เอื้อเฟื้อ"
"contact","A page detailing the ways in which one can contact Lichess. Appears on the footer of the menu page. Links to https://lichess.org/contact","Contact","ติดต่อ"
"termsOfService","","Terms of Service","ข้อกำหนดการใช้"
"sourceCode","Lichess' source code repository. Appears on the footer of the menu page. Links to https://github.com/ornicar/lila","Source Code","ซอร์สโค้ด"
"simultaneousExhibitions","Clicking this takes you to a page all about simuls on Lichess, where you can see open, running and finished simuls, as well as create your own. Appears as one of the links at the top of the navigation bar and on menu page. Links to https://lichess.org/simul","Simultaneous exhibitions","มหกรรมไซมัลเทเนียส"
"host","The person who created the simul. Appears as a column heading on https://lichess.org/simul","Host","โฮสต์"
"createdSimuls","Appears as a heading on https://lichess.org/simul under which currently running and starting simuls are listed.","Newly created simuls","ไซมัลที่สร้างใหม่"
"hostANewSimul","A button that allows players to create a new simul event. Appears on https://lichess.org/simul and links to https://lichess.org/simul/new","Host a new simul","เป็นโฮสต์ไซมัลใหม่"
"noSimulFound","A header warning when a simul event cannot be found. Displayed here https://lichess.org/simul/notfound","Simul not found","ไม่พบไซมัล"
"noSimulExplanation","When a simul event cannot be found a new page is displayed here https://lichess.org/simul/notfound notifying the user why and how to proceed.","This simultaneous exhibition does not exist.","ไม่มีมหกรรมไซมัลเทเนียสนี้"
"returnToSimulHomepage","A link to the simul homepage (https://lichess.org/simul/) displayed here https://lichess.org/simul/notfound","Return to simul homepage","กลับสู่หน้าหลักไซมัล"
"aboutSimul","A short explanation about what a simul is on the simul homepage (https://lichess.org/simul)","Simuls involve a single player facing several players at once.","ไซมัล หมายถึง ผู้เล่นเดี่ยวเล่นกับผู้เล่นหลายคนในครั้งเดียว"
"aboutSimulImage","A short caption for the Bobby Fischer image found on the simul homepage (https://lichess.org/simul) after clicking'More...'","Out of 50 opponents, Fischer won 47 games, drew 2 and lost 1.","จาก 50 คู่แข่ง, ฟิสเชอร์ ชนะ 47, เสมอ 2 และ แพ้ 1"
"aboutSimulRealLife","A short explanation about what a simul is on the simul homepage (https://lichess.org/simul) after clicking'More...'","The concept is taken from real world events. In real life, this involves the simul host moving from table to table to play a single move.","ได้ความคิดมาจากการแข่งขันระดับโลกของจริง ในเกมจริงสิ่งนี้หมายถึง โฮสต์ไซมัลจะย้ายจากโต๊ะหนึ่งไปอีกโต๊ะหนึ่ง เพื่อทำการเดินหนึ่งครั้ง"
"aboutSimulRules","A short explanation about the rules of a simul found on the simul homepage (https://lichess.org/simul) after clicking'More...'","When the simul starts, every player starts a game with the host, who gets to play the white pieces. The simul ends when all games are complete.","เมื่อไซมัลเริ่มต้น ผู้เล่นทุกคนจะเล่นเกมกับโฮสต์ผู้ซึ่งจะเล่นเป็นฝ่ายสีขาว ไซมัลจะจบเมื่อทุกเกมจบอย่างสมบูรณ์"
"aboutSimulSettings","More explanations about lichess simuls, on the simul homepage (https://lichess.org/simul).","Simuls are always casual. Rematches, takebacks and ""moretime"" are disabled.","ไซมัลจะใช้การเล่นแบบธรรมดา  การขอเล่นอีกครั้ง, การเดินใหม่, หรือ ""เพิ่มเวลา"" จะไม่อนุญาตให้ใช้"
"create","A button that finalises the creation of some event. Found, for insance, at the bottom of the create simul form page (https://lichess.org/simul/new)","Create","สร้าง"
"whenCreateSimul","A short explanation of what to expect from creating a simul. Found on the create simul form page (https://lichess.org/simul/new)","When you create a Simul, you get to play several players at once.","เมื่อคุณสร้างไซมัล คุณจะได้เล่นกับหลายผู้เล่นในครั้งเดียว"
"simulVariantsHint","Explains the variants checkboxes found on the create simul form page (https://lichess.org/simul/new)","If you select several variants, each player gets to choose which one to play.","ถ้าคุณเลือกหลายตัวแปรกติกา ผู้เล่นแต่ละคนจะเลือกได้ว่าจะเล่นอันไหน"
"simulClockHint","Explains the Fischer clock time control settings found on the create simul form page (https://lichess.org/simul/new)","Fischer Clock setup. The more players you take on, the more time you may need.","การตั้งนาฬิกาฟิสเชอร์ ยิ่งคุณเล่นกับผู้เล่นหลายคน คุณยิ่งต้องการเวลามากขึ้น"
"simulAddExtraTime","Suggests adding extra time for the simul. Found on the create simul form page (https://lichess.org/simul/new)","You may add extra time to your clock to help cope with the simul.","คุณอาจบวกเวลาพิเศษให้นาฬิกาของคุณ เพื่อช่วยคุณรับมือกับไซมัล"
"simulHostExtraTime","A setting for the simul host to add extra time. Found on the create simul form page (https://lichess.org/simul/new)","Host extra clock time","เวลานาฬิกาพิเศษโฮสต์"
"lichessTournaments","A heading on the side of the tournaments homepage (https://lichess.org/tournament) under which the official tournaments of Lichess are listed.","Lichess tournaments","ทัวร์นาเมนต์ Lichess"
"tournamentFAQ","A link to an FAQ page for Lichess tournaments. Links to https://lichess.org/tournament/help?system=arena and found on every tournament page as a small question mark.","Arena tournament FAQ","ถามตอบสนามทัวร์นาเมนต์"
"tournamentOfficial","All official (not user created) Lichess tournaments have this shown in said tournament's information box shows that appears on the top left of the screen.","Official","เป็นทางการ"
"timeBeforeTournamentStarts","Users creating new tournaments can decide when their tournament begins. Appears on the form used to create a new tournament (https://lichess.org/tournament/new)","Time before tournament starts","เวลาก่อนทัวร์นาเมนต์จะเริ่ม"
"averageCentipawnLoss","ACPL. This is one of the categories of problems discovered by the computer analysis. Appears on the right hand side of pages with analyzed games.","Average centipawn loss","เบี้ยร้อยละที่เสียโดยเฉลี่ย"
"keyboardShortcuts","A heading appearing in the bottom left side of pages with analyzed games under which are available keyboard shortcuts.","Keyboard shortcuts","ปุ่มลัดแป้นพิมพ์"
"keyMoveBackwardOrForward","Explains that the preceding keyboard shortcuts move the game backward or forward. Appears on the bottom left side of pages with analyzed games under Keyboard Shortcuts dropdown.","move backward/forward","เดินถอยหลัง/ไปหน้า"
"keyGoToStartOrEnd","Explains that the preceding keyboard shortcuts move the game to the start or end position. Appears on the bottom left side of pages with analyzed games under Keyboard Shortcuts dropdown.","go to start/end","ไปยังตอนเริ่ม/ตอนจบ"
"keyShowOrHideComments","Explains that the preceding keyboard shortcuts show or hide comments. Appears on the bottom left side of pages with analyzed games under Keyboard Shortcuts dropdown.","show/hide comments","แสดง/ซ่อนความคิดเห็น"
"keyEnterOrExitVariation","Explains that the preceding keyboard shortcuts enter or exit variations. Appears on the bottom left side of pages with analyzed games under Keyboard Shortcuts dropdown.","enter/exit variation","เข้าสู่/ออกจากตัวแปรกติกา"
"keyYouCanDrawArrowsCirclesAndScrollToMove","Explains that using Shift+Click or right-clicking draws arrows and circles on the game board and that one can use the mouse scroll to play through game. Appears on the bottom left side of pages with analyzed games under Keyboard Shortcuts dropdown.","Press shift+click or right-click to draw circles and arrows on the board. You can also scroll over the board to move in the game.","กด Shift+คลิก หรือ คลิกขวา เพื่อวาดวงกลมและลูกศรบนกระดาน คุณยังสามารถหมุนเลื่อนบนกระดานเพื่อเดินเกมได้ด้วย"
"newTournament","The title of the page where you can create a new tournament, https://lichess.org/tournament/new","New tournament","ทัวร์นาเมนต์ใหม่"
"tournamentHomeTitle","The title of the tournaments home page (https://lichess.org/tournament) which is used for search engines.","Chess tournament featuring various time controls and variants","ทัวร์นาเมนต์หมากรุกซึ่งมีการควบคุมเวลาและตัวแปรกติกาต่างๆ"
