"timeOut","This is the condition of a game ending by time-out, which is when one player's clock runs out of time. This sentence appears in the list of games in the profile page and in the game view.","Time out","หมดเวลา"
"drawOfferSent","Informs that a draw offer has been sent. This is a system message that appears in the chat box.","Draw offer sent","ข้อเสนอเพื่อการเสมอ ถูกส่ง"
"drawOfferDeclined","Informs that the draw offer has been declined. This is a system message that appears in the chat box.","Draw offer declined","ข้อเสนอเพื่อการเสมอ ถูกปฏิเสธ"
"drawOfferAccepted","Informs that a draw offer has been accepted. This is a system message that appears in the chat box. This ends the game.","Draw offer accepted","ข้อเสนอเพื่อการเสมอ ถูกยอมรับ"
"drawOfferCanceled","Informs that the player that sent the draw offer canceled it before his/her opponent responded. This is a system message that appears in the chat box","Draw offer canceled","ข้อเสนอเพื่อการเสมอ ถูกยกเลิก"
"whiteOffersDraw","Informs that the White player wants to draw the game. This is a system message that appears in the chat box.","White offers draw","ขาวเสนอว่าเสมอ"
"blackOffersDraw","Informs that the Black player wants to draw the game. This is a system message that appears in the chat box.","Black offers draw","ดำเสนอว่าเสมอ"
"whiteDeclinesDraw","Informs that the White player declined Black's offer to draw the game. This is a system message that appears in the chat box.","White declines draw","ขาวปฏิเสธการเสมอ"
"blackDeclinesDraw","Informs that the Black player declined White's offer to draw the game. This is a system message that appears in the chat box.","Black declines draw","ดำปฏิเสธการเสมอ"
"yourOpponentOffersADraw","This sentence appears in the right-hand side box while playing a game after your opponent offers you a draw.","Your opponent offers a draw","คู่แข่งของคุณได้เสนอว่าเสมอกัน"
"accept","Clicking this will accept your opponent's offer and let the action the opponent requested happen. A generic word that appears as a button when your opponent sends an offer to do something (such as a takeback or ending the game by draw). Please translate as a verb if possible.","Accept","ยอมรับ"
"decline","Clicking this will reject your opponent's offer. A generic word that appears as a button when your opponent sends an offer to do something (such as a takeback or ending the game by draw). Please translate as a verb if possible.","Decline","ปฏิเสธ"
"playingRightNow","This sentence indicates that the game you are looking at is playing right now. Appears on the ""Tournaments"" page (https://lichess.org/tournament) if any tournaments are currently being played, and also on the pages of individual games.","Playing right now","กำลังเล่นในขณะนี้"
"finished","This is for tournaments. It means the tournament is over. Appears on individual tournament pages (e.g. https://lichess.org/tournament/67hj23c2) and also on the ""Tournaments"" page (https://lichess.org/tournament) to denote finished tournaments. Translate as plural; another sentence will be added at some point for individual tournament pages.","Finished","จบแล้ว"
"abortGame","Clicking this aborts the game. This means that no points are won or lost. You can only perform this action until the second move of the game. It is NOT a resignation (which has a different sentence). Appears in the right-hand side box on the page of a game you are playing.","Abort game","ยกเลิกเกม"
"gameAborted","Indicates that the game has been aborted. Appears in the left and right hand side boxes, as well as in the games list, for aborted games. Note that aborted games are removed from the database after 48 hours.","Game aborted","เกมถูกยกเลิก"
"standard","""Standard"" here means ""not a variant"". Selecting this means you play international standard chess, not Chess960 or another variant. Appears in the game creation menus (e.g. ""Create a game"", ""Play with a friend"") on the ""Play"" page.","Standard","มาตรฐาน"
"unlimited","This is short for ""Unlimited time"". It describes games that have no time controls and can therefore run for an infinite amount of time. This sentence appears in many locations, including game pages and the ""Create a game"" menu. Please keep this sentence as short as possible.","Unlimited","ไม่จำกัด"
"mode","""Mode"" here is in the context of filtering between Casual (casual games are not rated) and Rated games. The sentence appears in the ""Filter games"" menu, which is just above the list of games on the ""Play"" page (https://lichess.org/).","Mode","แบบการเล่น"
"casual","""Casual"" in this context means the game is unrated; players will not gain or lose points. Has been translated to ""Friendly"" (after the football term) and simply ""Unrated"" in some languages. Be creative. The sentence appears in the ""Filter games"" menu, which can be accessed through the ""Play"" page (https://lichess.org).","Casual","ธรรมดา"
"rated","""Rated"" means that the outcome of the game will result in a gain or loss of rating points for either players. This sentence appears in a variety of places, including the pages of individual games (which are rated) and the ""Filter games"" page.","Rated","คิดคะแนน"
"thisGameIsRated","""Rated"" means that the outcome of the game will result in a gain or loss of rating points for either players. This sentence appears in profile page listings of games and games lists (e.g. https://lichess.org/games/all).","This game is rated","เกมนี้ถูกคิดคะแนน"
"rematch","Translated as a verb if possible. This is a button that appears at the end of a game in the right hand side box. Clicking it sends a rematch offer.","Rematch","เล่นอีกครั้ง"
"rematchOfferSent","Informs you that your offer of a rematch has been sent to your opponent. This is a system message that appears in the chat box, and also in the right-hand side box.","Rematch offer sent","ข้อเสนอเพื่อเล่นอีกครั้ง ถูกส่ง"
"rematchOfferAccepted","Informs that the rematch offer was accepted. This is a system message that appears in the chat box.","Rematch offer accepted","ข้อเสนอเพื่อเล่นอีกครั้ง ถูกยอมรับ"
"rematchOfferCanceled","Informs that the rematch offer a player sent was canceled.This is a system message that appears in the chat box.","Rematch offer canceled","ข้อเสนอเพื่อเล่นอีกครั้ง ถูกยกเลิก"
"rematchOfferDeclined","Informs that the rematch offer a player sent was declined.This is a system message that appears in the chat box.","Rematch offer declined","ข้อเสนอเพื่อเล่นอีกครั้ง ถูกปฎิเสธ"
"cancelRematchOffer","Clicking this cancels the rematch you offered. Obviously, this button appears after you have sent a rematch offer.","Cancel rematch offer","ยกเลิกการขอเล่นอีกครั้ง"
"viewRematch","A button that appears on game pages if the two players had a rematch. Example: https://lichess.org/rc7l3n66/black","View rematch","ดูการเล่นอีกครั้ง"
"play","One of the four menu sections. Contains links to game creation, tournaments, simuls, and lichess TV. ""Play"" in this context is a verb.","Play","เล่น"
"inbox","This is in the title for the ""Inbox"" page (https://lichess.org/inbox) that you can go to by clicking the mail link at the top when you are signed in. The translation should match whatever is used for popular email clients such as GMail and Outlook in your language.","Inbox","กล่องเข้า"
"chatRoom","The chat function for one-to-one chat. A box on the left-hand side on games pages. Appears only in games you are in, not games you are spectating.","Chat room","กรอบแชท"
"spectatorRoom","The chat room for spectators. Appears in a box to the left-hand side on analysis pages, as well as games pages while the game is playing. Example: https://lichess.org/vyvcbk8s","Spectator room","กรอบผู้สังเกตการณ์"
"composeMessage","Another word for this could be ""Create message"". This is a link on the left-hand side of https://lichess.org/inbox. Please follow the standard set by popular email clients such as GMail or Outlook in translating this sentence.","Compose message","เขียนข้อความ"
"noNewMessages","This is the text that appears when you mouseover the mail icon at the top, but have no new messages to read.","No new messages","ไม่มีข้อความใหม่"
"subject","Next to this is the field where you put in a few words about the subject, or topic, of your message. It appears on the page on which you can compose a new message. (https://lichess.org/inbox/new)","Subject","หัวข้อ"
"recipient","Next to this is a field where you can input the name of the player that receives this message.","Recipient","ผู้รับ"
"send","This is the button you use to send messages in the compose message page. (https://lichess.org/inbox/new)","Send","ส่ง"
"incrementInSeconds","Increment in this context means how many seconds are added every time you make a move. So if you set time to 5 minutes and increment in seconds to 2, it would be a ""5+2"" game. This means that each player would have 5 minutes on the clock, and every time the player makes a move, 2 seconds are added. Appears in the game creation menus (e.g. ""Create a game"", ""Play with a friend"") on the ""Play"" page with the ""Clock"" time control.","Increment in seconds","วินาทีที่บวกเพิ่ม"
"freeOnlineChess","This sentence appears in the title of every page e.g. ""lichess  • Free Online Chess"" on the ""Play"" page as it appears in the English version. This means it shows up as the title of browser windows and tabs. Technical information: by title here we are literally referring to the HTML <title> tag that carries this.","Free Online Chess","หมากรุกสากลออนไลน์ฟรี"
"spectators","""Spectators:"" precedes a list of spectators. It appears just below the chat box on any game that is being spectated, such as the games on Lichess TV (https://lichess.org/tv).","Spectators:","ผู้สังเกตการณ์:"
"nbWins","This appears as a clickable tab in player profiles. The %s is the number of games won.","%s wins","ชนะ %s"
"nbLosses","This appears as a clickable tab in player profiles. The %s is the number of games lost.","%s losses","แพ้ %s"
"nbDraws","This appears as a clickable tab in player profiles. The %s is the number of games that ended in draw.","%s draws","เสมอ %s"
"exportGames","This function lets you download a table of all your games in CSV format. The button in question is a folder with an arrow pointing downwards overlayed on it. It can be seen at profile pages, e.g. https://lichess.org/@/thibault.","Export games","ส่งออกเกม"
"ratingRange","Below this is a slider that lets you choose the accepted player ratings. The sentence appears in the ""Create a game"" (https://lichess.org/setup/hook) and ""Filter games"" menus. Please do NOT translate ""rating"" to ""Elo"", because lichess has been using the superior Glicko-2 rating system since late 2013.","Rating range","ช่วงระดับคะแนน"
"giveNbSeconds","%s here is the number of seconds, usually 15. This is the mouseover text of the ""+"" button that appears next to players' names in timed matches. Clicking it adds ""%s"" seconds to the player's clock.","Give %s seconds","ให้ %s วินาที"
"thisPlayerUsesChessComputerAssistance","Appears in a red box on player profiles that have been marked as cheater accounts by the site moderators. An example is https://lichess.org/@/ko1.","This player uses chess computer assistance","ผู้เล่นรายนี้ใช้การช่วยเหลือจากคอมพิวเตอร์หมากรุก"
"thisPlayerArtificiallyIncreasesTheirRating","Appears as a red box on the profiles of players that have been trying to cheat the rating system. An example is https://lichess.org/@/GrandMasterGnel1.","This player artificially increases/decreases their rating","ผู้เล่นรายนี้เพิ่ม/ลดระดับคะแนนตัวเองโดยทุจริต"
"openingExplorer","","Opening explorer & tablebase","ตัวสำรวจการเปิดเกม"
"takeback","This is an action you can take in-game that undoes a move. Clicking it sends an offer to your opponent. Appears in the box on right right-hand side. Translate freely, but keep it short. For instance, this has been translated to ""Cancel move"" in several languages.","Takeback","เดินใหม่"
"proposeATakeback","The mouseover text of ""Takeback"". See its description for details.","Propose a takeback","ขอเดินใหม่"
"takebackPropositionSent","Informs the player that a takeback proposition has been sent. This is a system message that appears in the chat box.","Takeback proposition sent","การขอเดินใหม่ ถูกส่ง"
"takebackPropositionDeclined","Informs the player that the takeback proposition was declined. This is a system message that appears in the chat box.","Takeback proposition declined","การขอเดินใหม่ ถูกปฏิเสธ"
"takebackPropositionAccepted","Informs the player that a takeback proposition was accepted. This is a system message that appears in the chat box.","Takeback proposition accepted","การขอเดินใหม่ ถูกยอมรับ"
"takebackPropositionCanceled","Informs the player that a takeback proposition was canceled. This is a system message that appears in the chat box.","Takeback proposition canceled","การขอเดินใหม่ ถูกยกเลิก"
"yourOpponentProposesATakeback","Appears on the right-hand side box while playing a game. Below it are two buttons that allow you to either accept or decline the takeback proposal.","Your opponent proposes a takeback","คู่แข่งของคุณขอเดินใหม่"
"bookmarkThisGame","The mouseover text of the bookmark button (a star-shaped symbol — ★). Appears on the pages of individual games. Example: https://lichess.org/vyvcbk8s","Bookmark this game","หมายเกมนี้ไว้"
"search","This is the placeholder text (greyed-out text that disappears when you click) for the search box on the forum page (https://lichess.org/forum). Should be translated as a verb if possible. Do not make it too long because it may not fit in the box.","Search","ค้นหา"
"advancedSearch","A powerful search engine that searches games in the database. Appears as a heading on the advanced search function's page, in the ""Games"" pages. Should be translated as a noun. Link: https://lichess.org/games/search","Advanced search","ค้นหาเชิงลึก"
"tournament","Clicking this takes you to the page of the tournament. Appears on the lists of games on player profiles, for games that were played as part of a tournament on Lichess.","Tournament","ทัวร์นาเมนต์"
"tournaments","Clicking this takes you to a page all about tournaments on lichess, where you can see open, running and finished tournaments, as well as create your own. Appears as one of the links at the top of the navigation bar. Links to https://lichess.org/tournament","Tournaments","ทัวร์นาเมนต์"
"tournamentPoints","The number of points the player has gained in tournament games. Could be translated as ""points from tournaments"", but please keep it as short as possible. Appears on profile pages. Example: https://lichess.org/@/thibault — Thibault has 40 tournament points as of the time of writing.","Tournament points","แต้มทัวร์นาเมนต์"
"viewTournament","Clicking this button takes you to the tournament overview page. Can also be translated to ""Watch tournament"" (watch being a verb). Appears when you are watching a game that is part of a tournament. This button only appears when watching a tournament game when the tournament is still running.","View tournament","ดูทัวร์นาเมนต์"
"backToTournament","","Back to tournament","กลับสู่ทัวร์นาเมนต์"
"backToGame","","Back to game","กลับสู่เกม"
"freeOnlineChessGamePlayChessNowInACleanInterfaceNoRegistrationNoAdsNoPluginRequiredPlayChessWithComputerFriendsOrRandomOpponents","This is what search engines (like Google, Baidu or Yandex) see when Lichess.org appears as a search result. Keep it as short as possible and make Lichess sound good!","Free online Chess server. Play Chess now in a clean interface. No registration, no ads, no plugin required. Play Chess with the computer, friends or random opponents.","เกมหมากรุกสากลออนไลน์ฟรี เล่นได้ทันทีในรูปลักษณ์ที่สะอาดตา โดยไม่จำเป็นต้องลงทะเบียน, ไม่มีโฆษณา, ไม่ต้องการปลั๊กอิน, เล่นหมากรุกกับคอมพิวเตอร์หรือเพื่อน หรือสุ่มคู่แข่งก็ได้"
"teams","Teams on lichess are groups of people with their own forum boards and chat channels. Appears at the top of every page on lichess.","Teams","ทีม"
"nbMembers","%s is the number of members. Appears on the top-right hand side on a team's page (e.g. https://lichess.org/team/linux).","%s members","%s สมาชิก"
"allTeams","A list of all teams on lichess. Links to https://lichess.org/team. Appears as a tab in the ""Teams"" page.","All teams","ทีมทั้งหมด"
"newTeam","Clicking this takes you to a form for creating a new team. Links to https://lichess.org/team/new. Appears as a tab on the ""Teams"" pages.","New team","ทีมใหม่"
"myTeams","A list of the teams you are a member of. Links to: https://lichess.org/team/me. Appears as a tab in the ""Teams"" pages after you have joined a team.","My teams","ทีมของฉัน"
"noTeamFound","Appears when you are not a member of any team on https://lichess.org/team/me.","No team found","ไม่พบทีมใด"
"joinTeam","Clicking this button makes you join the team you are looking at. Appears on the pages of teams (such as https://lichess.org/team/linux).","Join team","เข้าร่วมทีม"
"quitTeam","Clicking this button makes you leave the team. Appears on the pages of teams (such as https://lichess.org/team/linux).","Leave team","ออกจากทีม"
"anyoneCanJoin","This is the joining policy of a team that has no application or invitation process; ""free for all"" means anyone can join it, without an application process of any sort.","Free for all","รับทุกคน"
"aConfirmationIsRequiredToJoin","Means that the team leader must confirm every player's application to join the team. Appears as an option on the new team creation page (https://lichess.org/team/new).","A confirmation is required to join","ต้องได้รับอนุมัติก่อนเข้าร่วม"
"joiningPolicy","This determines how players can join the team: by application or without restrictions. Appears on the new team creation page (https://lichess.org/team/new).","Joining policy","นโยบายการเข้าร่วม"
"teamLeader","Shows who the leader of the team is (usually its creator). Appears on team pages. Example: https://lichess.org/team/linux — ""untitled"" is the leader of the team.","Team leader","ผู้นำทีม"
"teamBestPlayers","This is for teams. It is a listing of the best players in the team. It appears on the left-hand side of any team's page. Example https://lichess.org/team/saloon","Best players","ผู้เล่นที่ดีที่สุด"
"teamRecentMembers","This is for teams. It is a listing of all players in the team sorted by who joined most recently. It appears on the left-hand side of any team's page (e.g. https://lichess.org/team/saloon).","Recent members","สมาชิกล่าสุดของทีม"
"xJoinedTeamY","The first %s is the name of the player, and the second %s is the team the player joined. Appears in the activity timeline on the left-hand side of the ""Play"" page (https://lichess.org/) after you have started following a player.","%s joined team %s","%s ได้เข้าร่วมทีม %s"
"xCreatedTeamY","The first %s is the name of the player, and the second %s is the team the player created. Appears in the activity timeline on the left-hand side of the ""Play"" page (https://lichess.org/) after you have started following a player.","%s created team %s","%s ได้สร้างทีม %s"
"averageElo","This is the mean average rating of all players in the team. Appears on the information box on team pages. Example: https://lichess.org/team/linux","Average rating","ระดับคะแนนเฉลี่ย"
"location","This is before an input box that lets you write where you are located (a city, town, or whatever you want to write in it). Appears in the ""Edit profile"" page (https://lichess.org/account/profile).","Location","ที่ตั้ง"
"settings","Appears in the profile dropdown on the top-right of every page, and also as a heading. Please keep it short. Links to the settings page: https://lichess.org/account/preferences","Settings","การตั้งค่า"
"filterGames","Clicking this opens a menu that lets you define criteria by which you can filter games in the game list. This appears above and to the right of the game list on the ""Play"" page (https://lichess.org/). Note that ""filter"" does not necessarily mean ""reduce"". It is recommended to translate this as search engines such as Google Search, Yandex or Baidu do.","Filter games","กรองเกม"
"reset","Clicking it resets all options back to their defaults. Appears in the ""Filter games"" sub-menu and your profile configuration (https://lichess.org/account/profile).","Reset","คืนค่าเดิม"
"apply","","Submit","ใช้งาน"
"leaderboard","A table of the best players on Lichess. Appears on the ""Players"" page (https://lichess.org/people). Could be translated as ""Score table"" or even ""Best players"" (though it is recommended to avoid this) if your language has no equivalent.","Leaderboard","กระดานผู้นำ"
"pasteTheFenStringHere","This is the placeholder text (greyed-out text that disappears when you click)  for FEN pasting, so you can play a game from a certain position against the computer. Appears in the ""Play with the computer"" menu (https://lichess.org/setup/ai).","Paste the FEN text here","วางสตริง FEN ที่นี่"
"pasteThePgnStringHere","This is the placeholder text (greyed-out text that disappears when you click)  for importing games stored in PGN files. Appears in the ""Import game"" menu (https://lichess.org/paste).","Paste the PGN text here","วางสตริง PGN ที่นี่"
"fromPosition","""From position"" means the game was started from a board set up in a non-standard way. Typically used to continue games. Appears on the pages of games started from position, as well as games lists on player profiles. Example: https://lichess.org/JHFiNdy2/black","From position","จากตำแหน่ง"
"continueFromHere","Clicking this lets you continue the game from that position against the AI, or a friend. Appears as a button with two crossed swords on it, just below the board on game pages. Example: https://lichess.org/vyvcbk8s — click on any move, then click the ""Continue from here"" button.","Continue from here","เล่นต่อจากที่นี่"
"importGame","This form lets you paste a PGN (Portable Game Notation), which imports the game into lichess. Links to https://lichess.org/paste. Appears as a tab in the ""Games"" pages.","Import game","นำเข้าเกม"
"nbImportedGames","%s is the number of games imported into the Lichess database using the ""Import games"" tool. Links to https://lichess.org/games/imported and is found on the left hand side of the ""Games"" pages.","%s Imported games","%s เกมที่ถูกนำเข้า"
"thisIsAChessCaptcha","A ""CAPTCHA"" is, in short, a test to see if the user is human or a bot. You have probably comes across them before; they usually involve putting in a word or answering a question that only a human would know the answer to. CAPTCHAs appear before registering and when posting on the forum.","This is a chess CAPTCHA.","นี่คือปริศนาหมากรุก"
